Cozi,https://emerald.puzzlepirates.com/yoweb/pirate.wm?classic=false&target=cozi,http://emerald.puzzlepirates.com/media/emerald/portraits/acf/658afc119e679628d07dd54fdc53b.jpg,Senior Officer,Portrait Painter,Euthanasia,Lady,No Strings Attached,Lieutenant,Barbary Island Navy,Ibis,7,Forbidden Fruits on Kasidim Island | Sanctuary for Sin on Kasidim Island | Dinosaur Court on Arakoua Island | K TWO on Arakoua Island | Balls Mafia on Barbary Island | Altered Reality on Kasidim Island | Buffalo Trace on Barbary Island,7,Bang from Downtown on Blackthorpe Island | Pacts on Papyrus and Parchment on Arakoua Island | Gentleman's Quarterly on Barbary Island | Chair Witch Project on Barbary Island | Ironically on Barbary Island | The Unions Alehouse on Barbary Island | Ball Busters on Barbary Island,5,Cozi's Apothecary Stall on Greenwich Island | Cozi's Distilling Stall on Blackthorpe Island | Cozi's Tailoring Stall on Admiral Island | Cozi's Furnishing Stall on Greenwich Island | Quap's Furnishing Stall on Greenwich Island,14,Shadow Cabin on Barbary Island | Blackgate on Barbary Island | Krypton Kottage on Barbary Island | Gardens of Babylon on Kasidim Island | Villa of the Damned on Aimuari Island | Guardians of the Gallery on Barbary Island | Sidekick Shacks on Barbary Island | Caddyshack on Admiral Island | Bungalow Bill on Admiral Island | King Kottage on Admiral Island | Gardens of Babylon on Kasidim Island | Jonestown Houses on Aimuari Island | Villayria on Barbary Island | Villa Las Vegas on Admiral Island,1,Quapozi,Established,Renowned,Eminent,Aspiring,Crafting,Piracy,Piracy,Crafting,Piracy,Crafting,Carousing,Crafting,Piracy,Carousing,Piracy,Piracy,Carousing,Piracy,Piracy,Piracy,Crafting,Carousing,Piracy,Carousing,Piracy,Crafting,Solid,Weighty,Weighty,Solid,Weighty,Broad,Neophyte,Broad,Solid,Solid,Solid,Solid,Illustrious,Broad,Narrow,Weighty,Novice,Solid,Weighty,Narrow,Paragon,Novice,Distinguished,Renowned,Respected,Master,Distinguished,Proficient,Proficient,Distinguished,Proficient,Ultimate,Respected,Distinguished,Proficient,Proficient,Master,Respected,Able,Renowned,Respected,Proficient,Distinguished,Able
Ekzo,https://emerald.puzzlepirates.com/yoweb/pirate.wm?classic=false&target=ekzo,http://emerald.puzzlepirates.com/media/emerald/portraits/c58/6a6fc088cf7a17e5e3b36c65efca4.jpg,Senior Officer,Parrot Postmaster,Euthanasia,Lord,No Strings Attached,Admiral,Barbary Island Navy,Ibis,3,Tora the Explorer on Gauntlet Island | Fort Grievous on Gauntlet Island | Crazy Potions on Barbary Island,1,Molten Metals on Caravanserai Island,0,,2,Manor of Steel on Barbary Island | Guardians of the Gallery on Barbary Island,2,Maybnot | Yourluckyday,Noted,Celebrated,Established,Aspiring,Crafting,Piracy,Piracy,Crafting,Piracy,Crafting,Carousing,Crafting,Piracy,Carousing,Piracy,Piracy,Carousing,Piracy,Piracy,Piracy,Crafting,Carousing,Piracy,Carousing,Piracy,Crafting,Solid,Solid,Expert,Solid,Paragon,Solid,Narrow,Solid,Paragon,Broad,Solid,Solid,Weighty,Solid,Narrow,Weighty,Solid,Narrow,Paragon,Neophyte,Weighty,Broad,Grand-Master,Grand-Master,Legendary,Master,Grand-Master,Proficient,Respected,Master,Renowned,Grand-Master,Grand-Master,Respected,Legendary,Grand-Master,Master,Legendary,Master,Respected,Ultimate,Proficient,Legendary,Respected
Obaider,https://emerald.puzzlepirates.com/yoweb/pirate.wm?classic=false&target=obaider,http://emerald.puzzlepirates.com/media/emerald/portraits/19e/64705a2bed47f8e3c74536ba07395.jpg,Captain,Monster Hunter,PALACTION,Lord,No Strings Attached,Chief Petty Officer,Admiral Island Navy,Gull,0,,1,I'm a LumberJacket and I'm OK on Bowditch Island,0,,11,Caddyshack on Admiral Island | Pine Boxes on Aimuari Island | Death Row on Aimuari Island | Only a Manor of Time on Aimuari Island | Cabin Fever on Admiral Island | Cabin Fever on Admiral Island | Bedside Manors on Admiral Island | Bedside Manors on Admiral Island | Castle Arrrrrrrrrrggghh on Bowditch Island | Guardians of the Gallery on Barbary Island | Guardians of the Gallery on Admiral Island,1,Delores,Obscure,Obscure,Renowned,Aspiring,Crafting,Piracy,Piracy,Crafting,Piracy,Crafting,Carousing,Crafting,Piracy,Carousing,Piracy,Piracy,Carousing,Piracy,Piracy,Piracy,Crafting,Carousing,Piracy,Carousing,Piracy,Crafting,Solid,Weighty,Expert,Neophyte,Solid,Neophyte,Apprentice,Weighty,Weighty,Narrow,Solid,Solid,Illustrious,Solid,Broad,Solid,Broad,Neophyte,Weighty,Broad,Illustrious,Solid,Distinguished,Grand-Master,Respected,Able,Proficient,Able,Distinguished,Grand-Master,Proficient,Master,Proficient,Distinguished,Able,Distinguished,Respected,Respected,Proficient,Proficient,Proficient,Respected,Distinguished,Renowned
Senga,https://emerald.puzzlepirates.com/yoweb/pirate.wm?classic=false&target=senga,http://emerald.puzzlepirates.com/media/emerald/portraits/79d/42bf63a26e94ebaffffbeb5ecc7e1.jpg,Captain,Bilge Rat,Hardcore Sea Ravers,Queen,Symonds Says,Admiral,Basset Island Navy,Gull,7,Ten Things I Crate About You on Admiral Island | Toilet Paper Balls on Barbary Island | Rums on Bowditch Island | Brassy Balls on Basset Island | Due or Dye on Admiral Island | Ninny Knickers on Admiral Island | Fort Influential on Basset Island,11,Red Red Rum on Caravanserai Island | Roadside Remedies on Scrimshaw Island | Iron Heart on Caravanserai Island | Wicked Wench on Cryo Island | Elixir of Love on Caravanserai Island | Frig on a Lease on Caravanserai Island | Naughty Balls on Aimuari Island | Naughty Shots on Aimuari Island | Timely Fashion on Greenwich Island | The Great White North on Cryo Island | Calm Seas Blacksmith on Caravanserai Island,3,Banishdemons's Ironworking Stall on The Lowland Hundred | Cazl's Shipbuilding Stall on Isle of Kent | Banishdemons's Distilling Stall on The Lowland Hundred,22,Caddyshack on Admiral Island | Milkshack on Wensleydale | Homestead Hut on Lincoln Island | Riemann Slums on Descartes Isle | Rho House on Descartes Isle | Riemann Slums on Descartes Isle | Love Shack on Caravanserai Island | Love Shack on Caravanserai Island | Shack eel Oh Kneel on Blackthorpe Island | Caddyshack on Admiral Island | Stab In Cabin on Aimuari Island | Cypress Cabins on Alkaid Island | King Kottage on Admiral Island | Row Me Daddy on Admiral Island | Bringing Town the House on Admiral Island | Bedside Manors on Admiral Island | Only a Manor of Time on Aimuari Island | The Great Estate on Admiral Island | The Great Estate on Admiral Island | Dream On on Caravanserai Island | Guardians of the Gallery on Admiral Island | Guardians of the Gallery on Admiral Island,1,Robee,Noted,Noted,Established,Aspiring,Crafting,Piracy,Piracy,Crafting,Piracy,Crafting,Carousing,Crafting,Piracy,Carousing,Piracy,Piracy,Carousing,Piracy,Piracy,Piracy,Crafting,Carousing,Piracy,Carousing,Piracy,Crafting,Sublime,Illustrious,Exalted,Paragon,Exalted,Illustrious,Solid,Illustrious,Illustrious,Solid,Sublime,Solid,Illustrious,Exalted,Broad,Paragon,Sublime,Narrow,Solid,Weighty,Paragon,Expert,Master,Distinguished,Proficient,Distinguished,Proficient,Proficient,Able,Renowned,Able,Grand-Master,Distinguished,Distinguished,Legendary,Distinguished,Able,Proficient,Proficient,Distinguished,Able,Proficient,Legendary,Respected
Alitar,https://emerald.puzzlepirates.com/yoweb/pirate.wm?classic=false&target=alitar,http://emerald.puzzlepirates.com/media/emerald/portraits/6a1/6f2f40c2e445ef13b10d6d1a89d76.jpg,Captain,,Gondolin,Prince,Symonds Says,Lieutenant,Aimuari Island Navy,Orion,1,Harland Ships on Aimuari Island,2,Fabric Fix on Aimuari Island | Brassy Balls on Basset Island,1,Cupcakie's Ironworking Stall on Chachapoya Island,4,Pine Boxes on Aimuari Island | Only a Manor of Time on Aimuari Island | Mayfair Mansions on Pukru Island | Tomb of the Hallowed Soul on Aimuari Island,0,,Aspiring,Aspiring,Aspiring,Aspiring,Crafting,Piracy,Piracy,Crafting,Piracy,Crafting,Carousing,Crafting,Piracy,Carousing,Piracy,Piracy,Carousing,Piracy,Piracy,Piracy,Crafting,Carousing,Piracy,Carousing,Piracy,Crafting,Novice,Weighty,Weighty,Broad,Weighty,Novice,Novice,Broad,Paragon,Narrow,Paragon,Narrow,Solid,Illustrious,Narrow,Narrow,Expert,Broad,Broad,Novice,Expert,Broad,Able,Legendary,Respected,Distinguished,Distinguished,Able,Able,Renowned,Master,Respected,Grand-Master,Proficient,Distinguished,Respected,Proficient,Proficient,Renowned,Master,Master,Proficient,Master,Master
Cazl,https://emerald.puzzlepirates.com/yoweb/pirate.wm?classic=false&target=cazl,http://emerald.puzzlepirates.com/media/emerald/portraits/62e/3341689a65555a8321698db2877c4.jpg,Captain,Siren,Ult naughty ones,Princess,Symonds Says,Admiral,Aimuari Island Navy,Orion,2,Naughty Balls on Aimuari Island | Naughty Shots on Aimuari Island,8,Ten Things I Crate About You on Admiral Island | Toilet Paper Balls on Barbary Island | Brassy Balls on Basset Island | Wicked Wench on Cryo Island | Due or Dye on Admiral Island | Ninny Knickers on Admiral Island | Fort Influential on Basset Island | The Great White North on Cryo Island,1,Cazl's Shipbuilding Stall on Isle of Kent,20,Caddyshack on Admiral Island | Shack Macaque on Alkaid Island | Adobe Abode on Chachapoya Island | Cabin Fever on Admiral Island | Cypress Cabins on Alkaid Island | Bungalow Bill on Admiral Island | Mayfair Mansions on Pukru Island | Me So Homey on Armstrong Island | Live Organ Townhouses on Bowditch Island | Emu-ving on Up on Quetzal Island | Bringing Town the House on Admiral Island | Only a Manor of Time on Aimuari Island | Villa of the Damned on Aimuari Island | Dead Mansion Walking on Aimuari Island | Stab In Cabin on Aimuari Island | King Kottage on Admiral Island | Emu-ving on Up on Quetzal Island | Bringing Town the House on Admiral Island | Bedside Manors on Admiral Island | The Great Estate on Admiral Island,2,Rilee | Snakegirly,Rumored,Illustrious,Renowned,Aspiring,Crafting,Piracy,Piracy,Crafting,Piracy,Crafting,Carousing,Crafting,Piracy,Carousing,Piracy,Piracy,Carousing,Piracy,Piracy,Piracy,Crafting,Carousing,Piracy,Carousing,Piracy,Crafting,Solid,Neophyte,Illustrious,Illustrious,Transcendent,Weighty,Novice,Paragon,Broad,Novice,Neophyte,Neophyte,Neophyte,Exalted,Narrow,Expert,Paragon,Novice,Broad,Novice,Sublime,Expert,Proficient,Proficient,Proficient,Distinguished,Respected,Proficient,Respected,Respected,Respected,Able,Proficient,Proficient,Proficient,Proficient,Proficient,Proficient,Able,Able,Respected,Proficient,Distinguished,Distinguished
Eltaro,https://emerald.puzzlepirates.com/yoweb/pirate.wm?classic=false&target=eltaro,http://emerald.puzzlepirates.com/media/emerald/portraits/37a/0ea0f2513b30b1214bcd8ad398c44.jpg,Senior Officer,Counselor,Hardcore Sea Ravers,Prince,Symonds Says,Admiral,Admiral Island Navy,Gull,3,Roadside Remedies on Scrimshaw Island | The Great White North on Cryo Island | Wicked Wench on Cryo Island,3,Ninny Knickers on Admiral Island | Fort Influential on Basset Island | Brassy Balls on Basset Island,3,Eltaro's Apothecary Stall on Bowditch Island | Eltaro's Apothecary Stall on Wensleydale | Eltaro's Apothecary Stall on Admiral Island,6,Milkshack on Wensleydale | Bedside Manors on Admiral Island | Villa Las Vegas on Admiral Island | King Kottage on Admiral Island | Dead Mansion Walking on Aimuari Island | Guardians of the Gallery on Admiral Island,2,Galantis | Smellsweird,Rumored,Illustrious,Celebrated,Aspiring,Crafting,Piracy,Piracy,Crafting,Piracy,Crafting,Carousing,Crafting,Piracy,Carousing,Piracy,Piracy,Carousing,Piracy,Piracy,Piracy,Crafting,Carousing,Piracy,Carousing,Piracy,Crafting,Solid,Paragon,Sublime,Weighty,Paragon,Broad,Narrow,Weighty,Sublime,Broad,Expert,Solid,Expert,Expert,Narrow,Expert,Broad,Narrow,Solid,Broad,Revered,Broad,Master,Proficient,Proficient,Proficient,Distinguished,Able,Able,Grand-Master,Distinguished,Distinguished,Able,Distinguished,Renowned,Respected,Respected,Distinguished,Proficient,Distinguished,Distinguished,Proficient,Proficient,Proficient
Smurfysenga,https://emerald.puzzlepirates.com/yoweb/pirate.wm?classic=false&target=smurfysenga,,Captain,,The Cade Crew,Princess,Symonds Says,Petty Officer,Cryo Island Navy,Puffin,0,,0,,0,,2,Homestead Hut on Lincoln Island | Was A Marked Down Shack on Wissahickon Island,14,Altos | Brummies | Cazl | Clockwatcher | Cupcakeze | Deadwill | Jollyana | Marmy | Mrmoneyboy | Robee | Senga | Sethsea | Shiri | Specke,Aspiring,Aspiring,Obscure,Aspiring,Crafting,Piracy,Piracy,Crafting,Piracy,Crafting,Carousing,Crafting,Piracy,Carousing,Piracy,Piracy,Carousing,Piracy,Piracy,Piracy,Crafting,Carousing,Piracy,Carousing,Piracy,Crafting,Apprentice,Narrow,Solid,Neophyte,Solid,Narrow,Novice,Neophyte,Narrow,Novice,Solid,Novice,Apprentice,Solid,Novice,Novice,Neophyte,Novice,Novice,Neophyte,Apprentice,Novice,Proficient,Distinguished,Distinguished,Proficient,Proficient,Proficient,Able,Respected,Proficient,Able,Proficient,Able,Legendary,Distinguished,Able,Able,Proficient,Able,Master,Proficient,Grand-Master,Able
Wiplasher,https://emerald.puzzlepirates.com/yoweb/pirate.wm?classic=false&target=Wiplasher,http://emerald.puzzlepirates.com/media/emerald/portraits/878/0e0eadc0b16377ef2869719172487.jpg,Senior Officer,Drunk,Natural Selection,Prince,No Bamboozles,Admiral,Blackthorpe Island Navy,Pelican,11,Rags to Riches on Caravanserai Island | Crazy Ship on Barbary Island | Sew What on Caravanserai Island | Sacred Hemp of Ibis on Caravanserai Island | Oops I Whisk'd it Again on Caravanserai Island | No Ship Sherlock on Caravanserai Island | Heavenly Sails on Arakoua Island | Bird Strike Bargains on Caravanserai Island | Scourge of Iron on Caravanserai Island | Loom 'n' Lyrics on Armstrong Island | Harbor Forge on Barbary Island,11,Lithium Balls on Armstrong Island | Dyenamite Spice on Arakoua Island | Bang from Downtown on Blackthorpe Island | Hammer and Hound on Spaniel Island | Dye For You on Caravanserai Island | Triceracloth on Arakoua Island | Bamboozled on Scrimshaw Island | Ship Happens on Kakraphoon Island | Dino Might on Arakoua Island | Pound One Out on Bowditch Island | Fleet Pics on Caravanserai Island,7,Wiplasher's Ironworking Stall on The Lowland Hundred | Wiplasher's Weaving Stall on Wensleydale | Wiplasher's Shipbuilding Stall on Isle of Kent | Martellus's Shipbuilding Stall on Greenwich Island | Amin's Ironworking Stall on Admiral Island | Amin's Weaving Stall on Wensleydale | Amin's Tailoring Stall on Pukru Island,8,Caddyshack on Admiral Island | Shack eel Oh Kneel on Blackthorpe Island | Milkshack on Wensleydale | Was A Marked Down Shack on Wissahickon Island | Bungalow Bill on Admiral Island | Bedside Manors on Admiral Island | Magical Mystery Mansion on Caravanserai Island | Cthulhu Mansion on Admiral Island,12,Chorleychick | Crazee | Daan | Dragonhelper | Greecefeva | Gwilo | Hakerz | Michaelos | Micko | Sacker | Theredwench | Unodos,Aspiring,Renowned,Illustrious,Aspiring,Crafting,Piracy,Piracy,Crafting,Piracy,Crafting,Carousing,Crafting,Piracy,Carousing,Piracy,Piracy,Carousing,Piracy,Piracy,Piracy,Crafting,Carousing,Piracy,Carousing,Piracy,Crafting,Solid,Weighty,Illustrious,Solid,Expert,Solid,Narrow,Solid,Expert,Narrow,Illustrious,Solid,Solid,Illustrious,Broad,Expert,Weighty,Neophyte,Expert,Narrow,Weighty,Broad,Respected,Proficient,Grand-Master,Renowned,Grand-Master,Proficient,Able,Master,Distinguished,Proficient,Legendary,Respected,Legendary,Ultimate,Proficient,Distinguished,Grand-Master,Proficient,Distinguished,Proficient,Master,Respected
Amin,https://emerald.puzzlepirates.com/yoweb/pirate.wm?classic=false&target=amin,http://emerald.puzzlepirates.com/media/emerald/portraits/2ba/cc6f7f65c7beba068a1379e70f47a.jpg,Captain,Shopkeeper,Splash Warning,Lord,No Bamboozles,Ensign,Arakoua Island Navy,Ibis,11,Lithium Balls on Armstrong Island | Dyenamite Spice on Arakoua Island | Hammer and Hound on Spaniel Island | Dye For You on Caravanserai Island | Triceracloth on Arakoua Island | Blow My Bellows on Barbary Island | Bamboozled on Scrimshaw Island | Large Cannonballs on Aimuari Island | Forty-Two on Kakraphoon Island | Dino Might on Arakoua Island | Pound One Out on Bowditch Island,17,Rags to Riches on Caravanserai Island | Crazy Ship on Barbary Island | Sew What on Caravanserai Island | Sacred Hemp of Ibis on Caravanserai Island | Bang from Downtown on Blackthorpe Island | Oops I Whisk'd it Again on Caravanserai Island | No Ship Sherlock on Caravanserai Island | Heavenly Sails on Arakoua Island | Bird Strike Bargains on Caravanserai Island | Nuts & Bolts on Scrimshaw Island | Malice in the Palace on Blackthorpe Island | The Screwed Goose on Scrimshaw Island | Ship Happens on Kakraphoon Island | Scourge of Iron on Caravanserai Island | Loom 'n' Lyrics on Armstrong Island | Mile High Mongers on Admiral Island | Harbor Forge on Barbary Island,6,Amin's Tailoring Stall on Pukru Island | Amin's Ironworking Stall on Admiral Island | Amin's Weaving Stall on Wensleydale | Traegs's Apothecary Stall on Admiral Island | Wiplasher's Weaving Stall on Wensleydale | Wiplasher's Shipbuilding Stall on Isle of Kent,6,Pine Boxes on Aimuari Island | Shack eel Oh Kneel on Blackthorpe Island | King Kottage on Admiral Island | Bringing Town the House on Admiral Island | Bringing Town the House on Admiral Island | Bedside Manors on Admiral Island,23,Astrangel | Buckets | Capnray | Cinnaman | Embargo | Finbarr | Godoftheseas | Greecefeva | Hamsty | Itsjess | Jakdaniels | Jazz | Martellus | Monlizzy | Narp | Pyke | Rockstarg | Sinkz | Teabiscuit | Traegs | Umami | Wiplasher | Youngsinatra,Noted,Celebrated,Eminent,Aspiring,Crafting,Piracy,Piracy,Crafting,Piracy,Crafting,Carousing,Crafting,Piracy,Carousing,Piracy,Piracy,Carousing,Piracy,Piracy,Piracy,Crafting,Carousing,Piracy,Carousing,Piracy,Crafting,Weighty,Solid,Broad,Solid,Illustrious,Novice,Novice,Narrow,Solid,Novice,Broad,Broad,Expert,Broad,Neophyte,Solid,Neophyte,Novice,Solid,Novice,Expert,Broad,Renowned,Respected,Proficient,Master,Respected,Able,Able,Proficient,Proficient,Able,Able,Proficient,Proficient,Proficient,Able,Distinguished,Able,Able,Distinguished,Proficient,Distinguished,Distinguished
Hamsty,https://emerald.puzzlepirates.com/yoweb/pirate.wm?classic=false&target=hamsty,http://emerald.puzzlepirates.com/media/emerald/portraits/c3e/d97454868e604daab242bdb453548.jpg,Senior Officer,,Splash Warning,Prince,No Bamboozles,Sailor,Kakraphoon Island Navy,Dodo,0,,20,No Ballboozles on Aimuari Island | Rags to Riches on Caravanserai Island | Crazy Ship on Barbary Island | Dyenamite Spice on Arakoua Island | Sew What on Caravanserai Island | Greece's Pieces on Aimuari Island | Sacred Hemp of Ibis on Caravanserai Island | Oops I Whisk'd it Again on Caravanserai Island | Hammer and Hound on Spaniel Island | No Ship Sherlock on Caravanserai Island | Dye For You on Caravanserai Island | Triceracloth on Arakoua Island | Bird Strike Bargains on Caravanserai Island | Blow My Bellows on Barbary Island | Bamboozled on Scrimshaw Island | Ball-Mart on Scrimshaw Island | Dino Might on Arakoua Island | Loom 'n' Lyrics on Armstrong Island | Pound One Out on Bowditch Island | Harbor Forge on Barbary Island,0,,11,Adobe Abode on Chachapoya Island | The Dove Shack on Armstrong Island | Was A Marked Down Shack on Wissahickon Island | Sigil Shack on Sayers Rock | Riemann Slums on Descartes Isle | Shack eel Oh Kneel on Blackthorpe Island | The Cuckoo's Nest on Quetzal Island | Shack Macaque on Alkaid Island | Pine Boxes on Aimuari Island | Minute House on Greenwich Island | Bringing Town the House on Admiral Island,0,,Aspiring,Rumored,Noted,Aspiring,Crafting,Piracy,Piracy,Crafting,Piracy,Crafting,Carousing,Crafting,Piracy,Carousing,Piracy,Piracy,Carousing,Piracy,Piracy,Piracy,Crafting,Carousing,Piracy,Carousing,Piracy,Crafting,Novice,Weighty,Expert,Neophyte,Narrow,Novice,Novice,Broad,Broad,Novice,Solid,Broad,Weighty,Solid,Neophyte,Neophyte,Solid,Novice,Narrow,Neophyte,Solid,Novice,Able,Proficient,Respected,Proficient,Able,Able,Respected,Able,Distinguished,Able,Proficient,Proficient,Respected,Distinguished,Able,Proficient,Distinguished,Able,Master,Distinguished,Distinguished,Proficient
Martellus,https://emerald.puzzlepirates.com/yoweb/pirate.wm?classic=false&target=martellus,http://emerald.puzzlepirates.com/media/emerald/portraits/b58/d0bad43177ab19df9a41ff6615762.jpg,Captain,Drunk,Queso De Mondays,Princess,No Bamboozles,Petty Officer,Blackthorpe Island Navy,Pelican,0,,16,Rags to Riches on Caravanserai Island | Crazy Ship on Barbary Island | Dyenamite Spice on Arakoua Island | Sacred Hemp of Ibis on Caravanserai Island | Bang from Downtown on Blackthorpe Island | Oops I Whisk'd it Again on Caravanserai Island | No Ship Sherlock on Caravanserai Island | Dye For You on Caravanserai Island | Heavenly Sails on Arakoua Island | Triceracloth on Arakoua Island | Bird Strike Bargains on Caravanserai Island | Bamboozled on Scrimshaw Island | Building Dynasties on Blackthorpe Island | Scourge of Iron on Caravanserai Island | Loom 'n' Lyrics on Armstrong Island | Harbor Forge on Barbary Island,6,Martellus's Apothecary Stall on Greenwich Island | Martellus's Shipbuilding Stall on Greenwich Island | Martellus's Ironworking Stall on Blackthorpe Island | Martellus's Distilling Stall on Greenwich Island | Wiplasher's Ironworking Stall on The Lowland Hundred | Wiplasher's Shipbuilding Stall on Isle of Kent,15,Minute House on Greenwich Island | Shack eel Oh Kneel on Blackthorpe Island | Milkshack on Wensleydale | Sigil Shack on Sayers Rock | Caddyshack on Admiral Island | Cabin Fever on Admiral Island | Bungalow Bill on Admiral Island | King Kottage on Admiral Island | Row Me Daddy on Admiral Island | Bringing Town the House on Admiral Island | Caddyshack on Admiral Island | Stab In Cabin on Aimuari Island | Rho House on Descartes Isle | Bringing Town the House on Admiral Island | Bedside Manors on Admiral Island,46,Affame | Beia | Blonde | Bonze | Brocko | Cafefe | Canadagoose | Capnray | Ccarlson | Contressa | Derivatives | Dirtybowdy | Drover | Frostease | Glamourr | Greecefeva | Hamsty | Hellz | Iaago | Jacobdwnunda | Jahron | Jazz | Jerrk | Kizzle | Kushlorde | Lashientax | Maeven | Margaroo | Marioman | Mchicken | Missyfiercer | Narp | Ohmi | Papi | Pedro | Psychi | Shigby | Sonadora | Sonicbang | Sscc | Teabiscuit | Umami | Viator | Walterwhale | Youngsinatra | Zengris,Aspiring,Aspiring,Renowned,Obscure,Crafting,Piracy,Piracy,Crafting,Piracy,Crafting,Carousing,Crafting,Piracy,Carousing,Piracy,Piracy,Carousing,Piracy,Piracy,Piracy,Crafting,Carousing,Piracy,Carousing,Piracy,Crafting,Neophyte,Expert,Weighty,Solid,Solid,Apprentice,Broad,Broad,Solid,Solid,Paragon,Solid,Illustrious,Expert,Solid,Solid,Broad,Narrow,Solid,Narrow,Weighty,Apprentice,Able,Proficient,Respected,Renowned,Able,Able,Proficient,Distinguished,Proficient,Legendary,Ultimate,Distinguished,Grand-Master,Master,Master,Proficient,Proficient,Proficient,Proficient,Proficient,Distinguished,Able
Ohmi,https://emerald.puzzlepirates.com/yoweb/pirate.wm?classic=false&target=ohmi,http://emerald.puzzlepirates.com/media/emerald/portraits/142/7f5c49aa10dbd8b1c4dd9fd0540ec.jpg,Senior Officer,Navigator,Splash Warning,Prince,No Bamboozles,Lieutenant,Admiral Island Navy,Gull,0,,7,Oops I Whisk'd it Again on Caravanserai Island | Loom 'n' Lyrics on Armstrong Island | Rags to Riches on Caravanserai Island | Crazy Ship on Barbary Island | Sew What on Caravanserai Island | Bird Strike Bargains on Caravanserai Island | Harbor Forge on Barbary Island,1,Martellus's Apothecary Stall on Greenwich Island,3,Shack eel Oh Kneel on Blackthorpe Island | Cthulhu Mansion on Admiral Island | Bringing Town the House on Admiral Island,11,Amin | Blonde | Daeris | Embargo | Greecefeva | Helium | Mahsa | Mahta | Martellus | Sscc | Youngsinatra,Obscure,Rumored,Renowned,Aspiring,Crafting,Piracy,Piracy,Crafting,Piracy,Crafting,Carousing,Crafting,Piracy,Carousing,Piracy,Piracy,Carousing,Piracy,Piracy,Piracy,Crafting,Carousing,Piracy,Carousing,Piracy,Crafting,Solid,Solid,Solid,Solid,Paragon,Novice,Broad,Solid,Solid,Weighty,Solid,Solid,Paragon,Solid,Broad,Solid,Broad,Neophyte,Solid,Solid,Solid,Narrow,Distinguished,Respected,Proficient,Master,Master,Able,Proficient,Distinguished,Able,Ultimate,Proficient,Proficient,Proficient,Distinguished,Proficient,Proficient,Proficient,Proficient,Respected,Master,Proficient,Proficient
Sankz,https://emerald.puzzlepirates.com/yoweb/pirate.wm?classic=false&target=sankz,,Senior Officer,,Splash Warning,Lord,No Bamboozles,Chief Petty Officer,Pukru Island Navy,Orion,0,,0,,0,,2,Shack eel Oh Kneel on Blackthorpe Island | Sea Shack on Scrimshaw Island,4,Canceer | Hamsty | Sinkz | Wraps,Aspiring,Aspiring,Aspiring,Aspiring,Crafting,Piracy,Piracy,Crafting,Piracy,Crafting,Carousing,Crafting,Piracy,Carousing,Piracy,Piracy,Carousing,Piracy,Piracy,Piracy,Crafting,Carousing,Piracy,Carousing,Piracy,Crafting,Novice,Apprentice,Novice,Solid,Narrow,Novice,Novice,Apprentice,Narrow,Novice,Narrow,Apprentice,Neophyte,Solid,Novice,Novice,Novice,Novice,Novice,Novice,Solid,Neophyte,Able,Proficient,Able,Ultimate,Proficient,Able,Able,Master,Master,Able,Proficient,Proficient,Respected,Respected,Able,Able,Able,Able,Proficient,Able,Distinguished,Distinguished
Wargrade,https://emerald.puzzlepirates.com/yoweb/pirate.wm?classic=false&target=wargrade,,Captain,Nap Specialist,Nightfall,Prince,Deadlock,Stowaway,Cryo Island Navy,Puffin,0,,0,,0,,1,Caddyshack on Admiral Island,0,,Aspiring,Aspiring,Aspiring,Aspiring,Crafting,Piracy,Piracy,Crafting,Piracy,Crafting,Carousing,Crafting,Piracy,Carousing,Piracy,Piracy,Carousing,Piracy,Piracy,Piracy,Crafting,Carousing,Piracy,Carousing,Piracy,Crafting,Novice,Novice,Novice,Novice,Novice,Novice,Novice,Novice,Novice,Novice,Novice,Novice,Novice,Novice,Novice,Novice,Novice,Novice,Novice,Novice,Novice,Novice,Able,Able,Able,Able,Able,Able,Able,Able,Able,Able,Able,Able,Able,Able,Able,Able,Able,Able,Able,Able,Able,Able
