Cozi,https://emerald.puzzlepirates.com/yoweb/pirate.wm?classic=false&target=cozi,http://emerald.puzzlepirates.com/media/emerald/portraits/887/3f47f872f0f0ddbd42b312c7c45f6.jpg,Senior Officer,Portrait Painter,Euthanasia,Lady,No Strings Attached,Lieutenant,Barbary Island Navy,Ibis,7,Buffalo Trace on Barbary Island | Dinosaur Court on Arakoua Island | Forbidden Fruits on Kasidim Island | Sanctuary for Sin on Kasidim Island | K TWO on Arakoua Island | Altered Reality on Kasidim Island | Balls Mafia on Barbary Island,7,Pacts on Papyrus and Parchment on Arakoua Island | Chair Witch Project on Barbary Island | Gentleman's Quarterly on Barbary Island | Ironically on Barbary Island | Ball Busters on Barbary Island | Bang from Downtown on Blackthorpe Island | The Unions Alehouse on Barbary Island,5,Cozi's Apothecary Stall on Greenwich Island | Cozi's Tailoring Stall on Admiral Island | Cozi's Distilling Stall on Blackthorpe Island | Cozi's Furnishing Stall on Greenwich Island | Quap's Furnishing Stall on Greenwich Island,14,Shadow Cabin on Barbary Island | Blackgate on Barbary Island | Gardens of Babylon on Kasidim Island | Krypton Kottage on Barbary Island | Villa of the Damned on Aimuari Island | Guardians of the Gallery on Barbary Island | Sidekick Shacks on Barbary Island | Caddyshack on Admiral Island | Bungalow Bill on Admiral Island | Gardens of Babylon on Kasidim Island | King Kottage on Admiral Island | Jonestown Houses on Aimuari Island | Villa Las Vegas on Admiral Island | Villayria on Barbary Island,1,Quapozi,Renowned,Celebrated,Illustrious,Aspiring,Crafting,Piracy,Piracy,Crafting,Piracy,Crafting,Carousing,Crafting,Piracy,Carousing,Piracy,Piracy,Carousing,Piracy,Piracy,Piracy,Crafting,Carousing,Piracy,Carousing,Piracy,Crafting,Solid,Weighty,Weighty,Solid,Weighty,Broad,Neophyte,Broad,Solid,Solid,Solid,Solid,Illustrious,Broad,Narrow,Weighty,Novice,Solid,Weighty,Narrow,Paragon,Novice,Distinguished,Renowned,Respected,Distinguished,Distinguished,Proficient,Proficient,Proficient,Proficient,Ultimate,Respected,Master,Master,Proficient,Master,Respected,Able,Renowned,Renowned,Proficient,Distinguished,Able
Ekzo,https://emerald.puzzlepirates.com/yoweb/pirate.wm?classic=false&target=ekzo,http://emerald.puzzlepirates.com/media/emerald/portraits/c58/6a6fc088cf7a17e5e3b36c65efca4.jpg,Senior Officer,Parrot Postmaster,Euthanasia,Lord,No Strings Attached,Admiral,Barbary Island Navy,Ibis,3,Crazy Potions on Barbary Island | Tora the Explorer on Gauntlet Island | Fort Grievous on Gauntlet Island,1,Molten Metals on Caravanserai Island,0,,2,Manor of Steel on Barbary Island | Guardians of the Gallery on Barbary Island,2,Maybnot | Yourluckyday,Established,Celebrated,Renowned,Aspiring,Crafting,Piracy,Piracy,Crafting,Piracy,Crafting,Carousing,Crafting,Piracy,Carousing,Piracy,Piracy,Carousing,Piracy,Piracy,Piracy,Crafting,Carousing,Piracy,Carousing,Piracy,Crafting,Solid,Solid,Expert,Solid,Paragon,Solid,Narrow,Solid,Paragon,Broad,Solid,Solid,Weighty,Solid,Narrow,Weighty,Solid,Narrow,Paragon,Neophyte,Weighty,Broad,Grand-Master,Grand-Master,Legendary,Distinguished,Renowned,Proficient,Distinguished,Respected,Grand-Master,Grand-Master,Renowned,Renowned,Grand-Master,Legendary,Renowned,Grand-Master,Respected,Respected,Ultimate,Proficient,Legendary,Respected
Obaider,https://emerald.puzzlepirates.com/yoweb/pirate.wm?classic=false&target=obaider,http://emerald.puzzlepirates.com/media/emerald/portraits/19e/64705a2bed47f8e3c74536ba07395.jpg,Captain,Monster Hunter,PALACTION,Lord,No Strings Attached,Chief Petty Officer,Admiral Island Navy,Gull,0,,1,I'm a LumberJacket and I'm OK on Bowditch Island,0,,11,Pine Boxes on Aimuari Island | Caddyshack on Admiral Island | Death Row on Aimuari Island | Only a Manor of Time on Aimuari Island | Cabin Fever on Admiral Island | Cabin Fever on Admiral Island | Bedside Manors on Admiral Island | Bedside Manors on Admiral Island | Castle Arrrrrrrrrrggghh on Bowditch Island | Guardians of the Gallery on Admiral Island | Guardians of the Gallery on Barbary Island,1,Delores,Rumored,Rumored,Celebrated,Aspiring,Crafting,Piracy,Piracy,Crafting,Piracy,Crafting,Carousing,Crafting,Piracy,Carousing,Piracy,Piracy,Carousing,Piracy,Piracy,Piracy,Crafting,Carousing,Piracy,Carousing,Piracy,Crafting,Solid,Weighty,Expert,Neophyte,Solid,Neophyte,Apprentice,Weighty,Weighty,Narrow,Solid,Solid,Illustrious,Solid,Broad,Solid,Broad,Neophyte,Weighty,Broad,Illustrious,Solid,Proficient,Legendary,Respected,Able,Proficient,Able,Distinguished,Legendary,Proficient,Master,Proficient,Master,Distinguished,Distinguished,Respected,Respected,Proficient,Proficient,Proficient,Distinguished,Distinguished,Master
Senga,https://emerald.puzzlepirates.com/yoweb/pirate.wm?classic=false&target=senga,http://emerald.puzzlepirates.com/media/emerald/portraits/79d/42bf63a26e94ebaffffbeb5ecc7e1.jpg,Captain,Bilge Rat,Hardcore Sea Ravers,Queen,Symonds Says,Admiral,Basset Island Navy,Gull,7,Toilet Paper Balls on Barbary Island | Fort Influential on Basset Island | Due or Dye on Admiral Island | Brassy Balls on Basset Island | Ninny Knickers on Admiral Island | Ten Things I Crate About You on Admiral Island | Rums on Bowditch Island,11,Frig on a Lease on Caravanserai Island | Red Red Rum on Caravanserai Island | Roadside Remedies on Scrimshaw Island | Naughty Shots on Aimuari Island | Wicked Wench on Cryo Island | Iron Heart on Caravanserai Island | Timely Fashion on Greenwich Island | The Great White North on Cryo Island | Calm Seas Blacksmith on Caravanserai Island | Naughty Balls on Aimuari Island | Elixir of Love on Caravanserai Island,3,Cazl's Shipbuilding Stall on Isle of Kent | Banishdemons's Distilling Stall on The Lowland Hundred | Banishdemons's Ironworking Stall on The Lowland Hundred,22,Homestead Hut on Lincoln Island | Milkshack on Wensleydale | Riemann Slums on Descartes Isle | Caddyshack on Admiral Island | Rho House on Descartes Isle | Shack eel Oh Kneel on Blackthorpe Island | Love Shack on Caravanserai Island | Love Shack on Caravanserai Island | Riemann Slums on Descartes Isle | Caddyshack on Admiral Island | Cypress Cabins on Alkaid Island | Stab In Cabin on Aimuari Island | King Kottage on Admiral Island | Row Me Daddy on Admiral Island | Bringing Town the House on Admiral Island | Bedside Manors on Admiral Island | Only a Manor of Time on Aimuari Island | The Great Estate on Admiral Island | The Great Estate on Admiral Island | Guardians of the Gallery on Admiral Island | Guardians of the Gallery on Admiral Island | Dream On on Caravanserai Island,1,Robee,Noted,Noted,Renowned,Aspiring,Crafting,Piracy,Piracy,Crafting,Piracy,Crafting,Carousing,Crafting,Piracy,Carousing,Piracy,Piracy,Carousing,Piracy,Piracy,Piracy,Crafting,Carousing,Piracy,Carousing,Piracy,Crafting,Sublime,Illustrious,Exalted,Paragon,Exalted,Illustrious,Solid,Illustrious,Illustrious,Solid,Sublime,Solid,Illustrious,Exalted,Broad,Paragon,Sublime,Narrow,Solid,Weighty,Paragon,Expert,Master,Distinguished,Proficient,Proficient,Proficient,Proficient,Able,Grand-Master,Able,Grand-Master,Proficient,Master,Grand-Master,Distinguished,Able,Proficient,Able,Distinguished,Able,Proficient,Grand-Master,Respected
Alitar,https://emerald.puzzlepirates.com/yoweb/pirate.wm?classic=false&target=alitar,http://emerald.puzzlepirates.com/media/emerald/portraits/6a1/6f2f40c2e445ef13b10d6d1a89d76.jpg,Captain,,Gondolin,Prince,Symonds Says,Lieutenant,Aimuari Island Navy,Orion,1,Harland Ships on Aimuari Island,2,Brassy Balls on Basset Island | Fabric Fix on Aimuari Island,1,Cupcakie's Ironworking Stall on Chachapoya Island,4,Pine Boxes on Aimuari Island | Only a Manor of Time on Aimuari Island | Mayfair Mansions on Pukru Island | Tomb of the Hallowed Soul on Aimuari Island,0,,Aspiring,Aspiring,Aspiring,Aspiring,Crafting,Piracy,Piracy,Crafting,Piracy,Crafting,Carousing,Crafting,Piracy,Carousing,Piracy,Piracy,Carousing,Piracy,Piracy,Piracy,Crafting,Carousing,Piracy,Carousing,Piracy,Crafting,Novice,Weighty,Weighty,Broad,Weighty,Novice,Novice,Broad,Paragon,Narrow,Paragon,Narrow,Solid,Illustrious,Narrow,Narrow,Expert,Broad,Broad,Novice,Expert,Broad,Able,Legendary,Respected,Proficient,Distinguished,Able,Able,Legendary,Master,Respected,Grand-Master,Respected,Distinguished,Grand-Master,Proficient,Proficient,Respected,Master,Grand-Master,Proficient,Master,Respected
Cazl,https://emerald.puzzlepirates.com/yoweb/pirate.wm?classic=false&target=cazl,http://emerald.puzzlepirates.com/media/emerald/portraits/62e/3341689a65555a8321698db2877c4.jpg,Captain,Siren,Ult naughty ones,Princess,Symonds Says,Admiral,Aimuari Island Navy,Orion,2,Naughty Shots on Aimuari Island | Naughty Balls on Aimuari Island,8,Toilet Paper Balls on Barbary Island | Fort Influential on Basset Island | Due or Dye on Admiral Island | Brassy Balls on Basset Island | Wicked Wench on Cryo Island | Ninny Knickers on Admiral Island | Ten Things I Crate About You on Admiral Island | The Great White North on Cryo Island,1,Cazl's Shipbuilding Stall on Isle of Kent,20,Shack Macaque on Alkaid Island | Adobe Abode on Chachapoya Island | Caddyshack on Admiral Island | Cabin Fever on Admiral Island | Cypress Cabins on Alkaid Island | Bungalow Bill on Admiral Island | Mayfair Mansions on Pukru Island | Live Organ Townhouses on Bowditch Island | Bringing Town the House on Admiral Island | Emu-ving on Up on Quetzal Island | Me So Homey on Armstrong Island | Only a Manor of Time on Aimuari Island | Villa of the Damned on Aimuari Island | Dead Mansion Walking on Aimuari Island | Stab In Cabin on Aimuari Island | King Kottage on Admiral Island | Bringing Town the House on Admiral Island | Emu-ving on Up on Quetzal Island | Bedside Manors on Admiral Island | The Great Estate on Admiral Island,2,Rilee | Snakegirly,Noted,Eminent,Renowned,Aspiring,Crafting,Piracy,Piracy,Crafting,Piracy,Crafting,Carousing,Crafting,Piracy,Carousing,Piracy,Piracy,Carousing,Piracy,Piracy,Piracy,Crafting,Carousing,Piracy,Carousing,Piracy,Crafting,Solid,Neophyte,Illustrious,Illustrious,Transcendent,Weighty,Novice,Paragon,Broad,Novice,Neophyte,Neophyte,Neophyte,Exalted,Narrow,Expert,Paragon,Novice,Broad,Novice,Illustrious,Expert,Proficient,Able,Proficient,Proficient,Distinguished,Proficient,Distinguished,Distinguished,Respected,Able,Proficient,Distinguished,Proficient,Proficient,Proficient,Proficient,Able,Able,Grand-Master,Proficient,Able,Distinguished
Eltaro,https://emerald.puzzlepirates.com/yoweb/pirate.wm?classic=false&target=eltaro,http://emerald.puzzlepirates.com/media/emerald/portraits/117/a87989d9b2ee3e067f2e3286c30cc.jpg,Senior Officer,Counselor,Hardcore Sea Ravers,Prince,Symonds Says,Admiral,Admiral Island Navy,Gull,3,The Great White North on Cryo Island | Roadside Remedies on Scrimshaw Island | Wicked Wench on Cryo Island,3,Ninny Knickers on Admiral Island | Fort Influential on Basset Island | Brassy Balls on Basset Island,3,Eltaro's Apothecary Stall on Bowditch Island | Eltaro's Apothecary Stall on Admiral Island | Eltaro's Apothecary Stall on Wensleydale,6,Milkshack on Wensleydale | Bedside Manors on Admiral Island | Villa Las Vegas on Admiral Island | King Kottage on Admiral Island | Dead Mansion Walking on Aimuari Island | Guardians of the Gallery on Admiral Island,2,Galantis | Smellsweird,Rumored,Illustrious,Celebrated,Aspiring,Crafting,Piracy,Piracy,Crafting,Piracy,Crafting,Carousing,Crafting,Piracy,Carousing,Piracy,Piracy,Carousing,Piracy,Piracy,Piracy,Crafting,Carousing,Piracy,Carousing,Piracy,Crafting,Solid,Paragon,Sublime,Weighty,Paragon,Broad,Narrow,Weighty,Sublime,Broad,Expert,Solid,Expert,Expert,Narrow,Expert,Broad,Narrow,Solid,Broad,Revered,Broad,Respected,Proficient,Distinguished,Able,Distinguished,Able,Proficient,Grand-Master,Distinguished,Distinguished,Able,Renowned,Master,Renowned,Master,Distinguished,Proficient,Distinguished,Master,Proficient,Able,Proficient
Smurfysenga,https://emerald.puzzlepirates.com/yoweb/pirate.wm?classic=false&target=smurfysenga,,Captain,,The Cade Crew,Princess,Symonds Says,Petty Officer,Cryo Island Navy,Puffin,0,,0,,0,,2,Homestead Hut on Lincoln Island | Was A Marked Down Shack on Wissahickon Island,14,Altos | Brummies | Cazl | Clockwatcher | Cupcakeze | Deadwill | Jollyana | Marmy | Mrmoneyboy | Robee | Senga | Sethsea | Shiri | Specke,Aspiring,Aspiring,Rumored,Aspiring,Crafting,Piracy,Piracy,Crafting,Piracy,Crafting,Carousing,Crafting,Piracy,Carousing,Piracy,Piracy,Carousing,Piracy,Piracy,Piracy,Crafting,Carousing,Piracy,Carousing,Piracy,Crafting,Apprentice,Narrow,Solid,Neophyte,Solid,Narrow,Novice,Neophyte,Narrow,Novice,Solid,Novice,Apprentice,Solid,Novice,Novice,Neophyte,Novice,Novice,Neophyte,Apprentice,Novice,Proficient,Distinguished,Distinguished,Able,Proficient,Proficient,Able,Distinguished,Proficient,Able,Proficient,Able,Legendary,Distinguished,Able,Able,Able,Able,Grand-Master,Proficient,Grand-Master,Able
Wiplasher,https://emerald.puzzlepirates.com/yoweb/pirate.wm?classic=false&target=Wiplasher,http://emerald.puzzlepirates.com/media/emerald/portraits/878/0e0eadc0b16377ef2869719172487.jpg,Senior Officer,Drunk,Natural Selection,Prince,No Bamboozles,Admiral,Blackthorpe Island Navy,Pelican,11,Heavenly Sails on Arakoua Island | Loom 'n' Lyrics on Armstrong Island | Harbor Forge on Barbary Island | Sew What on Caravanserai Island | Bird Strike Bargains on Caravanserai Island | Crazy Ship on Barbary Island | No Ship Sherlock on Caravanserai Island | Scourge of Iron on Caravanserai Island | Rags to Riches on Caravanserai Island | Oops I Whisk'd it Again on Caravanserai Island | Sacred Hemp of Ibis on Caravanserai Island,11,Pound One Out on Bowditch Island | Fleet Pics on Caravanserai Island | Ship Happens on Kakraphoon Island | Hammer and Hound on Spaniel Island | Dino Might on Arakoua Island | Dye For You on Caravanserai Island | Bang from Downtown on Blackthorpe Island | Bamboozled on Scrimshaw Island | Lithium Balls on Armstrong Island | Triceracloth on Arakoua Island | Dyenamite Spice on Arakoua Island,7,Wiplasher's Weaving Stall on Wensleydale | Wiplasher's Shipbuilding Stall on Isle of Kent | Wiplasher's Ironworking Stall on The Lowland Hundred | Amin's Weaving Stall on Wensleydale | Amin's Tailoring Stall on Pukru Island | Martellus's Shipbuilding Stall on Greenwich Island | Amin's Ironworking Stall on Admiral Island,8,Shack eel Oh Kneel on Blackthorpe Island | Milkshack on Wensleydale | Was A Marked Down Shack on Wissahickon Island | Caddyshack on Admiral Island | Bungalow Bill on Admiral Island | Bedside Manors on Admiral Island | Cthulhu Mansion on Admiral Island | Magical Mystery Mansion on Caravanserai Island,12,Chorleychick | Crazee | Daan | Dragonhelper | Greecefeva | Gwilo | Hakerz | Michaelos | Micko | Sacker | Theredwench | Unodos,Aspiring,Renowned,Illustrious,Aspiring,Crafting,Piracy,Piracy,Crafting,Piracy,Crafting,Carousing,Crafting,Piracy,Carousing,Piracy,Piracy,Carousing,Piracy,Piracy,Piracy,Crafting,Carousing,Piracy,Carousing,Piracy,Crafting,Solid,Weighty,Illustrious,Solid,Expert,Solid,Narrow,Solid,Expert,Narrow,Illustrious,Solid,Solid,Illustrious,Broad,Expert,Weighty,Neophyte,Expert,Narrow,Weighty,Broad,Respected,Proficient,Legendary,Renowned,Grand-Master,Proficient,Able,Respected,Distinguished,Proficient,Legendary,Renowned,Legendary,Ultimate,Proficient,Distinguished,Grand-Master,Proficient,Master,Proficient,Master,Respected
Amin,https://emerald.puzzlepirates.com/yoweb/pirate.wm?classic=false&target=amin,http://emerald.puzzlepirates.com/media/emerald/portraits/2ba/cc6f7f65c7beba068a1379e70f47a.jpg,Captain,Shopkeeper,Splash Warning,Prince,No Bamboozles,Ensign,Arakoua Island Navy,Ibis,11,Pound One Out on Bowditch Island | Large Cannonballs on Aimuari Island | Hammer and Hound on Spaniel Island | Forty-Two on Kakraphoon Island | Dino Might on Arakoua Island | Dye For You on Caravanserai Island | Blow My Bellows on Barbary Island | Bamboozled on Scrimshaw Island | Lithium Balls on Armstrong Island | Triceracloth on Arakoua Island | Dyenamite Spice on Arakoua Island,18,Heavenly Sails on Arakoua Island | Loom 'n' Lyrics on Armstrong Island | Ship Happens on Kakraphoon Island | Harbor Forge on Barbary Island | Sew What on Caravanserai Island | Bird Strike Bargains on Caravanserai Island | Nuts & Bolts on Scrimshaw Island | Crazy Ship on Barbary Island | No Ship Sherlock on Caravanserai Island | Mile High Mongers on Admiral Island | The Screwed Goose on Scrimshaw Island | Scourge of Iron on Caravanserai Island | Iron Hangar on Bowditch Island | Rags to Riches on Caravanserai Island | Bang from Downtown on Blackthorpe Island | Oops I Whisk'd it Again on Caravanserai Island | Sacred Hemp of Ibis on Caravanserai Island | Malice in the Palace on Blackthorpe Island,6,Amin's Tailoring Stall on Pukru Island | Amin's Weaving Stall on Wensleydale | Amin's Ironworking Stall on Admiral Island | Traegs's Apothecary Stall on Admiral Island | Wiplasher's Weaving Stall on Wensleydale | Wiplasher's Shipbuilding Stall on Isle of Kent,6,Pine Boxes on Aimuari Island | Shack eel Oh Kneel on Blackthorpe Island | King Kottage on Admiral Island | Bringing Town the House on Admiral Island | Bringing Town the House on Admiral Island | Bedside Manors on Admiral Island,23,Astrangel | Buckets | Capnray | Cinnaman | Embargo | Finbarr | Godoftheseas | Greecefeva | Hamsty | Itsjess | Jakdaniels | Jazz | Martellus | Monlizzy | Narp | Pyke | Rockstarg | Sinkz | Teabiscuit | Traegs | Umami | Wiplasher | Youngsinatra,Established,Celebrated,Illustrious,Aspiring,Crafting,Piracy,Piracy,Crafting,Piracy,Crafting,Carousing,Crafting,Piracy,Carousing,Piracy,Piracy,Carousing,Piracy,Piracy,Piracy,Crafting,Carousing,Piracy,Carousing,Piracy,Crafting,Weighty,Solid,Broad,Solid,Illustrious,Novice,Novice,Narrow,Solid,Novice,Broad,Broad,Expert,Broad,Neophyte,Solid,Neophyte,Novice,Solid,Novice,Expert,Broad,Renowned,Respected,Proficient,Respected,Master,Able,Able,Proficient,Proficient,Able,Able,Distinguished,Proficient,Proficient,Able,Distinguished,Able,Able,Respected,Proficient,Proficient,Distinguished
Hamsty,https://emerald.puzzlepirates.com/yoweb/pirate.wm?classic=false&target=hamsty,http://emerald.puzzlepirates.com/media/emerald/portraits/c3e/d97454868e604daab242bdb453548.jpg,Senior Officer,,Queso De Mondays,Prince,No Bamboozles,Sailor,Kakraphoon Island Navy,Dodo,0,,20,Pound One Out on Bowditch Island | Ball-Mart on Scrimshaw Island | Loom 'n' Lyrics on Armstrong Island | Hammer and Hound on Spaniel Island | Harbor Forge on Barbary Island | Sew What on Caravanserai Island | Bird Strike Bargains on Caravanserai Island | Greece's Pieces on Aimuari Island | Crazy Ship on Barbary Island | Dino Might on Arakoua Island | No Ship Sherlock on Caravanserai Island | No Ballboozles on Aimuari Island | Rags to Riches on Caravanserai Island | Dye For You on Caravanserai Island | Blow My Bellows on Barbary Island | Bamboozled on Scrimshaw Island | Triceracloth on Arakoua Island | Oops I Whisk'd it Again on Caravanserai Island | Sacred Hemp of Ibis on Caravanserai Island | Dyenamite Spice on Arakoua Island,0,,11,The Dove Shack on Armstrong Island | Was A Marked Down Shack on Wissahickon Island | The Cuckoo's Nest on Quetzal Island | Shack eel Oh Kneel on Blackthorpe Island | Riemann Slums on Descartes Isle | Sigil Shack on Sayers Rock | Minute House on Greenwich Island | Adobe Abode on Chachapoya Island | Pine Boxes on Aimuari Island | Shack Macaque on Alkaid Island | Bringing Town the House on Admiral Island,0,,Aspiring,Aspiring,Noted,Aspiring,Crafting,Piracy,Piracy,Crafting,Piracy,Crafting,Carousing,Crafting,Piracy,Carousing,Piracy,Piracy,Carousing,Piracy,Piracy,Piracy,Crafting,Carousing,Piracy,Carousing,Piracy,Crafting,Novice,Weighty,Expert,Neophyte,Narrow,Novice,Novice,Broad,Broad,Novice,Solid,Broad,Weighty,Solid,Neophyte,Neophyte,Solid,Novice,Narrow,Neophyte,Solid,Novice,Able,Able,Respected,Proficient,Able,Able,Distinguished,Able,Distinguished,Able,Proficient,Respected,Respected,Distinguished,Able,Proficient,Proficient,Able,Grand-Master,Distinguished,Distinguished,Able
Martellus,https://emerald.puzzlepirates.com/yoweb/pirate.wm?classic=false&target=martellus,http://emerald.puzzlepirates.com/media/emerald/portraits/b58/d0bad43177ab19df9a41ff6615762.jpg,Captain,Drunk,Queso De Mondays,Princess,No Bamboozles,Petty Officer,Blackthorpe Island Navy,Pelican,0,,16,Heavenly Sails on Arakoua Island | Loom 'n' Lyrics on Armstrong Island | Harbor Forge on Barbary Island | Bird Strike Bargains on Caravanserai Island | Building Dynasties on Blackthorpe Island | Crazy Ship on Barbary Island | No Ship Sherlock on Caravanserai Island | Scourge of Iron on Caravanserai Island | Rags to Riches on Caravanserai Island | Dye For You on Caravanserai Island | Bang from Downtown on Blackthorpe Island | Bamboozled on Scrimshaw Island | Triceracloth on Arakoua Island | Oops I Whisk'd it Again on Caravanserai Island | Sacred Hemp of Ibis on Caravanserai Island | Dyenamite Spice on Arakoua Island,6,Martellus's Ironworking Stall on Blackthorpe Island | Martellus's Apothecary Stall on Greenwich Island | Martellus's Shipbuilding Stall on Greenwich Island | Martellus's Distilling Stall on Greenwich Island | Wiplasher's Shipbuilding Stall on Isle of Kent | Wiplasher's Ironworking Stall on The Lowland Hundred,15,Shack eel Oh Kneel on Blackthorpe Island | Milkshack on Wensleydale | Minute House on Greenwich Island | Sigil Shack on Sayers Rock | Caddyshack on Admiral Island | Cabin Fever on Admiral Island | Bungalow Bill on Admiral Island | King Kottage on Admiral Island | Row Me Daddy on Admiral Island | Bringing Town the House on Admiral Island | Caddyshack on Admiral Island | Stab In Cabin on Aimuari Island | Rho House on Descartes Isle | Bringing Town the House on Admiral Island | Bedside Manors on Admiral Island,46,Affame | Beia | Blonde | Bonze | Brocko | Cafefe | Canadagoose | Capnray | Ccarlson | Contressa | Derivatives | Dirtybowdy | Drover | Frostease | Glamourr | Greecefeva | Hamsty | Hellz | Iaago | Jacobdwnunda | Jahron | Jazz | Jerrk | Kizzle | Kushlorde | Lashientax | Maeven | Margaroo | Marioman | Mchicken | Missyfiercer | Narp | Ohmi | Papi | Pedro | Psychi | Shigby | Sonadora | Sonicbang | Sscc | Teabiscuit | Umami | Viator | Walterwhale | Youngsinatra | Zengris,Aspiring,Obscure,Celebrated,Rumored,Crafting,Piracy,Piracy,Crafting,Piracy,Crafting,Carousing,Crafting,Piracy,Carousing,Piracy,Piracy,Carousing,Piracy,Piracy,Piracy,Crafting,Carousing,Piracy,Carousing,Piracy,Crafting,Neophyte,Expert,Weighty,Solid,Solid,Apprentice,Broad,Broad,Solid,Solid,Paragon,Solid,Illustrious,Expert,Solid,Solid,Broad,Narrow,Solid,Narrow,Weighty,Apprentice,Able,Proficient,Respected,Master,Proficient,Able,Proficient,Proficient,Proficient,Legendary,Ultimate,Renowned,Grand-Master,Legendary,Renowned,Proficient,Able,Proficient,Proficient,Proficient,Distinguished,Able
Ohmi,https://emerald.puzzlepirates.com/yoweb/pirate.wm?classic=false&target=ohmi,http://emerald.puzzlepirates.com/media/emerald/portraits/142/7f5c49aa10dbd8b1c4dd9fd0540ec.jpg,Senior Officer,Navigator,Splash Warning,Prince,No Bamboozles,Lieutenant,Admiral Island Navy,Gull,3,Home Court Commodities on Blackthorpe Island | Building Dynasties on Blackthorpe Island | Malice in the Palace on Blackthorpe Island,7,Rags to Riches on Caravanserai Island | Loom 'n' Lyrics on Armstrong Island | Harbor Forge on Barbary Island | Sew What on Caravanserai Island | Bird Strike Bargains on Caravanserai Island | Oops I Whisk'd it Again on Caravanserai Island | Crazy Ship on Barbary Island,1,Martellus's Apothecary Stall on Greenwich Island,4,Shack eel Oh Kneel on Blackthorpe Island | Cthulhu Mansion on Admiral Island | Bringing Town the House on Admiral Island | Cthulhu Mansion on Admiral Island,11,Amin | Blonde | Daeris | Embargo | Greecefeva | Helium | Mahsa | Mahta | Martellus | Sscc | Youngsinatra,Rumored,Noted,Celebrated,Aspiring,Crafting,Piracy,Piracy,Crafting,Piracy,Crafting,Carousing,Crafting,Piracy,Carousing,Piracy,Piracy,Carousing,Piracy,Piracy,Piracy,Crafting,Carousing,Piracy,Carousing,Piracy,Crafting,Solid,Solid,Solid,Solid,Paragon,Novice,Broad,Solid,Solid,Weighty,Solid,Solid,Paragon,Solid,Broad,Solid,Broad,Neophyte,Solid,Solid,Solid,Narrow,Distinguished,Distinguished,Proficient,Distinguished,Master,Able,Proficient,Proficient,Able,Ultimate,Proficient,Respected,Proficient,Distinguished,Proficient,Proficient,Proficient,Proficient,Renowned,Master,Proficient,Proficient
Sankz,https://emerald.puzzlepirates.com/yoweb/pirate.wm?classic=false&target=sankz,,Senior Officer,,Splash Warning,Lord,No Bamboozles,Chief Petty Officer,Pukru Island Navy,Orion,0,,0,,0,,2,Sea Shack on Scrimshaw Island | Shack eel Oh Kneel on Blackthorpe Island,4,Canceer | Hamsty | Sinkz | Wraps,Aspiring,Aspiring,Aspiring,Aspiring,Crafting,Piracy,Piracy,Crafting,Piracy,Crafting,Carousing,Crafting,Piracy,Carousing,Piracy,Piracy,Carousing,Piracy,Piracy,Piracy,Crafting,Carousing,Piracy,Carousing,Piracy,Crafting,Novice,Apprentice,Novice,Solid,Narrow,Novice,Novice,Apprentice,Narrow,Novice,Narrow,Apprentice,Neophyte,Solid,Novice,Novice,Novice,Novice,Novice,Novice,Solid,Neophyte,Able,Able,Able,Ultimate,Proficient,Able,Able,Renowned,Renowned,Able,Proficient,Respected,Respected,Respected,Able,Able,Able,Able,Proficient,Able,Respected,Proficient
Wargrade,https://emerald.puzzlepirates.com/yoweb/pirate.wm?classic=false&target=wargrade,,Captain,Nap Specialist,Nightfall,Prince,Deadlock,Stowaway,Cryo Island Navy,Puffin,0,,0,,0,,1,Caddyshack on Admiral Island,0,,Aspiring,Aspiring,Aspiring,Aspiring,Crafting,Piracy,Piracy,Crafting,Piracy,Crafting,Carousing,Crafting,Piracy,Carousing,Piracy,Piracy,Carousing,Piracy,Piracy,Piracy,Crafting,Carousing,Piracy,Carousing,Piracy,Crafting,Novice,Novice,Novice,Novice,Novice,Novice,Novice,Novice,Novice,Novice,Novice,Novice,Novice,Novice,Novice,Novice,Novice,Novice,Novice,Novice,Novice,Novice,Able,Able,Able,Able,Able,Able,Able,Able,Able,Able,Able,Able,Able,Able,Able,Able,Able,Able,Able,Able,Able,Able
