Graymouser,https://emerald.puzzlepirates.com/yoweb/pirate.wm?classic=false&target=graymouser,http://emerald.puzzlepirates.com/media/emerald/portraits/2ce/71dfee1b11a760da7f4d1b86bf9c0.jpg,Senior Officer,,Cheers,Lord,Ad Finem Maris,Lieutenant,Alkaid Island Navy,Ursa,0,,0,,1,Graymouser's Tailoring Stall on Pukru Island,5,Sigil Shack on Sayers Rock | Caddyshack on Admiral Island | Past Tents on Greenwich Island | Just a Bungalow on Caravanserai Island | Liana Villa on Alkaid Island,0,,Aspiring,Aspiring,Obscure,Aspiring,Crafting,Piracy,Piracy,Crafting,Piracy,Crafting,Carousing,Crafting,Piracy,Carousing,Piracy,Piracy,Carousing,Piracy,Piracy,Piracy,Crafting,Carousing,Piracy,Carousing,Piracy,Crafting,Narrow,Paragon,Broad,Weighty,Weighty,Neophyte,Novice,Solid,Solid,Novice,Neophyte,Apprentice,Solid,Narrow,Apprentice,Expert,Solid,Novice,Narrow,Apprentice,Solid,Expert,Proficient,Renowned,Proficient,Proficient,Distinguished,Able,Distinguished,Legendary,Proficient,Distinguished,Able,Proficient,Proficient,Proficient,Proficient,Renowned,Proficient,Able,Proficient,Proficient,Distinguished,Legendary
Gusher,https://emerald.puzzlepirates.com/yoweb/pirate.wm?classic=false&target=gusher,http://emerald.puzzlepirates.com/media/emerald/portraits/dc7/fee0d7ab3bca586e60101075d47df.jpg,Senior Officer,First Mate,The Salty Splatoon,Member,Party On Olympus,Admiral,Admiral Island Navy,Gull,1,Ships For Days on Sayers Rock,0,,0,,4,Caddyshack on Admiral Island | Cabin Fever on Admiral Island | Bungalow Bill on Admiral Island | Keep Calm and Love King Kong on Alkaid Island,5,Alykat | Crip | Jezerbell | Mattystrong | Rojavey,Aspiring,Aspiring,Aspiring,Aspiring,Crafting,Piracy,Piracy,Crafting,Piracy,Crafting,Carousing,Crafting,Piracy,Carousing,Piracy,Piracy,Carousing,Piracy,Piracy,Piracy,Crafting,Carousing,Piracy,Carousing,Piracy,Crafting,Narrow,Narrow,Revered,Narrow,Paragon,Novice,Narrow,Solid,Weighty,Expert,Paragon,Weighty,Solid,Illustrious,Narrow,Narrow,Expert,Solid,Solid,Narrow,Illustrious,Neophyte,Proficient,Distinguished,Legendary,Proficient,Legendary,Able,Respected,Ultimate,Distinguished,Ultimate,Legendary,Legendary,Distinguished,Ultimate,Able,Proficient,Legendary,Respected,Legendary,Proficient,Renowned,Proficient
Toastyboy,https://emerald.puzzlepirates.com/yoweb/pirate.wm?classic=false&target=toastyboy,http://emerald.puzzlepirates.com/media/emerald/portraits/5bf/d8b0f1f035311585b06a5d7c75808.jpg,Captain,,Keep Going,Prince,Ad Finem Maris,Captain,Admiral Island Navy,Gull,2,Toasty Tonics on Barbary Island | Toasty Balls on Barbary Island,5,Salty Remedies on Sayers Rock | Big Ball Energy on Sayers Rock | Cannon Balls & Swords on Alkaid Island | Negra Arroyo Lane on Alkaid Island | Salty Balls on Sayers Rock,2,Toastyboy's Tailoring Stall on Barbary Island | Toastyboy's Distilling Stall on Barbary Island,6,Pine Boxes on Aimuari Island | Bedside Manors on Admiral Island | Bringing Town the House on Admiral Island | Bringing Town the House on Admiral Island | Bedside Manors on Admiral Island | Only a Manor of Time on Aimuari Island,0,,Renowned,Illustrious,Illustrious,Rumored,Crafting,Piracy,Piracy,Crafting,Piracy,Crafting,Carousing,Crafting,Piracy,Carousing,Piracy,Piracy,Carousing,Piracy,Piracy,Piracy,Crafting,Carousing,Piracy,Carousing,Piracy,Crafting,Solid,Weighty,Sublime,Solid,Paragon,Broad,Apprentice,Solid,Expert,Neophyte,Paragon,Expert,Weighty,Illustrious,Broad,Weighty,Solid,Narrow,Solid,Narrow,Sublime,Broad,Distinguished,Master,Legendary,Master,Grand-Master,Proficient,Able,Ultimate,Proficient,Proficient,Grand-Master,Legendary,Legendary,Legendary,Master,Master,Proficient,Proficient,Legendary,Distinguished,Distinguished,Respected
Ulygold,https://emerald.puzzlepirates.com/yoweb/pirate.wm?classic=false&target=ulygold,http://emerald.puzzlepirates.com/media/emerald/portraits/25f/ad56761afd6c258ee9ad609592b1a.jpg,Senior Officer,Troublemaker,Bomb It Like It's Hot,Prince,Bombaholics Anonymous,Lieutenant,Tumult Island Navy,Canis,3,Big Beautiful Ball on Sayers Rock | Unstable Concoction on Sayers Rock | Snoop Forge on Armstrong Island,4,The Way You Make Me Steel on Caravanserai Island | Weaving in Traffic on Sayers Rock | Cursed Cauldron on Alkaid Island | Pimps N Potions on Arakoua Island,1,Lozenger's Apothecary Stall on Chachapoya Island,11,Caddyshack on Admiral Island | Aural Shacks on Bowditch Island | Bungalow Bill on Admiral Island | Villa of the Damned on Aimuari Island | Got Your Girlfriend on Sayers Rock | Mirror Mirror Hanging On The Wall on Sayers Rock | Krypton Kottage on Barbary Island | Sherlock Homes on Doyle Island | Bedside Manors on Admiral Island | Bedside Manors on Admiral Island | Tortilla Villas on Chachapoya Island,0,,Aspiring,Eminent,Celebrated,Aspiring,Crafting,Piracy,Piracy,Crafting,Piracy,Crafting,Carousing,Crafting,Piracy,Carousing,Piracy,Piracy,Carousing,Piracy,Piracy,Piracy,Crafting,Carousing,Piracy,Carousing,Piracy,Crafting,Solid,Expert,Paragon,Solid,Paragon,Neophyte,Neophyte,Solid,Weighty,Novice,Solid,Solid,Broad,Illustrious,Narrow,Weighty,Solid,Neophyte,Solid,Neophyte,Illustrious,Solid,Proficient,Distinguished,Master,Master,Respected,Proficient,Proficient,Distinguished,Distinguished,Able,Proficient,Grand-Master,Grand-Master,Legendary,Master,Respected,Distinguished,Distinguished,Proficient,Proficient,Distinguished,Respected
Xanorth,https://emerald.puzzlepirates.com/yoweb/pirate.wm?classic=false&target=xanorth,http://emerald.puzzlepirates.com/media/emerald/portraits/3cd/d3078adba9fb28997f49a65e6b401.jpg,Captain,Wildcard,Chaotic Disposition,,,Lieutenant Commander,Aimuari Island Navy,Orion,0,,0,,0,,3,Minute House on Greenwich Island | Cabin Fever on Admiral Island | Villa of the Damned on Aimuari Island,0,,Rumored,Renowned,Celebrated,Aspiring,Crafting,Piracy,Piracy,Crafting,Piracy,Crafting,Carousing,Crafting,Piracy,Carousing,Piracy,Piracy,Carousing,Piracy,Piracy,Piracy,Crafting,Carousing,Piracy,Carousing,Piracy,Crafting,Apprentice,Solid,Solid,Narrow,Illustrious,Apprentice,Novice,Solid,Solid,Novice,Solid,Narrow,Solid,Solid,Apprentice,Narrow,Weighty,Novice,Narrow,Neophyte,Expert,Neophyte,Proficient,Respected,Respected,Able,Legendary,Able,Distinguished,Legendary,Distinguished,Able,Proficient,Distinguished,Master,Proficient,Master,Proficient,Distinguished,Able,Legendary,Distinguished,Respected,Proficient
Dalnoth,https://emerald.puzzlepirates.com/yoweb/pirate.wm?classic=false&target=Dalnoth,http://emerald.puzzlepirates.com/media/emerald/portraits/358/84d081ed5804148db25fae7b08f32.jpg,Captain,,- Virtute et Armis -,King,Don't Open Till Doomsday,Commander,Admiral Island Navy,Gull,4,Blackjack Betty on Armstrong Island | Warship's Eulogy on Aimuari Island | Bar With No Name on Barbary Island | Bring Out Your Thread on Aimuari Island,12,A Stitch In Time on Aimuari Island | Sink Factory on Admiral Island | Dr Doom's Dyes on Barbary Island | Gun Clappers on Barbary Island | Cool Ocean Shipyard on Arakoua Island | How Tee Vest Waz Won on Admiral Island | Cannonballs Do Migrate on Bowditch Island | Old Shipyard on Admiral Island | King's Iron on Admiral Island | Rhesus Pieces on Alkaid Island | National Paint's on Admiral Island | Gucci Gang on Admiral Island,0,,16,The Cuckoo's Nest on Quetzal Island | Cottagious Disease on Aimuari Island | King Kottage on Admiral Island | Eazy Street on Armstrong Island | The Cuckoo's Nest on Quetzal Island | Row Me Daddy on Admiral Island | Mayfair Mansions on Pukru Island | Mayfair Mansions on Pukru Island | Death Row on Aimuari Island | Only a Manor of Time on Aimuari Island | Makavilli on Armstrong Island | Villa of the Damned on Aimuari Island | Villa Las Vegas on Admiral Island | Cthulhu Mansion on Admiral Island | The Great Estate on Admiral Island | Guardians of the Gallery on Admiral Island,0,,Rumored,Celebrated,Established,Aspiring,Crafting,Piracy,Piracy,Crafting,Piracy,Crafting,Carousing,Crafting,Piracy,Carousing,Piracy,Piracy,Carousing,Piracy,Piracy,Piracy,Crafting,Carousing,Piracy,Carousing,Piracy,Crafting,Narrow,Expert,Revered,Broad,Paragon,Narrow,Solid,Narrow,Expert,Solid,Illustrious,Neophyte,Sublime,Broad,Paragon,Illustrious,Weighty,Solid,Revered,Broad,Weighty,Neophyte,Proficient,Legendary,Grand-Master,Proficient,Ultimate,Proficient,Master,Proficient,Legendary,Renowned,Grand-Master,Proficient,Distinguished,Distinguished,Ultimate,Master,Respected,Respected,Ultimate,Distinguished,Ultimate,Able
Codefish,https://emerald.puzzlepirates.com/yoweb/pirate.wm?classic=false&target=codefish,http://emerald.puzzlepirates.com/media/emerald/portraits/403/9310083f9632cc71c5bad6cd583ae.jpg,Captain,,Silver Storm,Princess,Don't Open Till Doomsday,Admiral,Sayers Rock Navy,Ursa,2,Cool Ocean Shipyard on Arakoua Island | Wicked Stitch of the Vest on Sayers Rock,9,Unicorn Blood on Aimuari Island | Sink Factory on Admiral Island | The Night Tables on Admiral Island | Basilisk's Fang on Aimuari Island | Old Shipyard on Admiral Island | All Dyes On You on Admiral Island | Living Death on Aimuari Island | King's Iron on Admiral Island | National Paint's on Admiral Island,0,,28,Homestead Hut on Lincoln Island | Caddyshack on Admiral Island | Sigil Shack on Sayers Rock | The Cuckoo's Nest on Quetzal Island | Pine Boxes on Aimuari Island | Sidekick Shacks on Barbary Island | Love Shack on Caravanserai Island | Shacky Doo on Hubble's Eye | Jurassic Shack on Arakoua Island | The Dove Shack on Armstrong Island | Stab In Cabin on Aimuari Island | King Kottage on Admiral Island | Row Me Daddy on Admiral Island | Jonestown Houses on Aimuari Island | A Jacuzzi on Sayers Rock | The Great Estate on Admiral Island | Pine Boxes on Aimuari Island | King Kottage on Admiral Island | Cottagious Disease on Aimuari Island | Bringing Town the House on Admiral Island | Bedside Manors on Admiral Island | Bedside Manors on Admiral Island | Chatham Manor on Lincoln Island | Only a Manor of Time on Aimuari Island | Villa Las Vegas on Admiral Island | Cthulhu Mansion on Admiral Island | Dead Mansion Walking on Aimuari Island | Guardians of the Gallery on Admiral Island,0,,Aspiring,Aspiring,Aspiring,Aspiring,Crafting,Piracy,Piracy,Crafting,Piracy,Crafting,Carousing,Crafting,Piracy,Carousing,Piracy,Piracy,Carousing,Piracy,Piracy,Piracy,Crafting,Carousing,Piracy,Carousing,Piracy,Crafting,Illustrious,Illustrious,Revered,Weighty,Illustrious,Expert,Narrow,Sublime,Illustrious,Solid,Revered,Illustrious,Paragon,Expert,Solid,Exalted,Illustrious,Solid,Solid,Broad,Illustrious,Expert,Master,Respected,Proficient,Proficient,Proficient,Proficient,Able,Respected,Able,Legendary,Proficient,Distinguished,Legendary,Able,Proficient,Distinguished,Proficient,Respected,Able,Proficient,Distinguished,Respected
Drinkkoolaid,https://emerald.puzzlepirates.com/yoweb/pirate.wm?classic=false&target=drinkkoolaid,,Senior Officer,,- Virtute et Armis -,Princess,Don't Open Till Doomsday,Stowaway,Admiral Island Navy,Gull,0,,0,,0,,4,Caddyshack on Admiral Island | The Dove Shack on Armstrong Island | Bungalow Bill on Admiral Island | Bungalow Bill on Admiral Island,1,Bungeegum,Aspiring,Aspiring,Noted,Aspiring,Crafting,Piracy,Piracy,Crafting,Piracy,Crafting,Carousing,Crafting,Piracy,Carousing,Piracy,Piracy,Carousing,Piracy,Piracy,Piracy,Crafting,Carousing,Piracy,Carousing,Piracy,Crafting,Novice,Narrow,Apprentice,Novice,Broad,Novice,Novice,Novice,Novice,Novice,Narrow,Novice,Weighty,Novice,Novice,Apprentice,Novice,Illustrious,Weighty,Novice,Broad,Novice,Able,Able,Able,Able,Proficient,Able,Able,Able,Able,Proficient,Proficient,Able,Master,Proficient,Able,Proficient,Able,Grand-Master,Grand-Master,Proficient,Proficient,Able
Imgonnanut,https://emerald.puzzlepirates.com/yoweb/pirate.wm?classic=false&target=imgonnanut,,Fleet Officer,,Keyboard Warrior,Princess,Don't Open Till Doomsday,Sailor,Admiral Island Navy,Gull,0,,0,,0,,1,Milkshack on Wensleydale,0,,Aspiring,Aspiring,Aspiring,Aspiring,Crafting,Piracy,Piracy,Crafting,Piracy,Crafting,Carousing,Crafting,Piracy,Carousing,Piracy,Piracy,Carousing,Piracy,Piracy,Piracy,Crafting,Carousing,Piracy,Carousing,Piracy,Crafting,Novice,Solid,Apprentice,Novice,Broad,Novice,Novice,Apprentice,Narrow,Novice,Neophyte,Novice,Weighty,Novice,Novice,Broad,Narrow,Novice,Narrow,Novice,Novice,Novice,Able,Proficient,Able,Able,Legendary,Able,Proficient,Legendary,Legendary,Able,Proficient,Able,Able,Able,Proficient,Ultimate,Respected,Distinguished,Renowned,Proficient,Able,Able
Misstrix,https://emerald.puzzlepirates.com/yoweb/pirate.wm?classic=false&target=misstrix,http://emerald.puzzlepirates.com/media/emerald/portraits/b68/f32304379ad7e03de08779aa88acb.jpg,Senior Officer,,Keyboard Warrior,Princess,Don't Open Till Doomsday,Stowaway,Admiral Island Navy,Gull,0,,0,,0,,1,Aural Shacks on Bowditch Island,0,,Aspiring,Aspiring,Aspiring,Aspiring,Crafting,Piracy,Piracy,Crafting,Piracy,Crafting,Carousing,Crafting,Piracy,Carousing,Piracy,Piracy,Carousing,Piracy,Piracy,Piracy,Crafting,Carousing,Piracy,Carousing,Piracy,Crafting,Neophyte,Broad,Weighty,Novice,Novice,Novice,Novice,Solid,Apprentice,Novice,Solid,Solid,Neophyte,Neophyte,Novice,Solid,Broad,Novice,Novice,Novice,Neophyte,Novice,Able,Renowned,Proficient,Able,Able,Able,Able,Proficient,Proficient,Able,Proficient,Distinguished,Proficient,Able,Proficient,Distinguished,Proficient,Able,Proficient,Able,Able,Able
Sscc,https://emerald.puzzlepirates.com/yoweb/pirate.wm?classic=false&target=sscc,http://emerald.puzzlepirates.com/media/emerald/portraits/738/21996baf4aa953f73fa7410cff047.jpg,Captain,Cook,Bax,Prince,Don't Open Till Doomsday,Lieutenant Commander,Admiral Island Navy,Gull,7,Sink Factory on Admiral Island | All Dyes On You on Admiral Island | King's Iron on Admiral Island | King's Chair on Admiral Island | National Paint's on Admiral Island | Old Shipyard on Admiral Island | Gucci Gang on Admiral Island,2,The Night Tables on Admiral Island | Cool Ocean Shipyard on Arakoua Island,0,,11,Sea Shack on Scrimshaw Island | Caddyshack on Admiral Island | Love Shack on Caravanserai Island | Bungalow Bill on Admiral Island | King Kottage on Admiral Island | Row Me Daddy on Admiral Island | Caddyshack on Admiral Island | Bungalow Bill on Admiral Island | Row Me Daddy on Admiral Island | Villa Las Vegas on Admiral Island | The Great Estate on Admiral Island,28,Aazy | Bobswald | Cairna | Carpaccio | Daeris | Dalnoth | Eyad | Hesperus | Icefiredad | Incineration | Joshsivils | Kingofthewar | Liud | Mahsa | Mahta | Mfw | Muli | Pasteyman | Ractor | Shadowiie | Shar | Shroomy | Sidero | Tempix | Texnikos | Tswifty | Tzz | Wowriver,Aspiring,Aspiring,Rumored,Aspiring,Crafting,Piracy,Piracy,Crafting,Piracy,Crafting,Carousing,Crafting,Piracy,Carousing,Piracy,Piracy,Carousing,Piracy,Piracy,Piracy,Crafting,Carousing,Piracy,Carousing,Piracy,Crafting,Narrow,Solid,Solid,Apprentice,Paragon,Solid,Narrow,Narrow,Solid,Novice,Solid,Broad,Illustrious,Weighty,Neophyte,Solid,Narrow,Narrow,Expert,Neophyte,Solid,Solid,Proficient,Ultimate,Respected,Able,Distinguished,Able,Master,Able,Distinguished,Distinguished,Respected,Respected,Ultimate,Renowned,Master,Distinguished,Able,Distinguished,Legendary,Proficient,Master,Respected
Robinhoodx,https://emerald.puzzlepirates.com/yoweb/pirate.wm?classic=false&target=robinhoodx,http://emerald.puzzlepirates.com/media/emerald/portraits/12b/d77d112d0e68939997449e440fc8f.jpg,Senior Officer,,Thank You Next,King,Pull Out,Lieutenant Commander,Admiral Island Navy,Gull,4,Trade Winds on Scrimshaw Island | Trap House on Scrimshaw Island | Reef Reelators on Scrimshaw Island | So Frigging Low on Sayers Rock,7,Rent Free Graveyards on Aimuari Island | Dawn of the Deed on Aimuari Island | Loaded Balls on Sayers Rock | Trap House on Sayers Rock | Trance Estate on Sayers Rock | Kitty City on Iocane Island | Frigged up on Iocane Island,3,Robinhoodx's Apothecary Stall on Scrimshaw Island | Robinhoodx's Apothecary Stall on Admiral Island | Robinaltx's Apothecary Stall on Admiral Island,7,The Dove Shack on Armstrong Island | Cabin Fever on Admiral Island | Stab In Cabin on Aimuari Island | Bungalow Bill on Admiral Island | Caddyshack on Admiral Island | Bringing Town the House on Admiral Island | The Great Estate on Admiral Island,0,,Rumored,Eminent,Established,Aspiring,Crafting,Piracy,Piracy,Crafting,Piracy,Crafting,Carousing,Crafting,Piracy,Carousing,Piracy,Piracy,Carousing,Piracy,Piracy,Piracy,Crafting,Carousing,Piracy,Carousing,Piracy,Crafting,Solid,Weighty,Broad,Apprentice,Solid,Novice,Narrow,Solid,Broad,Illustrious,Narrow,Apprentice,Revered,Solid,Apprentice,Paragon,Weighty,Expert,Expert,Weighty,Solid,Neophyte,Distinguished,Ultimate,Distinguished,Able,Master,Able,Able,Able,Grand-Master,Ultimate,Able,Respected,Ultimate,Renowned,Able,Master,Distinguished,Renowned,Legendary,Master,Able,Proficient
Bobswald,https://emerald.puzzlepirates.com/yoweb/pirate.wm?classic=false&target=bobswald,http://emerald.puzzlepirates.com/media/emerald/portraits/4cc/ed9584d3dfe5b0c1e4770abac50b7.jpg,Senior Officer,,Atlantean Explorers,Prince,Pull Out,Apprentice Sailor,Admiral Island Navy,Gull,0,,1,Labyrinth on Caravanserai Island,0,,2,Caddyshack on Admiral Island | Bringing Town the House on Admiral Island,8,Anchovia | Cairna | Dagnanlian | Iwnabeu | Joshsivils | Ltrekess | Sscc | Yassenn,Aspiring,Aspiring,Aspiring,Aspiring,Crafting,Piracy,Piracy,Crafting,Piracy,Crafting,Carousing,Crafting,Piracy,Carousing,Piracy,Piracy,Carousing,Piracy,Piracy,Piracy,Crafting,Carousing,Piracy,Carousing,Piracy,Crafting,Neophyte,Narrow,Broad,Novice,Weighty,Apprentice,Novice,Novice,Narrow,Narrow,Solid,Novice,Solid,Narrow,Novice,Solid,Novice,Apprentice,Solid,Novice,Apprentice,Novice,Proficient,Master,Master,Able,Legendary,Proficient,Able,Able,Proficient,Master,Master,Able,Grand-Master,Legendary,Proficient,Grand-Master,Able,Proficient,Renowned,Proficient,Respected,Able
Cencul,https://emerald.puzzlepirates.com/yoweb/pirate.wm?classic=false&target=cencul,http://emerald.puzzlepirates.com/media/emerald/portraits/d61/c8fb688b128907e81a951fcff2cb0.jpg,Captain,,Forward,Prince,Pull Out,Lieutenant,Admiral Island Navy,Gull,0,,3,Reef Reelators on Scrimshaw Island | Trap House on Admiral Island | The Boys on Admiral Island,1,Xii's Tailoring Stall on Pukru Island,3,Cabin Fever on Admiral Island | Bungalow Bill on Admiral Island | The Great Estate on Admiral Island,1,Xii,Aspiring,Aspiring,Aspiring,Aspiring,Crafting,Piracy,Piracy,Crafting,Piracy,Crafting,Carousing,Crafting,Piracy,Carousing,Piracy,Piracy,Carousing,Piracy,Piracy,Piracy,Crafting,Carousing,Piracy,Carousing,Piracy,Crafting,Weighty,Solid,Solid,Solid,Solid,Weighty,Broad,Narrow,Broad,Solid,Weighty,Weighty,Transcendent,Solid,Broad,Solid,Solid,Broad,Solid,Broad,Solid,Solid,Ultimate,Ultimate,Ultimate,Ultimate,Ultimate,Ultimate,Ultimate,Ultimate,Legendary,Ultimate,Ultimate,Ultimate,Ultimate,Ultimate,Ultimate,Ultimate,Legendary,Legendary,Ultimate,Ultimate,Ultimate,Ultimate
Discriminate,https://emerald.puzzlepirates.com/yoweb/pirate.wm?classic=false&target=discriminate,http://emerald.puzzlepirates.com/media/emerald/portraits/2eb/da280e2d7a2480453d650673a37cd.jpg,Senior Officer,Ambassador,Thank You Next,Prince,Pull Out,Lieutenant,Admiral Island Navy,Gull,5,Rent Free Graveyards on Aimuari Island | Iron Factory on Aimuari Island | Dawn of the Deed on Aimuari Island | Ships For Days on Aimuari Island | Sales from the Crypt on Aimuari Island,6,King's Landing on Wissahickon Island | Trap House on Sayers Rock | Trap House on Scrimshaw Island | The Boys on Admiral Island | Trap House on Admiral Island | So Frigging Low on Sayers Rock,3,Robinhoodx's Apothecary Stall on Admiral Island | Robinaltx's Apothecary Stall on Admiral Island | Robinhoodx's Apothecary Stall on Scrimshaw Island,16,Pine Boxes on Aimuari Island | Milkshack on Wensleydale | Shack Macaque on Alkaid Island | Caddyshack on Admiral Island | Homestead Hut on Lincoln Island | Shack eel Oh Kneel on Blackthorpe Island | Cabin Fever on Admiral Island | Bringing Town the House on Admiral Island | Bedside Manors on Admiral Island | The Cuckoo's Nest on Quetzal Island | Love Shack on Caravanserai Island | Cabin Fever on Admiral Island | Bungalow Bill on Admiral Island | Bringing Town the House on Admiral Island | Bringing Town the House on Admiral Island | Villa Las Vegas on Admiral Island,0,,Aspiring,Aspiring,Illustrious,Aspiring,Crafting,Piracy,Piracy,Crafting,Piracy,Crafting,Carousing,Crafting,Piracy,Carousing,Piracy,Piracy,Carousing,Piracy,Piracy,Piracy,Crafting,Carousing,Piracy,Carousing,Piracy,Crafting,Apprentice,Solid,Expert,Narrow,Solid,Novice,Novice,Solid,Solid,Expert,Solid,Solid,Sublime,Narrow,Neophyte,Weighty,Solid,Novice,Weighty,Neophyte,Solid,Neophyte,Proficient,Legendary,Grand-Master,Proficient,Proficient,Able,Proficient,Proficient,Distinguished,Ultimate,Proficient,Master,Master,Proficient,Able,Distinguished,Proficient,Distinguished,Legendary,Proficient,Respected,Proficient
Joshsivils,https://emerald.puzzlepirates.com/yoweb/pirate.wm?classic=false&target=joshsivils,http://emerald.puzzlepirates.com/media/emerald/portraits/c0a/e7aef844953cab85421729b820c99.jpg,Captain,Explorer,Atlantean Explorers,Prince,Pull Out,Commander,Admiral Island Navy,Gull,3,House of the Undying on Wissahickon Island | Castle Black on Wissahickon Island | King's Landing on Wissahickon Island,1,Pirates Pantaloons on Scrimshaw Island,0,,3,Caddyshack on Admiral Island | Caddyshack on Admiral Island | Villa Las Vegas on Admiral Island,21,Accoutre | Aeri | Amaliie | Anchovia | Bobswald | Cairna | Caitman | Captnpugwash | Caramaria | Dagnanlian | Daquan | Flourish | Hellacious | Jevons | Kikkit | Kingtomy | Ltrekess | Maeven | Seepnah | Sscc | Yassenn,Aspiring,Eminent,Illustrious,Aspiring,Crafting,Piracy,Piracy,Crafting,Piracy,Crafting,Carousing,Crafting,Piracy,Carousing,Piracy,Piracy,Carousing,Piracy,Piracy,Piracy,Crafting,Carousing,Piracy,Carousing,Piracy,Crafting,Solid,Expert,Sublime,Broad,Illustrious,Narrow,Solid,Solid,Paragon,Weighty,Weighty,Novice,Illustrious,Expert,Solid,Expert,Weighty,Solid,Illustrious,Solid,Paragon,Narrow,Distinguished,Ultimate,Grand-Master,Able,Ultimate,Proficient,Master,Respected,Grand-Master,Ultimate,Ultimate,Able,Proficient,Ultimate,Legendary,Ultimate,Respected,Respected,Legendary,Respected,Ultimate,Distinguished
Kushlorde,https://emerald.puzzlepirates.com/yoweb/pirate.wm?classic=false&target=kushlorde,http://emerald.puzzlepirates.com/media/emerald/portraits/d65/bcbc34b38a10713d30485cad62340.jpg,Senior Officer,,Forward,Princess,Pull Out,Commander,Admiral Island Navy,Gull,6,Woof Over Yer Head on Spaniel Island | Flea Market on Spaniel Island | Off Pace Weaving on Alkaid Island | Scottish Parliament on Spaniel Island | Bronx Zoo on Paihia Island | Trap House on Admiral Island,5,My Face When on Caravanserai Island | Dawn of the Deed on Aimuari Island | Backwoods on Paihia Island | The Boys on Admiral Island | Reef Reelators on Scrimshaw Island,5,Kushlorde's Weaving Stall on Scrimshaw Island | Kushlorde's Apothecary Stall on Scrimshaw Island | Cazix's Tailoring Stall on Wensleydale | Twitcher's Tailoring Stall on Aimuari Island | Kyubi's Tailoring Stall on Admiral Island,27,Shack eel Oh Kneel on Blackthorpe Island | The Cuckoo's Nest on Quetzal Island | Caddyshack on Admiral Island | King Kottage on Admiral Island | Row Me Daddy on Admiral Island | Villa Las Vegas on Admiral Island | Sea Shack on Scrimshaw Island | Sea Shack on Scrimshaw Island | Minute House on Greenwich Island | Caddyshack on Admiral Island | Caddyshack on Admiral Island | Caddyshack on Admiral Island | Caddyshack on Admiral Island | Caddyshack on Admiral Island | Sigil Shack on Sayers Rock | Milkshack on Wensleydale | Bungalow Bill on Admiral Island | King Kottage on Admiral Island | King Kottage on Admiral Island | Mayfair Mansions on Pukru Island | Jonestown Houses on Aimuari Island | Bedside Manors on Admiral Island | Villa of the Damned on Aimuari Island | Villa Las Vegas on Admiral Island | Villa Las Vegas on Admiral Island | Cthulhu Mansion on Admiral Island | Poseidon's Castle on Scrimshaw Island,21,Absence | Ashluv | Cazix | Cencul | Crowtit | Derivatives | Discriminate | Duskrager | Emraey | Kinkthings | Lengthy | Lowery | Maeven | Mockworld | Outlander | Rinhart | Rosieex | Toribuggy | Twitcher | Veerlon | Xii,Rumored,Illustrious,Celebrated,Aspiring,Crafting,Piracy,Piracy,Crafting,Piracy,Crafting,Carousing,Crafting,Piracy,Carousing,Piracy,Piracy,Carousing,Piracy,Piracy,Piracy,Crafting,Carousing,Piracy,Carousing,Piracy,Crafting,Weighty,Solid,Revered,Solid,Expert,Novice,Narrow,Expert,Weighty,Apprentice,Paragon,Expert,Expert,Exalted,Narrow,Weighty,Broad,Novice,Solid,Narrow,Revered,Weighty,Distinguished,Able,Master,Proficient,Able,Able,Able,Distinguished,Able,Proficient,Renowned,Renowned,Legendary,Legendary,Able,Proficient,Able,Able,Proficient,Proficient,Distinguished,Distinguished
