Toraken,https://emerald.puzzlepirates.com/yoweb/pirate.wm?classic=false&target=toraken,http://emerald.puzzlepirates.com/media/emerald/portraits/3ee/94e0338af7be4794b5caf77c19277.jpg,Senior Officer,,Euthanasia,Prince,No Strings Attached,Captain,Kiwara Island Navy,Ibis,2,Ships Attached on Bowditch Island | Strings Attached on Bowditch Island,6,The Philippine Swill and Grog on Scrimshaw Island | Tora the Explorer on Gauntlet Island | Ancient Craftsman on Admiral Island | Balls Attached on Kiwara Island | The Pines on Kiwara Island | Wonder Weaves on Barbary Island,1,Fools's Apothecary Stall on Admiral Island,14,Shack eel Oh Kneel on Blackthorpe Island | Shack Macaque on Alkaid Island | Sidekick Shacks on Barbary Island | Caddyshack on Admiral Island | Aural Shacks on Bowditch Island | Jurassic Shack on Arakoua Island | Sea Shack on Scrimshaw Island | Love Shack on Caravanserai Island | Bungalow Bill on Admiral Island | Bringing Town the House on Admiral Island | Milkshack on Wensleydale | Bungalow Bill on Admiral Island | Bedside Manors on Admiral Island | The Great Estate on Admiral Island,0,,Aspiring,Aspiring,Aspiring,Aspiring,Crafting,Piracy,Piracy,Crafting,Piracy,Crafting,Carousing,Crafting,Piracy,Carousing,Piracy,Piracy,Carousing,Piracy,Piracy,Piracy,Crafting,Carousing,Piracy,Carousing,Piracy,Crafting,Broad,Solid,Solid,Narrow,Solid,Neophyte,Neophyte,Solid,Expert,Narrow,Weighty,Solid,Expert,Solid,Apprentice,Weighty,Broad,Narrow,Solid,Neophyte,Expert,Narrow,Proficient,Legendary,Proficient,Able,Proficient,Proficient,Able,Master,Grand-Master,Distinguished,Distinguished,Master,Proficient,Proficient,Master,Distinguished,Distinguished,Respected,Able,Proficient,Able,Able
Cozi,https://emerald.puzzlepirates.com/yoweb/pirate.wm?classic=false&target=cozi,http://emerald.puzzlepirates.com/media/emerald/portraits/240/614dacb29b23a45ab5d8899f9b26b.jpg,Senior Officer,Portrait Painter,Euthanasia,Lord,No Strings Attached,Lieutenant,Barbary Island Navy,Ibis,9,Sanctuary for Sin on Kasidim Island | Dinosaur Court on Arakoua Island | Forbidden Fruits on Kasidim Island | Balls Mafia on Barbary Island | Altered Reality on Kasidim Island | K TWO on Arakoua Island | Balls Attached on Kiwara Island | Buffalo Trace on Barbary Island | The Pines on Kiwara Island,8,Ball Busters on Barbary Island | Ironically on Barbary Island | Chair Witch Project on Barbary Island | Bang from Downtown on Blackthorpe Island | The Unions Alehouse on Barbary Island | Pacts on Papyrus and Parchment on Arakoua Island | Gentleman's Quarterly on Barbary Island | Wonder Weaves on Barbary Island,6,Cozi's Distilling Stall on Blackthorpe Island | Cozi's Furnishing Stall on Greenwich Island | Cozi's Apothecary Stall on Greenwich Island | Cozi's Tailoring Stall on Admiral Island | Quap's Furnishing Stall on Greenwich Island | Yrn's Apothecary Stall on Greenwich Island,10,Shadow Cabin on Barbary Island | Krypton Kottage on Barbary Island | Gardens of Babylon on Kasidim Island | Villa of the Damned on Aimuari Island | Guardians of the Gallery on Barbary Island | Caddyshack on Admiral Island | Bungalow Bill on Admiral Island | Jonestown Houses on Aimuari Island | Villayria on Barbary Island | Villa Las Vegas on Admiral Island,1,Quapozi,Aspiring,Established,Illustrious,Obscure,Crafting,Piracy,Piracy,Crafting,Piracy,Crafting,Carousing,Crafting,Piracy,Carousing,Piracy,Piracy,Carousing,Piracy,Piracy,Piracy,Crafting,Carousing,Piracy,Carousing,Piracy,Crafting,Solid,Solid,Weighty,Solid,Weighty,Broad,Neophyte,Broad,Solid,Solid,Solid,Solid,Paragon,Broad,Narrow,Weighty,Novice,Solid,Weighty,Apprentice,Paragon,Novice,Distinguished,Legendary,Respected,Distinguished,Distinguished,Proficient,Proficient,Proficient,Proficient,Legendary,Respected,Master,Respected,Proficient,Master,Respected,Able,Master,Master,Proficient,Proficient,Able
Ekzo,https://emerald.puzzlepirates.com/yoweb/pirate.wm?classic=false&target=ekzo,http://emerald.puzzlepirates.com/media/emerald/portraits/f91/8a0fc0d473a81bb756684346e94ba.jpg,Senior Officer,,Euthanasia,Lord,No Strings Attached,Admiral,Barbary Island Navy,Ibis,3,Crazy Potions on Barbary Island | Fort Grievous on Gauntlet Island | Tora the Explorer on Gauntlet Island,1,Molten Metals on Caravanserai Island,1,Ekzo's Apothecary Stall on Sayers Rock,2,Manor of Steel on Barbary Island | Guardians of the Gallery on Barbary Island,25,Aimela | Akantha | Blackcannons | Blackied | Candymandan | Capnray | Capy | Chefdavid | Cozi | Demeo | Evoli | Finbarr | Fools | Heilheidi | Ltrekess | Luckysox | Omaris | Peaced | Quap | Sexiwench | Skaterkid | Tascruns | Triplem | Wipley | Zava,Rumored,Celebrated,Celebrated,Aspiring,Crafting,Piracy,Piracy,Crafting,Piracy,Crafting,Carousing,Crafting,Piracy,Carousing,Piracy,Piracy,Carousing,Piracy,Piracy,Piracy,Crafting,Carousing,Piracy,Carousing,Piracy,Crafting,Solid,Solid,Expert,Solid,Expert,Solid,Narrow,Solid,Expert,Broad,Solid,Solid,Weighty,Solid,Narrow,Weighty,Solid,Narrow,Paragon,Neophyte,Solid,Broad,Grand-Master,Legendary,Legendary,Distinguished,Legendary,Proficient,Respected,Respected,Renowned,Grand-Master,Renowned,Renowned,Respected,Legendary,Master,Grand-Master,Respected,Respected,Ultimate,Proficient,Grand-Master,Distinguished
Obaider,https://emerald.puzzlepirates.com/yoweb/pirate.wm?classic=false&target=obaider,http://emerald.puzzlepirates.com/media/emerald/portraits/19e/64705a2bed47f8e3c74536ba07395.jpg,Captain,Monster Hunter,PALACTION,Lord,No Strings Attached,Chief Petty Officer,Admiral Island Navy,Gull,0,,1,I'm a LumberJacket and I'm OK on Bowditch Island,0,,11,Caddyshack on Admiral Island | Pine Boxes on Aimuari Island | Death Row on Aimuari Island | Only a Manor of Time on Aimuari Island | Cabin Fever on Admiral Island | Cabin Fever on Admiral Island | Bedside Manors on Admiral Island | Bedside Manors on Admiral Island | Castle Arrrrrrrrrrggghh on Bowditch Island | Guardians of the Gallery on Admiral Island | Guardians of the Gallery on Barbary Island,1,Delores,Rumored,Celebrated,Illustrious,Aspiring,Crafting,Piracy,Piracy,Crafting,Piracy,Crafting,Carousing,Crafting,Piracy,Carousing,Piracy,Piracy,Carousing,Piracy,Piracy,Piracy,Crafting,Carousing,Piracy,Carousing,Piracy,Crafting,Solid,Weighty,Expert,Neophyte,Solid,Neophyte,Apprentice,Weighty,Weighty,Narrow,Solid,Solid,Illustrious,Solid,Broad,Solid,Broad,Neophyte,Weighty,Broad,Illustrious,Solid,Proficient,Legendary,Respected,Able,Proficient,Able,Proficient,Legendary,Proficient,Master,Proficient,Master,Grand-Master,Distinguished,Respected,Respected,Proficient,Proficient,Proficient,Distinguished,Distinguished,Master
Senga,https://emerald.puzzlepirates.com/yoweb/pirate.wm?classic=false&target=senga,http://emerald.puzzlepirates.com/media/emerald/portraits/79d/42bf63a26e94ebaffffbeb5ecc7e1.jpg,Captain,Bilge Rat,Hardcore Sea Ravers,Queen,Symonds Says,Admiral,Basset Island Navy,Gull,7,Due or Dye on Admiral Island | Toilet Paper Balls on Barbary Island | Ninny Knickers on Admiral Island | Fort Influential on Basset Island | Rums on Bowditch Island | Ten Things I Crate About You on Admiral Island | Brassy Balls on Basset Island,8,Red Red Rum on Caravanserai Island | Elixir of Love on Caravanserai Island | Iron Heart on Caravanserai Island | Frig on a Lease on Caravanserai Island | Naughty Balls on Aimuari Island | Calm Seas Blacksmith on Caravanserai Island | Timely Fashion on Greenwich Island | Naughty Shots on Aimuari Island,4,Guesswhoit's Distilling Stall on Hubble's Eye | Banishdemons's Ironworking Stall on The Lowland Hundred | Banishdemons's Distilling Stall on The Lowland Hundred | Cazl's Shipbuilding Stall on Isle of Kent,22,Milkshack on Wensleydale | Riemann Slums on Descartes Isle | Homestead Hut on Lincoln Island | Caddyshack on Admiral Island | Rho House on Descartes Isle | Shack eel Oh Kneel on Blackthorpe Island | Love Shack on Caravanserai Island | Love Shack on Caravanserai Island | Caddyshack on Admiral Island | Riemann Slums on Descartes Isle | Stab In Cabin on Aimuari Island | Cypress Cabins on Alkaid Island | King Kottage on Admiral Island | Row Me Daddy on Admiral Island | Bringing Town the House on Admiral Island | Only a Manor of Time on Aimuari Island | Bedside Manors on Admiral Island | The Great Estate on Admiral Island | The Great Estate on Admiral Island | Guardians of the Gallery on Admiral Island | Guardians of the Gallery on Admiral Island | Dream On on Caravanserai Island,1,Robee,Noted,Rumored,Renowned,Aspiring,Crafting,Piracy,Piracy,Crafting,Piracy,Crafting,Carousing,Crafting,Piracy,Carousing,Piracy,Piracy,Carousing,Piracy,Piracy,Piracy,Crafting,Carousing,Piracy,Carousing,Piracy,Crafting,Sublime,Illustrious,Exalted,Expert,Exalted,Illustrious,Solid,Illustrious,Illustrious,Solid,Sublime,Solid,Illustrious,Exalted,Broad,Paragon,Sublime,Narrow,Solid,Weighty,Paragon,Expert,Master,Proficient,Proficient,Proficient,Proficient,Proficient,Able,Legendary,Able,Grand-Master,Distinguished,Master,Grand-Master,Distinguished,Able,Proficient,Able,Distinguished,Able,Proficient,Legendary,Distinguished
Alitar,https://emerald.puzzlepirates.com/yoweb/pirate.wm?classic=false&target=alitar,http://emerald.puzzlepirates.com/media/emerald/portraits/6a1/6f2f40c2e445ef13b10d6d1a89d76.jpg,Captain,,Gondolin,Prince,Symonds Says,Lieutenant,Aimuari Island Navy,Orion,1,Harland Ships on Aimuari Island,3,Ping Ping Rubber Docks on Aimuari Island | Fabric Fix on Aimuari Island | Brassy Balls on Basset Island,1,Cupcakie's Ironworking Stall on Chachapoya Island,4,Pine Boxes on Aimuari Island | Only a Manor of Time on Aimuari Island | Mayfair Mansions on Pukru Island | Tomb of the Hallowed Soul on Aimuari Island,0,,Aspiring,Noted,Obscure,Aspiring,Crafting,Piracy,Piracy,Crafting,Piracy,Crafting,Carousing,Crafting,Piracy,Carousing,Piracy,Piracy,Carousing,Piracy,Piracy,Piracy,Crafting,Carousing,Piracy,Carousing,Piracy,Crafting,Novice,Weighty,Weighty,Broad,Weighty,Novice,Novice,Broad,Paragon,Narrow,Paragon,Narrow,Solid,Illustrious,Narrow,Narrow,Expert,Broad,Broad,Novice,Expert,Broad,Able,Legendary,Distinguished,Proficient,Proficient,Able,Able,Legendary,Master,Respected,Grand-Master,Respected,Distinguished,Grand-Master,Proficient,Proficient,Master,Master,Grand-Master,Proficient,Master,Master
Cazl,https://emerald.puzzlepirates.com/yoweb/pirate.wm?classic=false&target=cazl,http://emerald.puzzlepirates.com/media/emerald/portraits/62e/3341689a65555a8321698db2877c4.jpg,Captain,Siren,Ult naughty ones,Princess,Symonds Says,Admiral,Aimuari Island Navy,Orion,2,Naughty Balls on Aimuari Island | Naughty Shots on Aimuari Island,6,Due or Dye on Admiral Island | Toilet Paper Balls on Barbary Island | Ninny Knickers on Admiral Island | Fort Influential on Basset Island | Ten Things I Crate About You on Admiral Island | Brassy Balls on Basset Island,1,Cazl's Shipbuilding Stall on Isle of Kent,20,Shack Macaque on Alkaid Island | Adobe Abode on Chachapoya Island | Caddyshack on Admiral Island | Cabin Fever on Admiral Island | Cypress Cabins on Alkaid Island | Bungalow Bill on Admiral Island | Mayfair Mansions on Pukru Island | Bringing Town the House on Admiral Island | Emu-ving on Up on Quetzal Island | Live Organ Townhouses on Bowditch Island | Me So Homey on Armstrong Island | Only a Manor of Time on Aimuari Island | Villa of the Damned on Aimuari Island | Dead Mansion Walking on Aimuari Island | Stab In Cabin on Aimuari Island | King Kottage on Admiral Island | Emu-ving on Up on Quetzal Island | Bringing Town the House on Admiral Island | Bedside Manors on Admiral Island | The Great Estate on Admiral Island,2,Rilee | Snakegirly,Established,Renowned,Renowned,Aspiring,Crafting,Piracy,Piracy,Crafting,Piracy,Crafting,Carousing,Crafting,Piracy,Carousing,Piracy,Piracy,Carousing,Piracy,Piracy,Piracy,Crafting,Carousing,Piracy,Carousing,Piracy,Crafting,Solid,Neophyte,Illustrious,Illustrious,Transcendent,Weighty,Novice,Paragon,Broad,Novice,Neophyte,Neophyte,Neophyte,Exalted,Narrow,Expert,Paragon,Novice,Broad,Novice,Illustrious,Expert,Proficient,Able,Proficient,Proficient,Respected,Proficient,Distinguished,Distinguished,Respected,Able,Proficient,Distinguished,Proficient,Distinguished,Proficient,Proficient,Able,Able,Grand-Master,Proficient,Able,Proficient
Eltaro,https://emerald.puzzlepirates.com/yoweb/pirate.wm?classic=false&target=eltaro,http://emerald.puzzlepirates.com/media/emerald/portraits/9c1/9c0af4f91c9584c7e4ab37af79716.jpg,Senior Officer,Counselor,Hardcore Sea Ravers,Prince,Symonds Says,Admiral,Admiral Island Navy,Gull,0,,3,Ninny Knickers on Admiral Island | Fort Influential on Basset Island | Brassy Balls on Basset Island,0,,6,Milkshack on Wensleydale | Bedside Manors on Admiral Island | Villa Las Vegas on Admiral Island | King Kottage on Admiral Island | Dead Mansion Walking on Aimuari Island | Guardians of the Gallery on Admiral Island,2,Galantis | Smellsweird,Established,Illustrious,Celebrated,Obscure,Crafting,Piracy,Piracy,Crafting,Piracy,Crafting,Carousing,Crafting,Piracy,Carousing,Piracy,Piracy,Carousing,Piracy,Piracy,Piracy,Crafting,Carousing,Piracy,Carousing,Piracy,Crafting,Solid,Paragon,Sublime,Weighty,Paragon,Broad,Narrow,Weighty,Sublime,Broad,Expert,Solid,Expert,Expert,Narrow,Expert,Broad,Narrow,Solid,Broad,Sublime,Broad,Distinguished,Respected,Distinguished,Able,Distinguished,Able,Proficient,Legendary,Able,Distinguished,Able,Renowned,Renowned,Renowned,Respected,Distinguished,Able,Distinguished,Renowned,Proficient,Able,Proficient
Smurfysenga,https://emerald.puzzlepirates.com/yoweb/pirate.wm?classic=false&target=smurfysenga,,Captain,,The Cade Crew,Princess,Symonds Says,Petty Officer,Basset Island Navy,Gull,0,,0,,0,,2,Homestead Hut on Lincoln Island | Was A Marked Down Shack on Wissahickon Island,14,Altos | Brummies | Cazl | Clockwatcher | Cupcakeze | Deadwill | Jollyana | Marmy | Mrmoneyboy | Robee | Senga | Sethsea | Shiri | Specke,Aspiring,Aspiring,Aspiring,Aspiring,Crafting,Piracy,Piracy,Crafting,Piracy,Crafting,Carousing,Crafting,Piracy,Carousing,Piracy,Piracy,Carousing,Piracy,Piracy,Piracy,Crafting,Carousing,Piracy,Carousing,Piracy,Crafting,Apprentice,Narrow,Solid,Neophyte,Solid,Narrow,Novice,Neophyte,Narrow,Novice,Solid,Novice,Apprentice,Solid,Novice,Novice,Neophyte,Novice,Novice,Neophyte,Apprentice,Novice,Proficient,Distinguished,Distinguished,Able,Proficient,Proficient,Able,Proficient,Able,Able,Proficient,Able,Legendary,Distinguished,Able,Able,Able,Able,Grand-Master,Proficient,Legendary,Able
Wiplasher,https://emerald.puzzlepirates.com/yoweb/pirate.wm?classic=false&target=Wiplasher,http://emerald.puzzlepirates.com/media/emerald/portraits/878/0e0eadc0b16377ef2869719172487.jpg,Senior Officer,Drunk,Natural Selection,King,No Bamboozles,Admiral,Blackthorpe Island Navy,Pelican,10,Bird Strike Bargains on Caravanserai Island | Rags to Riches on Caravanserai Island | Sacred Hemp of Ibis on Caravanserai Island | Scourge of Iron on Caravanserai Island | Oops I Whisk'd it Again on Caravanserai Island | Harbor Forge on Barbary Island | Loom 'n' Lyrics on Armstrong Island | No Ship Sherlock on Caravanserai Island | Sew What on Caravanserai Island | Crazy Ship on Barbary Island,14,Bamboozled on Scrimshaw Island | Weave This Cloth on Armstrong Island | Triceracloth on Arakoua Island | Pound One Out on Bowditch Island | Bang from Downtown on Blackthorpe Island | Forty-Two on Kakraphoon Island | Dye For You on Caravanserai Island | Whole Lot of Yachts on Armstrong Island | The Dim-wit Knit-wits on Aimuari Island | Hammer and Hound on Spaniel Island | Dyenamite Spice on Arakoua Island | Lithium Balls on Armstrong Island | Dino Might on Arakoua Island | Ship Happens on Kakraphoon Island,6,Wiplasher's Shipbuilding Stall on Isle of Kent | Wiplasher's Ironworking Stall on The Lowland Hundred | Wiplasher's Weaving Stall on Wensleydale | Amin's Weaving Stall on Wensleydale | Amin's Tailoring Stall on Pukru Island | Martellus's Shipbuilding Stall on Greenwich Island,8,Milkshack on Wensleydale | Caddyshack on Admiral Island | Shack eel Oh Kneel on Blackthorpe Island | Was A Marked Down Shack on Wissahickon Island | Bungalow Bill on Admiral Island | Bedside Manors on Admiral Island | Cthulhu Mansion on Admiral Island | Magical Mystery Mansion on Caravanserai Island,11,Chorleychick | Crazee | Daan | Dragonhelper | Gwilo | Hakerz | Michaelos | Micko | Sacker | Theredwench | Unodos,Aspiring,Established,Illustrious,Aspiring,Crafting,Piracy,Piracy,Crafting,Piracy,Crafting,Carousing,Crafting,Piracy,Carousing,Piracy,Piracy,Carousing,Piracy,Piracy,Piracy,Crafting,Carousing,Piracy,Carousing,Piracy,Crafting,Solid,Weighty,Illustrious,Solid,Expert,Solid,Narrow,Solid,Expert,Narrow,Illustrious,Solid,Solid,Illustrious,Broad,Expert,Weighty,Neophyte,Expert,Narrow,Weighty,Broad,Respected,Proficient,Legendary,Master,Master,Proficient,Able,Master,Distinguished,Proficient,Legendary,Renowned,Grand-Master,Ultimate,Proficient,Distinguished,Grand-Master,Proficient,Master,Proficient,Renowned,Respected
Amin,https://emerald.puzzlepirates.com/yoweb/pirate.wm?classic=false&target=amin,http://emerald.puzzlepirates.com/media/emerald/portraits/2ba/cc6f7f65c7beba068a1379e70f47a.jpg,Captain,Shopkeeper,Money Shot,Prince,No Bamboozles,Ensign,Arakoua Island Navy,Ibis,10,Bamboozled on Scrimshaw Island | Triceracloth on Arakoua Island | Pound One Out on Bowditch Island | Dye For You on Caravanserai Island | The Dim-wit Knit-wits on Aimuari Island | Blow My Bellows on Barbary Island | Hammer and Hound on Spaniel Island | Dyenamite Spice on Arakoua Island | Lithium Balls on Armstrong Island | Dino Might on Arakoua Island,17,Iron Hangar on Bowditch Island | Ah Base on Caravanserai Island | The Half-wit Knit-wits on Admiral Island | Bird Strike Bargains on Caravanserai Island | Rags to Riches on Caravanserai Island | Sacred Hemp of Ibis on Caravanserai Island | The Iron Projectiles on Aimuari Island | Scourge of Iron on Caravanserai Island | Bang from Downtown on Blackthorpe Island | Oops I Whisk'd it Again on Caravanserai Island | Harbor Forge on Barbary Island | Mile High Ballers on Scrimshaw Island | Loom 'n' Lyrics on Armstrong Island | No Ship Sherlock on Caravanserai Island | Sew What on Caravanserai Island | Malice in the Palace on Blackthorpe Island | Iron Core on Aimuari Island,5,Amin's Weaving Stall on Wensleydale | Amin's Tailoring Stall on Pukru Island | Amin's Ironworking Stall on Wensleydale | Wiplasher's Weaving Stall on Wensleydale | Wiplasher's Shipbuilding Stall on Isle of Kent,6,Pine Boxes on Aimuari Island | Shack eel Oh Kneel on Blackthorpe Island | King Kottage on Admiral Island | Bringing Town the House on Admiral Island | Bringing Town the House on Admiral Island | Bedside Manors on Admiral Island,22,Astrangel | Buckets | Capnray | Cinnaman | Embargo | Finbarr | Godoftheseas | Greecefeva | Hamsty | Jakdaniels | Jazz | Jumpyjess | Martellus | Monlizzy | Narp | Pyke | Sinkz | Teabiscuit | Traegs | Umami | Wiplasher | Youngsinatra,Aspiring,Established,Established,Aspiring,Crafting,Piracy,Piracy,Crafting,Piracy,Crafting,Carousing,Crafting,Piracy,Carousing,Piracy,Piracy,Carousing,Piracy,Piracy,Piracy,Crafting,Carousing,Piracy,Carousing,Piracy,Crafting,Weighty,Solid,Broad,Solid,Illustrious,Novice,Novice,Narrow,Solid,Novice,Broad,Broad,Expert,Broad,Neophyte,Solid,Neophyte,Novice,Broad,Novice,Expert,Broad,Renowned,Respected,Proficient,Distinguished,Distinguished,Able,Able,Proficient,Proficient,Able,Able,Proficient,Proficient,Proficient,Able,Distinguished,Able,Able,Proficient,Proficient,Proficient,Distinguished
Hamsty,https://emerald.puzzlepirates.com/yoweb/pirate.wm?classic=false&target=hamsty,http://emerald.puzzlepirates.com/media/emerald/portraits/c3e/d97454868e604daab242bdb453548.jpg,Senior Officer,,Queso De Mondays,Prince,No Bamboozles,Sailor,Kakraphoon Island Navy,Dodo,2,Forty-Two on Kakraphoon Island | Ship Happens on Kakraphoon Island,22,Greece's Pieces on Aimuari Island | Bird Strike Bargains on Caravanserai Island | Bamboozled on Scrimshaw Island | Rags to Riches on Caravanserai Island | Triceracloth on Arakoua Island | Sacred Hemp of Ibis on Caravanserai Island | Don't Weave Me on Aimuari Island | Pound One Out on Bowditch Island | Ball-Mart on Scrimshaw Island | Oops I Whisk'd it Again on Caravanserai Island | Harbor Forge on Barbary Island | Dye For You on Caravanserai Island | Loom 'n' Lyrics on Armstrong Island | Blow My Bellows on Barbary Island | Hammer and Hound on Spaniel Island | Dyenamite Spice on Arakoua Island | Fleet Pics on Caravanserai Island | No Ship Sherlock on Caravanserai Island | Sew What on Caravanserai Island | Dino Might on Arakoua Island | Malice in the Palace on Blackthorpe Island | No Ballboozles on Aimuari Island,0,,11,The Dove Shack on Armstrong Island | Minute House on Greenwich Island | Adobe Abode on Chachapoya Island | Shack eel Oh Kneel on Blackthorpe Island | The Cuckoo's Nest on Quetzal Island | Shack Macaque on Alkaid Island | Was A Marked Down Shack on Wissahickon Island | Sigil Shack on Sayers Rock | Pine Boxes on Aimuari Island | Riemann Slums on Descartes Isle | Bringing Town the House on Admiral Island,0,,Aspiring,Aspiring,Obscure,Aspiring,Crafting,Piracy,Piracy,Crafting,Piracy,Crafting,Carousing,Crafting,Piracy,Carousing,Piracy,Piracy,Carousing,Piracy,Piracy,Piracy,Crafting,Carousing,Piracy,Carousing,Piracy,Crafting,Novice,Weighty,Expert,Neophyte,Narrow,Novice,Novice,Broad,Broad,Novice,Solid,Broad,Weighty,Solid,Neophyte,Neophyte,Solid,Novice,Narrow,Neophyte,Solid,Novice,Able,Able,Respected,Able,Able,Able,Distinguished,Able,Distinguished,Able,Proficient,Respected,Distinguished,Distinguished,Able,Proficient,Proficient,Able,Grand-Master,Distinguished,Distinguished,Able
Martellus,https://emerald.puzzlepirates.com/yoweb/pirate.wm?classic=false&target=martellus,http://emerald.puzzlepirates.com/media/emerald/portraits/b58/d0bad43177ab19df9a41ff6615762.jpg,Captain,Drunk,Queso De Mondays,Princess,No Bamboozles,Petty Officer,Blackthorpe Island Navy,Pelican,3,Trading Block on Blackthorpe Island | Building Dynasties on Blackthorpe Island | Malice in the Palace on Blackthorpe Island,14,Bird Strike Bargains on Caravanserai Island | Bamboozled on Scrimshaw Island | Rags to Riches on Caravanserai Island | Triceracloth on Arakoua Island | Sacred Hemp of Ibis on Caravanserai Island | Scourge of Iron on Caravanserai Island | Bang from Downtown on Blackthorpe Island | Oops I Whisk'd it Again on Caravanserai Island | Harbor Forge on Barbary Island | Dye For You on Caravanserai Island | Loom 'n' Lyrics on Armstrong Island | The Dim-wit Knit-wits on Aimuari Island | Dyenamite Spice on Arakoua Island | No Ship Sherlock on Caravanserai Island,6,Martellus's Ironworking Stall on Blackthorpe Island | Martellus's Distilling Stall on Greenwich Island | Martellus's Apothecary Stall on Greenwich Island | Martellus's Shipbuilding Stall on Greenwich Island | Wiplasher's Ironworking Stall on The Lowland Hundred | Wiplasher's Shipbuilding Stall on Isle of Kent,14,Caddyshack on Admiral Island | Shack eel Oh Kneel on Blackthorpe Island | Sigil Shack on Sayers Rock | Milkshack on Wensleydale | Cabin Fever on Admiral Island | Bungalow Bill on Admiral Island | King Kottage on Admiral Island | Row Me Daddy on Admiral Island | Bringing Town the House on Admiral Island | Caddyshack on Admiral Island | Stab In Cabin on Aimuari Island | Rho House on Descartes Isle | Bringing Town the House on Admiral Island | Bedside Manors on Admiral Island,46,Affame | Beia | Blonde | Bonze | Brocko | Cafefe | Canadagoose | Capnray | Ccarlson | Contressa | Derivatives | Dirtybowdy | Drover | Frostease | Glamourr | Greecefeva | Hamsty | Hellz | Iaago | Jacobdwnunda | Jahron | Jazz | Jerrk | Kizzle | Kushlorde | Lashientax | Maeven | Margaroo | Marioman | Mchicken | Missyfiercer | Narp | Ohmi | Papi | Pedro | Psychi | Shigby | Sonadora | Sonicbang | Sscc | Teabiscuit | Umami | Viator | Walterwhale | Youngsinatra | Zengris,Aspiring,Aspiring,Noted,Aspiring,Crafting,Piracy,Piracy,Crafting,Piracy,Crafting,Carousing,Crafting,Piracy,Carousing,Piracy,Piracy,Carousing,Piracy,Piracy,Piracy,Crafting,Carousing,Piracy,Carousing,Piracy,Crafting,Neophyte,Expert,Weighty,Solid,Solid,Apprentice,Broad,Broad,Solid,Solid,Paragon,Solid,Illustrious,Expert,Solid,Solid,Broad,Narrow,Solid,Narrow,Weighty,Apprentice,Able,Proficient,Respected,Master,Proficient,Able,Proficient,Proficient,Proficient,Legendary,Legendary,Renowned,Master,Legendary,Master,Proficient,Able,Proficient,Proficient,Proficient,Proficient,Able
Ohmi,https://emerald.puzzlepirates.com/yoweb/pirate.wm?classic=false&target=ohmi,http://emerald.puzzlepirates.com/media/emerald/portraits/ff7/ca31a0647854ebf6869e76976c17f.jpg,Captain,Navigator,Splash Warning,Prince,No Bamboozles,Lieutenant,Admiral Island Navy,Gull,1,The Smeltin' Kraken on Aimuari Island,7,Bird Strike Bargains on Caravanserai Island | Oops I Whisk'd it Again on Caravanserai Island | Harbor Forge on Barbary Island | Loom 'n' Lyrics on Armstrong Island | Lithium Balls on Armstrong Island | Sew What on Caravanserai Island | Crazy Ship on Barbary Island,1,Martellus's Apothecary Stall on Greenwich Island,0,,0,,Aspiring,Renowned,Illustrious,Obscure,Crafting,Piracy,Piracy,Crafting,Piracy,Crafting,Carousing,Crafting,Piracy,Carousing,Piracy,Piracy,Carousing,Piracy,Piracy,Piracy,Crafting,Carousing,Piracy,Carousing,Piracy,Crafting,Solid,Solid,Solid,Solid,Paragon,Novice,Broad,Solid,Solid,Solid,Solid,Solid,Paragon,Solid,Broad,Solid,Broad,Neophyte,Solid,Solid,Solid,Narrow,Distinguished,Distinguished,Proficient,Proficient,Master,Able,Able,Proficient,Able,Ultimate,Proficient,Respected,Distinguished,Distinguished,Proficient,Proficient,Proficient,Proficient,Proficient,Master,Proficient,Able
