Pirate Name,Pirate URL,Portrait URL,Crew Rank,Crew Job,Crew Name,Flag Role,Flag Name,Navy Rank,Navy Name,Navy Archipelago,Owns Count,Owns List,Manages Count,Manages List,Stalls Count,Stalls List,Houses Count,Houses List,Hearties Count,Hearties List,Reputation Conqueror,Reputation Explorer,Reputation Magnate,Reputation Patron,Skill Category Alchemistry,Skill Category Battle Navigation,Skill Category Bilging,Skill Category Blacksmithing,Skill Category Carpentry,Skill Category Distilling,Skill Category Drinking,Skill Category Foraging,Skill Category Gunning,Skill Category Hearts,Skill Category Navigating,Skill Category Patching,Skill Category Poker,Skill Category Rigging,Skill Category Rumble,Skill Category Sailing,Skill Category Shipwrightery,Skill Category Spades,Skill Category Swordfighting,Skill Category Treasure Drop,Skill Category Treasure Haul,Skill Category Weaving,Skill Experience Alchemistry,Skill Experience Battle Navigation,Skill Experience Bilging,Skill Experience Blacksmithing,Skill Experience Carpentry,Skill Experience Distilling,Skill Experience Drinking,Skill Experience Foraging,Skill Experience Gunning,Skill Experience Hearts,Skill Experience Navigating,Skill Experience Patching,Skill Experience Poker,Skill Experience Rigging,Skill Experience Rumble,Skill Experience Sailing,Skill Experience Shipwrightery,Skill Experience Spades,Skill Experience Swordfighting,Skill Experience Treasure Drop,Skill Experience Treasure Haul,Skill Experience Weaving,Skill Reputation Alchemistry,Skill Reputation Battle Navigation,Skill Reputation Bilging,Skill Reputation Blacksmithing,Skill Reputation Carpentry,Skill Reputation Distilling,Skill Reputation Drinking,Skill Reputation Foraging,Skill Reputation Gunning,Skill Reputation Hearts,Skill Reputation Navigating,Skill Reputation Patching,Skill Reputation Poker,Skill Reputation Rigging,Skill Reputation Rumble,Skill Reputation Sailing,Skill Reputation Shipwrightery,Skill Reputation Spades,Skill Reputation Swordfighting,Skill Reputation Treasure Drop,Skill Reputation Treasure Haul,Skill Reputation Weaving
Brucemcgaw,https://emerald.puzzlepirates.com/yoweb/pirate.wm?classic=false&target=Brucemcgaw,http://emerald.puzzlepirates.com/media/emerald/portraits/1af/69dfcd151d71879a78ebe3d38623d.jpg,Officer,Shopkeeper,Moolah,Member,Pull Out,Stowaway,Admiral Island Navy,Gull,0,,0,,1,Brucemcgaw's Shipbuilding Stall on Admiral Island,1,Love Shack on Caravanserai Island,43,Alwaysbroke | Beckerz | Bekkyjo | Bilager | Blackjacck | Cazix | Darkmouth | Darkwell | Deckpig | Electricio | Fastugio | Gongfu | Gurlar | Kelsarianna | Kikinoki | Koalaking | Kou | Krash | Legoheads | Longsao | Meowsah | Metapuzzle | Mirru | Missroxy | Msrg | Nautical | Oceanvibe | Oodnadata | Ottilia | Prrettywoman | Rockyb | Ruminmytum | Sparrky | Squares | Teddyb | Tobyeans | Tokkii | Tosikit | Traegs | Wodobols | Xingtairen | Xyc | Yovie,Aspiring,Obscure,Aspiring,Aspiring,Crafting,Piracy,Piracy,Crafting,Piracy,Crafting,Carousing,Crafting,Piracy,Carousing,Piracy,Piracy,Carousing,Piracy,Piracy,Piracy,Crafting,Carousing,Piracy,Carousing,Piracy,Crafting,Apprentice,Solid,Broad,Narrow,Narrow,Broad,Novice,Narrow,Novice,Novice,Narrow,Solid,Weighty,Solid,Neophyte,Broad,Solid,Novice,Neophyte,Neophyte,Expert,Novice,Able,Distinguished,Proficient,Able,Able,Proficient,Able,Distinguished,Able,Able,Able,Distinguished,Renowned,Proficient,Proficient,Proficient,Proficient,Able,Able,Proficient,Respected,Able
Amazingdarts,https://emerald.puzzlepirates.com/yoweb/pirate.wm?classic=false&target=Amazingdarts,http://emerald.puzzlepirates.com/media/emerald/portraits/632/75ddd11b9b0e1a145e49ff12b76c8.jpg,Senior Officer,,The Iron Crown,Member,The Iron Throne,Lieutenant,Arakoua Island Navy,Ibis,2,The Wright Dart on Sayers Rock | The Molten Dart on Sayers Rock,0,,1,Amazingdarts's Weaving Stall on Doyle Island,5,Minute House on Greenwich Island | Homestead Hut on Lincoln Island | Shacky Doo on Hubble's Eye | Eccentric Estates on Arakoua Island | Swamp Castle on Bowditch Island,0,,Aspiring,Rumored,Illustrious,Aspiring,Crafting,Piracy,Piracy,Crafting,Piracy,Crafting,Carousing,Crafting,Piracy,Carousing,Piracy,Piracy,Carousing,Piracy,Piracy,Piracy,Crafting,Carousing,Piracy,Carousing,Piracy,Crafting,Solid,Solid,Solid,Broad,Solid,Neophyte,Neophyte,Neophyte,Solid,Novice,Weighty,Broad,Solid,Weighty,Neophyte,Narrow,Solid,Novice,Narrow,Novice,Solid,Narrow,Distinguished,Master,Proficient,Respected,Distinguished,Able,Proficient,Master,Renowned,Able,Master,Distinguished,Proficient,Respected,Proficient,Proficient,Master,Able,Able,Able,Distinguished,Master
Whitesnakes,https://emerald.puzzlepirates.com/yoweb/pirate.wm?classic=false&target=whitesnakes,http://emerald.puzzlepirates.com/media/emerald/portraits/095/74f42e9de96b102ee9e2a185ed9d3.jpg,Senior Officer,Architect,Mayan Empire,Lord,No Strings Attached,Lieutenant,Admiral Island Navy,Gull,14,Dark Sommeliers on Alkaid Island | Knot So Spicy on Arakoua Island | Kukulkan Spirits on Armstrong Island | Forge of Kukulkan on Alkaid Island | Turn A Blind Dye on Bowditch Island | Threads of Kukulkan on Arakoua Island | Go Float Yourself on Ventress Island | Bedrock Brewery on Arakoua Island | Like A Rolling Forge on Caravanserai Island | Ch'aaj Apothecary on Barbary Island | Jade Industry on Armstrong Island | Distill My Heart on Alkaid Island | Kukulkan Spirits on Barbary Island | Hallow Bastion on Ventress Island,4,Sanctuary for Sin on Kasidim Island | K TWO on Arakoua Island | Balls Mafia on Barbary Island | Buffalo Trace on Barbary Island,5,Whitesnakes's Tailoring Stall on Admiral Island | Whitesnakes's Apothecary Stall on Aimuari Island | Whitesnakes's Apothecary Stall on Admiral Island | Hydroventure's Ironworking Stall on Wissahickon Island | Woodventure's Ironworking Stall on Wissahickon Island,11,Bungalow Bill on Admiral Island | King Kottage on Admiral Island | Row Me Daddy on Admiral Island | Jonestown Houses on Aimuari Island | Bedside Manors on Admiral Island | Villa Las Vegas on Admiral Island | Villa of the Damned on Aimuari Island | Guardians of the Gallery on Admiral Island | King Kottage on Admiral Island | The Great Estate on Admiral Island | Guardians of the Gallery on Barbary Island,2,Auraluna | Waternymph,Renowned,Illustrious,Illustrious,Aspiring,Crafting,Piracy,Piracy,Crafting,Piracy,Crafting,Carousing,Crafting,Piracy,Carousing,Piracy,Piracy,Carousing,Piracy,Piracy,Piracy,Crafting,Carousing,Piracy,Carousing,Piracy,Crafting,Solid,Paragon,Paragon,Solid,Paragon,Novice,Neophyte,Solid,Solid,Neophyte,Solid,Expert,Solid,Illustrious,Apprentice,Solid,Solid,Neophyte,Solid,Neophyte,Sublime,Solid,Distinguished,Distinguished,Grand-Master,Master,Renowned,Able,Distinguished,Ultimate,Proficient,Distinguished,Respected,Renowned,Proficient,Ultimate,Proficient,Proficient,Master,Distinguished,Master,Able,Renowned,Respected
Amazingtarts,https://emerald.puzzlepirates.com/yoweb/pirate.wm?classic=false&target=amazingtarts,http://emerald.puzzlepirates.com/media/emerald/portraits/113/ce8721d73b22a1a4ed9e5ae2c5e14.jpg,Fleet Officer,,Raging Waters,Member,Raging Waters,Stowaway,Sayers Rock Navy,Ursa,0,,2,The Wright Dart on Sayers Rock | The Molten Dart on Sayers Rock,0,,2,Shack Macaque on Alkaid Island | Eccentric Estates on Arakoua Island,1,Amazingdarts,Aspiring,Rumored,Obscure,Aspiring,Crafting,Piracy,Piracy,Crafting,Piracy,Crafting,Carousing,Crafting,Piracy,Carousing,Piracy,Piracy,Carousing,Piracy,Piracy,Piracy,Crafting,Carousing,Piracy,Carousing,Piracy,Crafting,Novice,Neophyte,Apprentice,Apprentice,Novice,Novice,Novice,Neophyte,Novice,Novice,Neophyte,Novice,Novice,Broad,Novice,Novice,Narrow,Novice,Novice,Novice,Novice,Novice,Able,Distinguished,Able,Distinguished,Able,Able,Able,Distinguished,Respected,Able,Able,Able,Able,Proficient,Able,Able,Proficient,Able,Able,Able,Distinguished,Proficient
Drunkdarts,https://emerald.puzzlepirates.com/yoweb/pirate.wm?classic=false&target=drunkdarts,,Pirate,,Mass Extinction,Member,Rude Awakening,Stowaway,The Lowland Hundred Navy,Horse Head,0,,0,,0,,1,Milkshack on Wensleydale,3,Amazingdarts | Captbiology | Deserteagles,Aspiring,Aspiring,Rumored,Aspiring,Crafting,Piracy,Piracy,Crafting,Piracy,Crafting,Carousing,Crafting,Piracy,Carousing,Piracy,Piracy,Carousing,Piracy,Piracy,Piracy,Crafting,Carousing,Piracy,Carousing,Piracy,Crafting,Novice,Novice,Neophyte,Solid,Novice,Novice,Novice,Novice,Novice,Novice,Novice,Novice,Novice,Apprentice,Novice,Novice,Neophyte,Novice,Novice,Novice,Novice,Novice,Able,Able,Proficient,Master,Able,Able,Able,Able,Able,Able,Able,Able,Able,Proficient,Able,Able,Proficient,Able,Able,Able,Able,Proficient
Scozy,https://emerald.puzzlepirates.com/yoweb/pirate.wm?classic=false&target=scozy,http://emerald.puzzlepirates.com/media/emerald/portraits/237/3dc8800fafdcd091d8cb2414eb1e7.jpg,Captain,Warmonger,Washed Up,King,Guppy Gang,Ensign,Alkaid Island Navy,Ursa,12,Primate Realty on Alkaid Island | The Norwood Builder on Doyle Island | Anchor Management on Tumult Island | The Iron Ape on Alkaid Island | Unfortunate on Tumult Island | Alloy Architect on Gallows Island | Progress Pointe on Gallows Island | The Shrine of the Silver Monkey on Alkaid Island | Baker Street on Doyle Island | See Hear Speak and Buy No Evil on Alkaid Island | The Game Is A-Fruit on Doyle Island | Lawless Blonde on Admiral Island,3,Dial M for Madder on Admiral Island | Clothes that Sleigh on Aimuari Island | Grindylows on Scrimshaw Island,0,,20,The Cuckoo's Nest on Quetzal Island | Milkshack on Wensleydale | Caddyshack on Admiral Island | Adobe Abode on Chachapoya Island | Shack eel Oh Kneel on Blackthorpe Island | Homestead Hut on Lincoln Island | Sigil Shack on Sayers Rock | Cambrian Cabins on Arakoua Island | Stab In Cabin on Aimuari Island | Cabin Fever on Admiral Island | Bungalow Bill on Admiral Island | Bunker Bungalow on Lincoln Island | Cheesy Pun on Wensleydale | Bringing Town the House on Admiral Island | Sidekick Shacks on Barbary Island | King Kottage on Admiral Island | Row Me Daddy on Admiral Island | Funky Townhouse on Caravanserai Island | Bedside Manors on Admiral Island | Only a Manor of Time on Aimuari Island,0,,Aspiring,Established,Illustrious,Aspiring,Crafting,Piracy,Piracy,Crafting,Piracy,Crafting,Carousing,Crafting,Piracy,Carousing,Piracy,Piracy,Carousing,Piracy,Piracy,Piracy,Crafting,Carousing,Piracy,Carousing,Piracy,Crafting,Narrow,Weighty,Solid,Solid,Solid,Apprentice,Neophyte,Solid,Weighty,Narrow,Expert,Broad,Sublime,Narrow,Apprentice,Illustrious,Narrow,Broad,Expert,Narrow,Paragon,Weighty,Proficient,Respected,Proficient,Renowned,Master,Able,Proficient,Master,Respected,Master,Master,Distinguished,Proficient,Proficient,Respected,Ultimate,Proficient,Master,Master,Distinguished,Distinguished,Legendary
Swiggity,https://emerald.puzzlepirates.com/yoweb/pirate.wm?classic=false&target=swiggity,http://emerald.puzzlepirates.com/media/emerald/portraits/e39/93c08462ad7bc7da5a157a87e60c2.jpg,Captain,Drunk,Jack Daniels,Lord,Pull Out,Chief Petty Officer,Admiral Island Navy,Gull,0,,0,,0,,5,Caddyshack on Admiral Island | King Kottage on Admiral Island | Cabin Fever on Admiral Island | Bringing Town the House on Admiral Island | Cthulhu Mansion on Admiral Island,2,Avada | Kedavra,Aspiring,Aspiring,Obscure,Aspiring,Crafting,Piracy,Piracy,Crafting,Piracy,Crafting,Carousing,Crafting,Piracy,Carousing,Piracy,Piracy,Carousing,Piracy,Piracy,Piracy,Crafting,Carousing,Piracy,Carousing,Piracy,Crafting,Broad,Weighty,Narrow,Broad,Broad,Solid,Neophyte,Broad,Narrow,Solid,Narrow,Broad,Solid,Narrow,Apprentice,Broad,Narrow,Novice,Narrow,Apprentice,Solid,Neophyte,Proficient,Ultimate,Proficient,Proficient,Proficient,Able,Able,Distinguished,Proficient,Renowned,Able,Able,Proficient,Proficient,Able,Proficient,Able,Able,Able,Proficient,Distinguished,Proficient
Scozydeeds,https://emerald.puzzlepirates.com/yoweb/pirate.wm?classic=false&target=scozydeeds,http://emerald.puzzlepirates.com/media/emerald/portraits/908/b45d71ad9cbfb37ab865290eefd6e.jpg,Captain,,Nein Nein Nein Nein,Prince,Guppy Gang,Chief Petty Officer,Doyle Island Navy,Ursa,0,,0,,0,,6,Sidekick Shacks on Barbary Island | Milkshack on Wensleydale | Sea Shack on Scrimshaw Island | Love Shack on Caravanserai Island | Shack eel Oh Kneel on Blackthorpe Island | Caddyshack on Admiral Island,1,Jobwithme,Aspiring,Obscure,Rumored,Aspiring,Crafting,Piracy,Piracy,Crafting,Piracy,Crafting,Carousing,Crafting,Piracy,Carousing,Piracy,Piracy,Carousing,Piracy,Piracy,Piracy,Crafting,Carousing,Piracy,Carousing,Piracy,Crafting,Novice,Solid,Narrow,Solid,Apprentice,Novice,Novice,Novice,Narrow,Novice,Narrow,Neophyte,Neophyte,Novice,Novice,Solid,Novice,Novice,Novice,Novice,Apprentice,Apprentice,Able,Able,Able,Master,Proficient,Able,Able,Able,Master,Able,Proficient,Proficient,Able,Able,Able,Master,Able,Able,Able,Able,Master,Respected
Crushiie,https://emerald.puzzlepirates.com/yoweb/pirate.wm?classic=false&target=crushiie,http://emerald.puzzlepirates.com/media/emerald/portraits/e90/99f5716ae32b288cd56db7f4c3745.jpg,Captain,,Get Scuppered,Queen,Her Majesties Misfits,Lieutenant,Admiral Island Navy,Gull,0,,0,,0,,6,Jurassic Shack on Arakoua Island | King Kottage on Admiral Island | Bringing Town the House on Admiral Island | Jurassic Shack on Arakoua Island | Villa Las Vegas on Admiral Island | Be Our Guest Gallery on Armstrong Island,0,,Aspiring,Aspiring,Celebrated,Aspiring,Crafting,Piracy,Piracy,Crafting,Piracy,Crafting,Carousing,Crafting,Piracy,Carousing,Piracy,Piracy,Carousing,Piracy,Piracy,Piracy,Crafting,Carousing,Piracy,Carousing,Piracy,Crafting,Apprentice,Broad,Weighty,Solid,Broad,Apprentice,Novice,Solid,Solid,Novice,Solid,Illustrious,Solid,Solid,Broad,Solid,Weighty,Neophyte,Solid,Apprentice,Weighty,Solid,Proficient,Proficient,Proficient,Respected,Proficient,Able,Able,Respected,Able,Able,Proficient,Renowned,Respected,Proficient,Able,Proficient,Distinguished,Proficient,Proficient,Able,Distinguished,Respected
Graysn,https://emerald.puzzlepirates.com/yoweb/pirate.wm?classic=false&target=graysn,http://emerald.puzzlepirates.com/media/emerald/portraits/35f/66eefa189a2576223e5d6dd95af04.jpg,Senior Officer,,The Mob,Prince,Late Night Hoes,Lieutenant,Admiral Island Navy,Gull,0,,3,Blazers of Glory on Admiral Island | Tailor Made on Admiral Island | Dock Dre on Armstrong Island,0,,5,Caddyshack on Admiral Island | The Cuckoo's Nest on Quetzal Island | Love Shack on Caravanserai Island | Cabin Fever on Admiral Island | Bedside Manors on Admiral Island,2,Hielo | Wishfury,Aspiring,Rumored,Established,Noted,Crafting,Piracy,Piracy,Crafting,Piracy,Crafting,Carousing,Crafting,Piracy,Carousing,Piracy,Piracy,Carousing,Piracy,Piracy,Piracy,Crafting,Carousing,Piracy,Carousing,Piracy,Crafting,Narrow,Narrow,Solid,Narrow,Broad,Novice,Novice,Solid,Broad,Novice,Solid,Weighty,Broad,Illustrious,Novice,Broad,Broad,Novice,Weighty,Novice,Illustrious,Solid,Proficient,Distinguished,Master,Proficient,Distinguished,Able,Proficient,Ultimate,Distinguished,Able,Master,Renowned,Proficient,Legendary,Able,Proficient,Respected,Able,Grand-Master,Proficient,Respected,Master
Krimz,https://emerald.puzzlepirates.com/yoweb/pirate.wm?classic=false&target=krimz,http://emerald.puzzlepirates.com/media/emerald/portraits/00c/03ef394460eac6f8842734668c099.jpg,Captain,Prisoner,Trippin Balls,Prince,Bad Trip,Admiral,Admiral Island Navy,Gull,1,Hullucination Harbor on Sayers Rock,1,Your Moist Laundry on Caravanserai Island,0,,2,Bedside Manors on Admiral Island | King Kottage on Admiral Island,0,,Aspiring,Eminent,Celebrated,Aspiring,Crafting,Piracy,Piracy,Crafting,Piracy,Crafting,Carousing,Crafting,Piracy,Carousing,Piracy,Piracy,Carousing,Piracy,Piracy,Piracy,Crafting,Carousing,Piracy,Carousing,Piracy,Crafting,Novice,Solid,Weighty,Apprentice,Sublime,Novice,Novice,Solid,Illustrious,Narrow,Weighty,Weighty,Expert,Narrow,Neophyte,Paragon,Weighty,Apprentice,Weighty,Neophyte,Paragon,Neophyte,Able,Ultimate,Legendary,Proficient,Master,Able,Able,Renowned,Legendary,Master,Proficient,Grand-Master,Able,Able,Master,Grand-Master,Distinguished,Distinguished,Master,Proficient,Respected,Proficient
Rickeh,https://emerald.puzzlepirates.com/yoweb/pirate.wm?classic=false&target=rickeh,http://emerald.puzzlepirates.com/media/emerald/portraits/84c/73f7ebe1fe98f0c915b0c6bd608f2.jpg,Captain,Diplomat,Moolah,Prince,Pull Out,Lieutenant,Admiral Island Navy,Gull,2,Frigged up on Iocane Island | Kitty City on Iocane Island,2,Mastrology on Sayers Rock | Biggie Ballistics on Armstrong Island,7,Rickeh's Distilling Stall on Lincoln Island | Rickeh's Ironworking Stall on Lincoln Island | Rickeh's Ironworking Stall on Greenwich Island | Rickeh's Ironworking Stall on Kasidim Island | Rickeh's Ironworking Stall on Isle of Kent | Laleh's Apothecary Stall on Wensleydale | Rhay's Distilling Stall on Kasidim Island,5,Shack Macaque on Alkaid Island | Caddyshack on Admiral Island | Villa Las Vegas on Admiral Island | Caddyshack on Admiral Island | The Great Estate on Admiral Island,0,,Aspiring,Aspiring,Obscure,Aspiring,Crafting,Piracy,Piracy,Crafting,Piracy,Crafting,Carousing,Crafting,Piracy,Carousing,Piracy,Piracy,Carousing,Piracy,Piracy,Piracy,Crafting,Carousing,Piracy,Carousing,Piracy,Crafting,Solid,Broad,Weighty,Weighty,Paragon,Expert,Neophyte,Narrow,Weighty,Broad,Illustrious,Solid,Expert,Weighty,Broad,Solid,Solid,Solid,Narrow,Apprentice,Paragon,Apprentice,Respected,Ultimate,Renowned,Grand-Master,Grand-Master,Distinguished,Respected,Ultimate,Respected,Master,Legendary,Legendary,Proficient,Ultimate,Respected,Respected,Distinguished,Master,Ultimate,Proficient,Renowned,Distinguished
Cashier,https://emerald.puzzlepirates.com/yoweb/pirate.wm?classic=false&target=cashier,http://emerald.puzzlepirates.com/media/emerald/portraits/845/c1c43a8b2e7d482b080f7e9104a2f.jpg,Senior Officer,Ambassador,The Salty Splatoon,King,Party On Olympus,Lieutenant Commander,Doyle Island Navy,Ursa,0,,2,Salty Remedies on Sayers Rock | Negra Arroyo Lane on Alkaid Island,1,Cashier's Tailoring Stall on Admiral Island,6,Caddyshack on Admiral Island | Milkshack on Wensleydale | Sea Shack on Scrimshaw Island | Bedside Manors on Admiral Island | Tortilla Villas on Chachapoya Island | Keep Calm and Love King Kong on Alkaid Island,1,Jezerbell,Aspiring,Obscure,Rumored,Aspiring,Crafting,Piracy,Piracy,Crafting,Piracy,Crafting,Carousing,Crafting,Piracy,Carousing,Piracy,Piracy,Carousing,Piracy,Piracy,Piracy,Crafting,Carousing,Piracy,Carousing,Piracy,Crafting,Narrow,Weighty,Expert,Solid,Expert,Neophyte,Apprentice,Weighty,Broad,Neophyte,Solid,Weighty,Solid,Illustrious,Neophyte,Narrow,Broad,Novice,Weighty,Broad,Paragon,Weighty,Proficient,Distinguished,Grand-Master,Grand-Master,Master,Able,Able,Ultimate,Proficient,Distinguished,Master,Master,Proficient,Ultimate,Proficient,Able,Master,Able,Master,Respected,Grand-Master,Ultimate
Chefdavid,https://emerald.puzzlepirates.com/yoweb/pirate.wm?classic=false&target=chefdavid,http://emerald.puzzlepirates.com/media/emerald/portraits/3b8/2b6ddb53f4d2aed595ff6eff3e01e.jpg,Senior Officer,Cook,Euthanasia,Prince,No Strings Attached,Petty Officer,Barbary Island Navy,Ibis,5,Hall of Justice on Barbary Island | uballs on Barbary Island | Bananaman on Barbary Island | Daily Plan-It on Barbary Island | Haute Couture Cafe on Sayers Rock,19,Dirty Dyeing on Admiral Island | Gentleman's Quarterly on Barbary Island | Jurassic Arch on Arakoua Island | Blow My Bellows on Barbary Island | Laboratory on Aimuari Island | Frig Off on Barbary Island | Frigate Driver on Admiral Island | Rocket Power on Barbary Island | The Lab on Arakoua Island | Only Frigs on Barbary Island | Skail Spice on Sayers Rock | Sword in the Stone on Admiral Island | Spirited Away on Admiral Island | Kryptonite Concoctions on Barbary Island | Altered Reality on Kasidim Island | Calico Cut Pants on Alkaid Island | Longneck Lager on Arakoua Island | The Crystal Palace on Arakoua Island | Wonder Weaves on Barbary Island,2,Cheesypoofzz's Ironworking Stall on Kasidim Island | Katzecradle's Apothecary Stall on Greenwich Island,8,Sigil Shack on Sayers Rock | Sidekick Shacks on Barbary Island | Cabin Fever on Admiral Island | A Theatre To Watch My Movies on Sayers Rock | Caddyshack on Admiral Island | Tortilla Villas on Chachapoya Island | Villayria on Barbary Island | Guardians of the Gallery on Barbary Island,20,Amayabella | Ashleydawn | Bekwreck | Cozi | Doomkitty | Finbarr | Fools | Goldenbears | Loons | Macsii | Mattrimc | Mrflop | Obaider | Ottilia | Quap | Rockstarg | Senara | Slows | Thelifeofme | Yassenn,Aspiring,Established,Eminent,Aspiring,Crafting,Piracy,Piracy,Crafting,Piracy,Crafting,Carousing,Crafting,Piracy,Carousing,Piracy,Piracy,Carousing,Piracy,Piracy,Piracy,Crafting,Carousing,Piracy,Carousing,Piracy,Crafting,Novice,Expert,Expert,Solid,Novice,Novice,Apprentice,Broad,Narrow,Broad,Narrow,Broad,Solid,Solid,Neophyte,Neophyte,Neophyte,Novice,Broad,Novice,Illustrious,Novice,Able,Ultimate,Proficient,Able,Able,Able,Distinguished,Proficient,Able,Renowned,Able,Proficient,Legendary,Proficient,Distinguished,Able,Able,Able,Able,Able,Able,Able
Chefdavidd,https://emerald.puzzlepirates.com/yoweb/pirate.wm?classic=false&target=chefdavidd,http://emerald.puzzlepirates.com/media/emerald/portraits/9b9/b6388cbde4a0e66bf59d920425441.jpg,Senior Officer,,Friends with Benefits,Member,No Strings Attached,Stowaway,Albatross Island Navy,Osprey,0,,0,,0,,1,Aural Shacks on Bowditch Island,0,,Aspiring,Aspiring,Aspiring,Aspiring,Crafting,Piracy,Piracy,Crafting,Piracy,Crafting,Carousing,Crafting,Piracy,Carousing,Piracy,Piracy,Carousing,Piracy,Piracy,Piracy,Crafting,Carousing,Piracy,Carousing,Piracy,Crafting,Novice,Novice,Novice,Novice,Novice,Novice,Novice,Novice,Narrow,Novice,Novice,Novice,Novice,Novice,Novice,Novice,Novice,Novice,Novice,Novice,Solid,Novice,Able,Able,Able,Able,Able,Able,Able,Able,Able,Able,Able,Able,Able,Able,Able,Able,Able,Able,Able,Able,Able,Able
Danuc,https://emerald.puzzlepirates.com/yoweb/pirate.wm?classic=false&target=danuc,http://emerald.puzzlepirates.com/media/emerald/portraits/533/3b03e2c0ef2208cff5bd16ff9d5b0.jpg,Captain,Strategist,Twisted Minds,Queen,Mind The Gap,Lieutenant,Scrimshaw Island Navy,Stork,9,Ah Rum on Scrimshaw Island | Ah Cloth on Scrimshaw Island | Steel Base on Armstrong Island | Steel Base on Caravanserai Island | Ah Ship on Scrimshaw Island | Steel Base on Barbary Island | Ah Spice on Scrimshaw Island | Your Moist Laundry on Caravanserai Island | Steel Base on Scrimshaw Island,1,Balls Deep on Bowditch Island,1,Danuc's Shipbuilding Stall on Isle of Kent,3,Black Villa Black on Scrimshaw Island | Cottage Cove on Scrimshaw Island | Bedside Manors on Admiral Island,1,Disruptor,Established,Illustrious,Illustrious,Aspiring,Crafting,Piracy,Piracy,Crafting,Piracy,Crafting,Carousing,Crafting,Piracy,Carousing,Piracy,Piracy,Carousing,Piracy,Piracy,Piracy,Crafting,Carousing,Piracy,Carousing,Piracy,Crafting,Novice,Weighty,Illustrious,Weighty,Illustrious,Novice,Novice,Weighty,Solid,Novice,Illustrious,Sublime,Novice,Illustrious,Broad,Solid,Expert,Novice,Broad,Novice,Sublime,Solid,Able,Respected,Grand-Master,Legendary,Legendary,Able,Able,Ultimate,Respected,Able,Grand-Master,Renowned,Able,Master,Master,Master,Grand-Master,Able,Legendary,Able,Renowned,Legendary
Danr,https://emerald.puzzlepirates.com/yoweb/pirate.wm?classic=false&target=danr,http://emerald.puzzlepirates.com/media/emerald/portraits/c99/8645780f88398e3dd3e956bfa76f0.jpg,Senior Officer,,The Mob,Lord,Late Night Hoes,Lieutenant Commander,Admiral Island Navy,Gull,0,,0,,1,Amaliie's Tailoring Stall on Lincoln Island,10,Shack Macaque on Alkaid Island | Pine Boxes on Aimuari Island | Shack eel Oh Kneel on Blackthorpe Island | Caddyshack on Admiral Island | Bedside Manors on Admiral Island | The Dove Shack on Armstrong Island | Past Tents on Greenwich Island | Bringing Town the House on Admiral Island | Villa Las Vegas on Admiral Island | Makavilli on Armstrong Island,0,,Aspiring,Celebrated,Renowned,Aspiring,Crafting,Piracy,Piracy,Crafting,Piracy,Crafting,Carousing,Crafting,Piracy,Carousing,Piracy,Piracy,Carousing,Piracy,Piracy,Piracy,Crafting,Carousing,Piracy,Carousing,Piracy,Crafting,Solid,Broad,Illustrious,Solid,Expert,Apprentice,Narrow,Weighty,Weighty,Apprentice,Solid,Weighty,Solid,Illustrious,Broad,Revered,Broad,Apprentice,Weighty,Narrow,Illustrious,Solid,Respected,Renowned,Ultimate,Grand-Master,Legendary,Able,Respected,Ultimate,Master,Distinguished,Respected,Legendary,Legendary,Ultimate,Master,Ultimate,Distinguished,Distinguished,Grand-Master,Proficient,Respected,Legendary
Hielo,https://emerald.puzzlepirates.com/yoweb/pirate.wm?classic=false&target=hielo,http://emerald.puzzlepirates.com/media/emerald/portraits/e75/b4b72792452ec0702b8b042912683.jpg,Senior Officer,Curmudgeon,Twisted Minds,Lord,Mind The Gap,Admiral,Admiral Island Navy,Gull,1,Tailor Made on Admiral Island,0,,3,Hielo's Apothecary Stall on Admiral Island | Hielo's Ironworking Stall on Admiral Island | Demonologist's Tailoring Stall on Admiral Island,9,Caddyshack on Admiral Island | Pine Boxes on Aimuari Island | Sigil Shack on Sayers Rock | Caddyshack on Admiral Island | Love Shack on Caravanserai Island | Pine Boxes on Aimuari Island | Bungalow Bill on Admiral Island | King Kottage on Admiral Island | Bedside Manors on Admiral Island,2,Graysn | Wishfury,Obscure,Renowned,Noted,Aspiring,Crafting,Piracy,Piracy,Crafting,Piracy,Crafting,Carousing,Crafting,Piracy,Carousing,Piracy,Piracy,Carousing,Piracy,Piracy,Piracy,Crafting,Carousing,Piracy,Carousing,Piracy,Crafting,Neophyte,Solid,Sublime,Solid,Broad,Novice,Apprentice,Solid,Broad,Neophyte,Expert,Solid,Solid,Solid,Narrow,Narrow,Novice,Apprentice,Narrow,Novice,Weighty,Narrow,Able,Master,Ultimate,Grand-Master,Proficient,Able,Distinguished,Master,Able,Distinguished,Legendary,Distinguished,Legendary,Master,Respected,Proficient,Able,Proficient,Able,Proficient,Renowned,Proficient
