Pirate Name,Pirate URL,Portrait URL,Crew Rank,Crew Job,Crew Name,Flag Role,Flag Name,Navy Rank,Navy Name,Navy Archipelago,Owns Count,Owns List,Manages Count,Manages List,Stalls Count,Stalls List,Houses Count,Houses List,Hearties Count,Hearties List,Reputation Conqueror,Reputation Explorer,Reputation Magnate,Reputation Patron,Skill Category Alchemistry,Skill Category Battle Navigation,Skill Category Bilging,Skill Category Blacksmithing,Skill Category Carpentry,Skill Category Distilling,Skill Category Drinking,Skill Category Foraging,Skill Category Gunning,Skill Category Hearts,Skill Category Navigating,Skill Category Patching,Skill Category Poker,Skill Category Rigging,Skill Category Rumble,Skill Category Sailing,Skill Category Shipwrightery,Skill Category Spades,Skill Category Swordfighting,Skill Category Treasure Drop,Skill Category Treasure Haul,Skill Category Weaving,Skill Experience Alchemistry,Skill Experience Battle Navigation,Skill Experience Bilging,Skill Experience Blacksmithing,Skill Experience Carpentry,Skill Experience Distilling,Skill Experience Drinking,Skill Experience Foraging,Skill Experience Gunning,Skill Experience Hearts,Skill Experience Navigating,Skill Experience Patching,Skill Experience Poker,Skill Experience Rigging,Skill Experience Rumble,Skill Experience Sailing,Skill Experience Shipwrightery,Skill Experience Spades,Skill Experience Swordfighting,Skill Experience Treasure Drop,Skill Experience Treasure Haul,Skill Experience Weaving,Skill Reputation Alchemistry,Skill Reputation Battle Navigation,Skill Reputation Bilging,Skill Reputation Blacksmithing,Skill Reputation Carpentry,Skill Reputation Distilling,Skill Reputation Drinking,Skill Reputation Foraging,Skill Reputation Gunning,Skill Reputation Hearts,Skill Reputation Navigating,Skill Reputation Patching,Skill Reputation Poker,Skill Reputation Rigging,Skill Reputation Rumble,Skill Reputation Sailing,Skill Reputation Shipwrightery,Skill Reputation Spades,Skill Reputation Swordfighting,Skill Reputation Treasure Drop,Skill Reputation Treasure Haul,Skill Reputation Weaving
Brucemcgaw,https://emerald.puzzlepirates.com/yoweb/pirate.wm?classic=false&target=Brucemcgaw,http://emerald.puzzlepirates.com/media/emerald/portraits/1af/69dfcd151d71879a78ebe3d38623d.jpg,Officer,Shopkeeper,Moolah,Member,Pull Out,Stowaway,Admiral Island Navy,Gull,0,,0,,1,Brucemcgaw's Shipbuilding Stall on Admiral Island,1,Love Shack on Caravanserai Island,43,Alwaysbroke | Beckerz | Bekkyjo | Bilager | Blackjacck | Cazix | Darkmouth | Darkwell | Deckpig | Electricio | Fastugio | Gongfu | Gurlar | Kelsarianna | Kikinoki | Koalaking | Kou | Krash | Legoheads | Longsao | Meowsah | Metapuzzle | Mirru | Missroxy | Msrg | Nautical | Oceanvibe | Oodnadata | Ottilia | Prrettywoman | Rockyb | Ruminmytum | Sparrky | Squares | Teddyb | Tobyeans | Tokkii | Tosikit | Traegs | Wodobols | Xingtairen | Xyc | Yovie,Aspiring,Rumored,Aspiring,Aspiring,Crafting,Piracy,Piracy,Crafting,Piracy,Crafting,Carousing,Crafting,Piracy,Carousing,Piracy,Piracy,Carousing,Piracy,Piracy,Piracy,Crafting,Carousing,Piracy,Carousing,Piracy,Crafting,Apprentice,Solid,Broad,Narrow,Narrow,Broad,Novice,Narrow,Novice,Novice,Narrow,Solid,Weighty,Solid,Neophyte,Broad,Solid,Novice,Neophyte,Neophyte,Expert,Novice,Able,Distinguished,Proficient,Able,Proficient,Proficient,Able,Proficient,Able,Able,Able,Master,Master,Proficient,Proficient,Proficient,Proficient,Able,Able,Proficient,Respected,Able
Amazingdarts,https://emerald.puzzlepirates.com/yoweb/pirate.wm?classic=false&target=Amazingdarts,http://emerald.puzzlepirates.com/media/emerald/portraits/632/75ddd11b9b0e1a145e49ff12b76c8.jpg,Captain,Tactician,Pound the Alarm,King,Rude Awakening,Lieutenant,Arakoua Island Navy,Ibis,0,,1,Botanical Blades on Sayers Rock,0,,5,Shacky Doo on Hubble's Eye | Homestead Hut on Lincoln Island | Minute House on Greenwich Island | Eccentric Estates on Arakoua Island | Swamp Castle on Bowditch Island,0,,Aspiring,Aspiring,Established,Aspiring,Crafting,Piracy,Piracy,Crafting,Piracy,Crafting,Carousing,Crafting,Piracy,Carousing,Piracy,Piracy,Carousing,Piracy,Piracy,Piracy,Crafting,Carousing,Piracy,Carousing,Piracy,Crafting,Solid,Solid,Solid,Broad,Solid,Neophyte,Neophyte,Neophyte,Solid,Novice,Weighty,Broad,Solid,Weighty,Neophyte,Narrow,Solid,Novice,Narrow,Novice,Solid,Narrow,Distinguished,Master,Proficient,Proficient,Distinguished,Able,Proficient,Renowned,Renowned,Able,Respected,Master,Distinguished,Grand-Master,Proficient,Proficient,Distinguished,Able,Able,Able,Distinguished,Respected
Whitesnakes,https://emerald.puzzlepirates.com/yoweb/pirate.wm?classic=false&target=whitesnakes,http://emerald.puzzlepirates.com/media/emerald/portraits/3c5/03baeb0557e1cc01c0e26be3a17aa.jpg,Senior Officer,Architect,Mayan Empire,Lord,No Strings Attached,Lieutenant,Admiral Island Navy,Gull,15,Jade Industry on Armstrong Island | Knot So Spicy on Arakoua Island | Kukulkan Spirits on Sayers Rock | Threads of Kukulkan on Arakoua Island | Bedrock Brewery on Arakoua Island | Dark Sommeliers on Alkaid Island | Turn A Blind Dye on Bowditch Island | Ch'aaj Apothecary on Barbary Island | Like A Rolling Forge on Caravanserai Island | Kukulkan Spirits on Armstrong Island | Distill My Heart on Alkaid Island | Kukulkan Spirits on Barbary Island | Forge of Kukulkan on Alkaid Island | Balls Attached on Kiwara Island | The Pines on Kiwara Island,5,Buffalo Trace on Barbary Island | Go Float Yourself on Ventress Island | Sanctuary for Sin on Kasidim Island | K TWO on Arakoua Island | Balls Mafia on Barbary Island,5,Whitesnakes's Apothecary Stall on Admiral Island | Whitesnakes's Apothecary Stall on Aimuari Island | Whitesnakes's Tailoring Stall on Admiral Island | Hydroventure's Ironworking Stall on Wissahickon Island | Woodventure's Ironworking Stall on Wissahickon Island,11,Bungalow Bill on Admiral Island | King Kottage on Admiral Island | Row Me Daddy on Admiral Island | Jonestown Houses on Aimuari Island | Bedside Manors on Admiral Island | Villa Las Vegas on Admiral Island | Villa of the Damned on Aimuari Island | Guardians of the Gallery on Admiral Island | King Kottage on Admiral Island | The Great Estate on Admiral Island | Guardians of the Gallery on Barbary Island,2,Auraluna | Waternymph,Renowned,Illustrious,Illustrious,Obscure,Crafting,Piracy,Piracy,Crafting,Piracy,Crafting,Carousing,Crafting,Piracy,Carousing,Piracy,Piracy,Carousing,Piracy,Piracy,Piracy,Crafting,Carousing,Piracy,Carousing,Piracy,Crafting,Solid,Paragon,Paragon,Solid,Expert,Novice,Neophyte,Solid,Solid,Neophyte,Solid,Weighty,Solid,Illustrious,Apprentice,Solid,Solid,Neophyte,Solid,Neophyte,Sublime,Solid,Distinguished,Respected,Grand-Master,Distinguished,Master,Able,Distinguished,Ultimate,Proficient,Distinguished,Respected,Legendary,Able,Ultimate,Proficient,Proficient,Respected,Distinguished,Legendary,Able,Master,Respected
Amazingtarts,https://emerald.puzzlepirates.com/yoweb/pirate.wm?classic=false&target=amazingtarts,,Senior Officer,,Mass Extinction,Member,Rude Awakening,Stowaway,Penobscot Island Navy,Stork,0,,0,,0,,2,Shack Macaque on Alkaid Island | Eccentric Estates on Arakoua Island,3,Amazingdarts | Captbiology | Cptbigbamboo,Aspiring,Aspiring,Aspiring,Aspiring,Crafting,Piracy,Piracy,Crafting,Piracy,Crafting,Carousing,Crafting,Piracy,Carousing,Piracy,Piracy,Carousing,Piracy,Piracy,Piracy,Crafting,Carousing,Piracy,Carousing,Piracy,Crafting,Novice,Neophyte,Apprentice,Apprentice,Novice,Novice,Novice,Neophyte,Novice,Novice,Neophyte,Novice,Novice,Narrow,Novice,Novice,Narrow,Novice,Novice,Novice,Novice,Novice,Able,Able,Able,Proficient,Able,Able,Able,Proficient,Able,Able,Able,Able,Able,Proficient,Able,Able,Proficient,Able,Able,Able,Proficient,Able
Drunkdarts,https://emerald.puzzlepirates.com/yoweb/pirate.wm?classic=false&target=drunkdarts,,Pirate,,Mass Extinction,Member,Rude Awakening,Stowaway,The Lowland Hundred Navy,Horse Head,0,,0,,0,,1,Milkshack on Wensleydale,3,Amazingdarts | Captbiology | Deserteagles,Aspiring,Aspiring,Noted,Aspiring,Crafting,Piracy,Piracy,Crafting,Piracy,Crafting,Carousing,Crafting,Piracy,Carousing,Piracy,Piracy,Carousing,Piracy,Piracy,Piracy,Crafting,Carousing,Piracy,Carousing,Piracy,Crafting,Novice,Novice,Neophyte,Solid,Novice,Novice,Novice,Novice,Novice,Novice,Novice,Novice,Novice,Apprentice,Novice,Novice,Neophyte,Novice,Novice,Novice,Novice,Novice,Able,Able,Proficient,Respected,Able,Able,Able,Able,Able,Able,Able,Able,Able,Proficient,Able,Able,Able,Able,Able,Able,Able,Able
Scozy,https://emerald.puzzlepirates.com/yoweb/pirate.wm?classic=false&target=scozy,http://emerald.puzzlepirates.com/media/emerald/portraits/237/3dc8800fafdcd091d8cb2414eb1e7.jpg,Captain,Warmonger,Washed Up,King,Guppy Gang,Ensign,Alkaid Island Navy,Ursa,5,The Shrine of the Silver Monkey on Alkaid Island | Lawless Blonde on Admiral Island | See Hear Speak and Buy No Evil on Alkaid Island | The Iron Ape on Alkaid Island | Primate Realty on Alkaid Island,3,Clothes that Sleigh on Aimuari Island | Grindylows on Scrimshaw Island | Dial M for Madder on Admiral Island,0,,20,Adobe Abode on Chachapoya Island | Shack eel Oh Kneel on Blackthorpe Island | Milkshack on Wensleydale | Caddyshack on Admiral Island | The Cuckoo's Nest on Quetzal Island | Sigil Shack on Sayers Rock | Homestead Hut on Lincoln Island | Cambrian Cabins on Arakoua Island | Cabin Fever on Admiral Island | Stab In Cabin on Aimuari Island | Bunker Bungalow on Lincoln Island | Bungalow Bill on Admiral Island | Cheesy Pun on Wensleydale | Bringing Town the House on Admiral Island | Sidekick Shacks on Barbary Island | King Kottage on Admiral Island | Row Me Daddy on Admiral Island | Funky Townhouse on Caravanserai Island | Bedside Manors on Admiral Island | Only a Manor of Time on Aimuari Island,0,,Aspiring,Renowned,Illustrious,Aspiring,Crafting,Piracy,Piracy,Crafting,Piracy,Crafting,Carousing,Crafting,Piracy,Carousing,Piracy,Piracy,Carousing,Piracy,Piracy,Piracy,Crafting,Carousing,Piracy,Carousing,Piracy,Crafting,Narrow,Weighty,Solid,Solid,Solid,Apprentice,Neophyte,Solid,Weighty,Narrow,Expert,Broad,Sublime,Narrow,Apprentice,Illustrious,Narrow,Broad,Expert,Narrow,Paragon,Weighty,Proficient,Respected,Proficient,Master,Respected,Able,Proficient,Respected,Respected,Master,Respected,Master,Proficient,Proficient,Master,Ultimate,Proficient,Master,Grand-Master,Distinguished,Distinguished,Legendary
Swiggity,https://emerald.puzzlepirates.com/yoweb/pirate.wm?classic=false&target=swiggity,http://emerald.puzzlepirates.com/media/emerald/portraits/e39/93c08462ad7bc7da5a157a87e60c2.jpg,Captain,Drunk,Jack Daniels,Lord,Pull Out,Chief Petty Officer,Admiral Island Navy,Gull,0,,0,,0,,5,Caddyshack on Admiral Island | King Kottage on Admiral Island | Cabin Fever on Admiral Island | Bringing Town the House on Admiral Island | Cthulhu Mansion on Admiral Island,2,Avada | Kedavra,Aspiring,Aspiring,Rumored,Obscure,Crafting,Piracy,Piracy,Crafting,Piracy,Crafting,Carousing,Crafting,Piracy,Carousing,Piracy,Piracy,Carousing,Piracy,Piracy,Piracy,Crafting,Carousing,Piracy,Carousing,Piracy,Crafting,Broad,Weighty,Narrow,Broad,Broad,Solid,Neophyte,Broad,Narrow,Solid,Narrow,Broad,Solid,Narrow,Apprentice,Broad,Narrow,Novice,Narrow,Apprentice,Solid,Neophyte,Proficient,Ultimate,Proficient,Able,Proficient,Able,Able,Proficient,Proficient,Renowned,Able,Proficient,Proficient,Proficient,Able,Proficient,Able,Able,Able,Proficient,Proficient,Proficient
Scozydeeds,https://emerald.puzzlepirates.com/yoweb/pirate.wm?classic=false&target=scozydeeds,http://emerald.puzzlepirates.com/media/emerald/portraits/908/b45d71ad9cbfb37ab865290eefd6e.jpg,Captain,,Nein Nein Nein Nein,Prince,Guppy Gang,Chief Petty Officer,Doyle Island Navy,Ursa,0,,0,,0,,6,Sea Shack on Scrimshaw Island | Sidekick Shacks on Barbary Island | Caddyshack on Admiral Island | Love Shack on Caravanserai Island | Milkshack on Wensleydale | Shack eel Oh Kneel on Blackthorpe Island,1,Jobwithme,Aspiring,Obscure,Noted,Aspiring,Crafting,Piracy,Piracy,Crafting,Piracy,Crafting,Carousing,Crafting,Piracy,Carousing,Piracy,Piracy,Carousing,Piracy,Piracy,Piracy,Crafting,Carousing,Piracy,Carousing,Piracy,Crafting,Novice,Solid,Narrow,Solid,Apprentice,Novice,Novice,Novice,Narrow,Novice,Narrow,Neophyte,Neophyte,Novice,Novice,Solid,Novice,Novice,Novice,Novice,Apprentice,Apprentice,Able,Able,Able,Respected,Proficient,Able,Able,Able,Master,Able,Proficient,Distinguished,Able,Able,Able,Master,Able,Able,Able,Able,Master,Respected
Crushiie,https://emerald.puzzlepirates.com/yoweb/pirate.wm?classic=false&target=crushiie,http://emerald.puzzlepirates.com/media/emerald/portraits/e90/99f5716ae32b288cd56db7f4c3745.jpg,Captain,,Get Scuppered,Queen,Her Majesties Misfits,Lieutenant,Admiral Island Navy,Gull,0,,0,,0,,6,Jurassic Shack on Arakoua Island | King Kottage on Admiral Island | Bringing Town the House on Admiral Island | Jurassic Shack on Arakoua Island | Villa Las Vegas on Admiral Island | Be Our Guest Gallery on Armstrong Island,0,,Aspiring,Aspiring,Eminent,Aspiring,Crafting,Piracy,Piracy,Crafting,Piracy,Crafting,Carousing,Crafting,Piracy,Carousing,Piracy,Piracy,Carousing,Piracy,Piracy,Piracy,Crafting,Carousing,Piracy,Carousing,Piracy,Crafting,Apprentice,Broad,Weighty,Solid,Broad,Apprentice,Novice,Solid,Solid,Novice,Solid,Illustrious,Solid,Solid,Broad,Solid,Weighty,Neophyte,Solid,Apprentice,Weighty,Solid,Proficient,Proficient,Proficient,Proficient,Proficient,Able,Able,Distinguished,Able,Able,Proficient,Legendary,Respected,Proficient,Able,Proficient,Proficient,Proficient,Proficient,Able,Proficient,Respected
Graysn,https://emerald.puzzlepirates.com/yoweb/pirate.wm?classic=false&target=graysn,http://emerald.puzzlepirates.com/media/emerald/portraits/35f/66eefa189a2576223e5d6dd95af04.jpg,Senior Officer,,The Mob,Prince,Late Night Hoes,Lieutenant,Admiral Island Navy,Gull,5,Desert Rose on Caravanserai Island | Build Me Shelter on Caravanserai Island | Whoops | I Bid it Again on Caravanserai Island | Tailor Made on Admiral Island,2,Blazers of Glory on Admiral Island | Dock Dre on Armstrong Island,0,,5,The Cuckoo's Nest on Quetzal Island | Love Shack on Caravanserai Island | Caddyshack on Admiral Island | Cabin Fever on Admiral Island | Bedside Manors on Admiral Island,2,Hielo | Wishfury,Aspiring,Noted,Renowned,Established,Crafting,Piracy,Piracy,Crafting,Piracy,Crafting,Carousing,Crafting,Piracy,Carousing,Piracy,Piracy,Carousing,Piracy,Piracy,Piracy,Crafting,Carousing,Piracy,Carousing,Piracy,Crafting,Narrow,Narrow,Solid,Narrow,Broad,Novice,Novice,Solid,Broad,Novice,Solid,Weighty,Broad,Illustrious,Novice,Broad,Broad,Novice,Weighty,Novice,Illustrious,Solid,Proficient,Distinguished,Master,Able,Proficient,Able,Proficient,Ultimate,Distinguished,Able,Master,Legendary,Proficient,Legendary,Able,Proficient,Distinguished,Able,Legendary,Proficient,Respected,Master
Krimz,https://emerald.puzzlepirates.com/yoweb/pirate.wm?classic=false&target=krimz,http://emerald.puzzlepirates.com/media/emerald/portraits/00c/03ef394460eac6f8842734668c099.jpg,Captain,Prisoner,Trippin Balls,Prince,Bad Trip,Admiral,Admiral Island Navy,Gull,1,Hullucination Harbor on Sayers Rock,1,Your Moist Laundry on Caravanserai Island,0,,2,Bedside Manors on Admiral Island | King Kottage on Admiral Island,0,,Aspiring,Eminent,Eminent,Aspiring,Crafting,Piracy,Piracy,Crafting,Piracy,Crafting,Carousing,Crafting,Piracy,Carousing,Piracy,Piracy,Carousing,Piracy,Piracy,Piracy,Crafting,Carousing,Piracy,Carousing,Piracy,Crafting,Novice,Solid,Weighty,Apprentice,Illustrious,Novice,Novice,Solid,Illustrious,Narrow,Weighty,Solid,Expert,Narrow,Neophyte,Paragon,Weighty,Apprentice,Weighty,Neophyte,Paragon,Neophyte,Able,Ultimate,Legendary,Proficient,Respected,Able,Able,Grand-Master,Legendary,Master,Proficient,Legendary,Able,Proficient,Master,Grand-Master,Proficient,Distinguished,Grand-Master,Proficient,Respected,Proficient
Rickeh,https://emerald.puzzlepirates.com/yoweb/pirate.wm?classic=false&target=rickeh,http://emerald.puzzlepirates.com/media/emerald/portraits/84c/73f7ebe1fe98f0c915b0c6bd608f2.jpg,Captain,Diplomat,Moolah,Prince,Pull Out,Lieutenant,Admiral Island Navy,Gull,2,Kitty City on Iocane Island | Frigged up on Iocane Island,2,Biggie Ballistics on Armstrong Island | Mastrology on Sayers Rock,7,Rickeh's Ironworking Stall on Lincoln Island | Rickeh's Distilling Stall on Lincoln Island | Rickeh's Ironworking Stall on Isle of Kent | Rickeh's Ironworking Stall on Greenwich Island | Rickeh's Ironworking Stall on Kasidim Island | Laleh's Apothecary Stall on Wensleydale | Rhay's Distilling Stall on Kasidim Island,5,Shack Macaque on Alkaid Island | Caddyshack on Admiral Island | Villa Las Vegas on Admiral Island | Caddyshack on Admiral Island | The Great Estate on Admiral Island,0,,Aspiring,Aspiring,Rumored,Aspiring,Crafting,Piracy,Piracy,Crafting,Piracy,Crafting,Carousing,Crafting,Piracy,Carousing,Piracy,Piracy,Carousing,Piracy,Piracy,Piracy,Crafting,Carousing,Piracy,Carousing,Piracy,Crafting,Solid,Broad,Weighty,Weighty,Paragon,Expert,Neophyte,Narrow,Weighty,Broad,Illustrious,Solid,Expert,Weighty,Broad,Solid,Solid,Solid,Narrow,Apprentice,Paragon,Apprentice,Respected,Ultimate,Grand-Master,Grand-Master,Grand-Master,Distinguished,Distinguished,Ultimate,Respected,Master,Legendary,Legendary,Proficient,Ultimate,Respected,Respected,Proficient,Master,Ultimate,Proficient,Master,Distinguished
Cashier,https://emerald.puzzlepirates.com/yoweb/pirate.wm?classic=false&target=cashier,http://emerald.puzzlepirates.com/media/emerald/portraits/845/c1c43a8b2e7d482b080f7e9104a2f.jpg,Senior Officer,Ambassador,The Salty Splatoon,King,Party On Olympus,Lieutenant Commander,Doyle Island Navy,Ursa,0,,2,Salty Remedies on Sayers Rock | Negra Arroyo Lane on Alkaid Island,1,Cashier's Tailoring Stall on Admiral Island,6,Milkshack on Wensleydale | Caddyshack on Admiral Island | Sea Shack on Scrimshaw Island | Bedside Manors on Admiral Island | Tortilla Villas on Chachapoya Island | Keep Calm and Love King Kong on Alkaid Island,1,Jezerbell,Aspiring,Rumored,Noted,Aspiring,Crafting,Piracy,Piracy,Crafting,Piracy,Crafting,Carousing,Crafting,Piracy,Carousing,Piracy,Piracy,Carousing,Piracy,Piracy,Piracy,Crafting,Carousing,Piracy,Carousing,Piracy,Crafting,Narrow,Weighty,Expert,Solid,Expert,Neophyte,Apprentice,Weighty,Broad,Neophyte,Solid,Weighty,Solid,Illustrious,Neophyte,Narrow,Broad,Novice,Weighty,Broad,Paragon,Weighty,Proficient,Proficient,Legendary,Grand-Master,Master,Able,Able,Ultimate,Proficient,Distinguished,Master,Grand-Master,Proficient,Ultimate,Proficient,Proficient,Respected,Able,Legendary,Respected,Renowned,Ultimate
Chefdavid,https://emerald.puzzlepirates.com/yoweb/pirate.wm?classic=false&target=chefdavid,http://emerald.puzzlepirates.com/media/emerald/portraits/3b8/2b6ddb53f4d2aed595ff6eff3e01e.jpg,Senior Officer,Cook,Euthanasia,Prince,No Strings Attached,Petty Officer,Barbary Island Navy,Ibis,5,Hall of Justice on Barbary Island | Daily Plan-It on Barbary Island | Haute Couture Cafe on Sayers Rock | Bananaman on Barbary Island | uballs on Barbary Island,19,Rocket Power on Barbary Island | Spirited Away on Admiral Island | Frig Off on Barbary Island | Longneck Lager on Arakoua Island | Frigate Driver on Admiral Island | Dirty Dyeing on Admiral Island | Sword in the Stone on Admiral Island | Blow My Bellows on Barbary Island | Laboratory on Aimuari Island | Jurassic Arch on Arakoua Island | Altered Reality on Kasidim Island | Only Frigs on Barbary Island | Kryptonite Concoctions on Barbary Island | The Lab on Arakoua Island | Calico Cut Pants on Alkaid Island | Wonder Weaves on Barbary Island | Gentleman's Quarterly on Barbary Island | Skail Spice on Sayers Rock | The Crystal Palace on Arakoua Island,2,Cheesypoofzz's Ironworking Stall on Kasidim Island | Katzecradle's Apothecary Stall on Greenwich Island,8,Sidekick Shacks on Barbary Island | Sigil Shack on Sayers Rock | Cabin Fever on Admiral Island | A Theatre To Watch My Movies on Sayers Rock | Caddyshack on Admiral Island | Villayria on Barbary Island | Tortilla Villas on Chachapoya Island | Guardians of the Gallery on Barbary Island,18,Amayabella | Ashleydawn | Bekwreck | Cozi | Doomkitty | Finbarr | Fools | Goldenbears | Kamikazi | Macsii | Obaider | Ottilia | Quap | Rockstarg | Senara | Slows | Thelifeofme | Yassenn,Obscure,Renowned,Celebrated,Aspiring,Crafting,Piracy,Piracy,Crafting,Piracy,Crafting,Carousing,Crafting,Piracy,Carousing,Piracy,Piracy,Carousing,Piracy,Piracy,Piracy,Crafting,Carousing,Piracy,Carousing,Piracy,Crafting,Novice,Expert,Expert,Solid,Novice,Novice,Apprentice,Broad,Narrow,Broad,Narrow,Broad,Solid,Solid,Neophyte,Neophyte,Neophyte,Novice,Broad,Novice,Illustrious,Novice,Able,Ultimate,Proficient,Able,Able,Able,Distinguished,Able,Able,Renowned,Able,Respected,Legendary,Proficient,Respected,Able,Able,Able,Able,Able,Able,Able
Chefdavidd,https://emerald.puzzlepirates.com/yoweb/pirate.wm?classic=false&target=chefdavidd,http://emerald.puzzlepirates.com/media/emerald/portraits/9b9/b6388cbde4a0e66bf59d920425441.jpg,Senior Officer,,Friends with Benefits,Member,No Strings Attached,Stowaway,Albatross Island Navy,Osprey,0,,0,,0,,1,Aural Shacks on Bowditch Island,0,,Aspiring,Aspiring,Aspiring,Aspiring,Crafting,Piracy,Piracy,Crafting,Piracy,Crafting,Carousing,Crafting,Piracy,Carousing,Piracy,Piracy,Carousing,Piracy,Piracy,Piracy,Crafting,Carousing,Piracy,Carousing,Piracy,Crafting,Novice,Novice,Novice,Novice,Novice,Novice,Novice,Novice,Narrow,Novice,Novice,Novice,Novice,Novice,Novice,Novice,Novice,Novice,Novice,Novice,Solid,Novice,Able,Able,Able,Able,Able,Able,Able,Able,Able,Able,Able,Able,Able,Able,Able,Able,Able,Able,Able,Able,Able,Able
Danuc,https://emerald.puzzlepirates.com/yoweb/pirate.wm?classic=false&target=danuc,http://emerald.puzzlepirates.com/media/emerald/portraits/1f1/0c4457f5ae7a72577060faf6353b2.jpg,Captain,Strategist,Twisted Minds,Queen,Mind The Gap,Lieutenant,Scrimshaw Island Navy,Stork,9,Ah Cloth on Scrimshaw Island | Ah Spice on Scrimshaw Island | Steel Base on Scrimshaw Island | Your Moist Laundry on Caravanserai Island | Ah Rum on Scrimshaw Island | Steel Base on Armstrong Island | Steel Base on Barbary Island | Steel Base on Caravanserai Island | Ah Ship on Scrimshaw Island,1,Balls Deep on Bowditch Island,1,Danuc's Shipbuilding Stall on Isle of Kent,3,Black Villa Black on Scrimshaw Island | Cottage Cove on Scrimshaw Island | Bedside Manors on Admiral Island,1,Disruptor,Established,Illustrious,Illustrious,Aspiring,Crafting,Piracy,Piracy,Crafting,Piracy,Crafting,Carousing,Crafting,Piracy,Carousing,Piracy,Piracy,Carousing,Piracy,Piracy,Piracy,Crafting,Carousing,Piracy,Carousing,Piracy,Crafting,Novice,Weighty,Illustrious,Weighty,Paragon,Novice,Novice,Weighty,Solid,Novice,Illustrious,Sublime,Novice,Illustrious,Broad,Solid,Expert,Novice,Broad,Novice,Sublime,Solid,Able,Master,Grand-Master,Grand-Master,Grand-Master,Able,Able,Ultimate,Respected,Able,Grand-Master,Legendary,Able,Grand-Master,Renowned,Master,Renowned,Able,Legendary,Able,Legendary,Legendary
Danr,https://emerald.puzzlepirates.com/yoweb/pirate.wm?classic=false&target=danr,http://emerald.puzzlepirates.com/media/emerald/portraits/c99/8645780f88398e3dd3e956bfa76f0.jpg,Senior Officer,,The Mob,Lord,Late Night Hoes,Lieutenant Commander,Admiral Island Navy,Gull,0,,0,,1,Amaliie's Tailoring Stall on Lincoln Island,10,Pine Boxes on Aimuari Island | Shack eel Oh Kneel on Blackthorpe Island | Shack Macaque on Alkaid Island | Caddyshack on Admiral Island | Bedside Manors on Admiral Island | The Dove Shack on Armstrong Island | Past Tents on Greenwich Island | Bringing Town the House on Admiral Island | Makavilli on Armstrong Island | Villa Las Vegas on Admiral Island,0,,Obscure,Eminent,Celebrated,Aspiring,Crafting,Piracy,Piracy,Crafting,Piracy,Crafting,Carousing,Crafting,Piracy,Carousing,Piracy,Piracy,Carousing,Piracy,Piracy,Piracy,Crafting,Carousing,Piracy,Carousing,Piracy,Crafting,Solid,Broad,Illustrious,Solid,Expert,Apprentice,Narrow,Weighty,Weighty,Apprentice,Solid,Weighty,Solid,Illustrious,Broad,Revered,Broad,Apprentice,Weighty,Narrow,Illustrious,Solid,Distinguished,Grand-Master,Ultimate,Renowned,Legendary,Able,Respected,Ultimate,Master,Distinguished,Respected,Legendary,Legendary,Ultimate,Master,Ultimate,Proficient,Distinguished,Legendary,Proficient,Distinguished,Legendary
Hielo,https://emerald.puzzlepirates.com/yoweb/pirate.wm?classic=false&target=hielo,http://emerald.puzzlepirates.com/media/emerald/portraits/e75/b4b72792452ec0702b8b042912683.jpg,Senior Officer,Curmudgeon,Twisted Minds,Lord,Mind The Gap,Admiral,Admiral Island Navy,Gull,0,,1,Tailor Made on Admiral Island,1,Demonologist's Tailoring Stall on Admiral Island,9,Sigil Shack on Sayers Rock | Caddyshack on Admiral Island | Pine Boxes on Aimuari Island | Love Shack on Caravanserai Island | Caddyshack on Admiral Island | Pine Boxes on Aimuari Island | Bungalow Bill on Admiral Island | King Kottage on Admiral Island | Bedside Manors on Admiral Island,2,Graysn | Wishfury,Rumored,Renowned,Established,Aspiring,Crafting,Piracy,Piracy,Crafting,Piracy,Crafting,Carousing,Crafting,Piracy,Carousing,Piracy,Piracy,Carousing,Piracy,Piracy,Piracy,Crafting,Carousing,Piracy,Carousing,Piracy,Crafting,Neophyte,Solid,Sublime,Solid,Broad,Novice,Apprentice,Solid,Broad,Neophyte,Expert,Solid,Solid,Solid,Narrow,Narrow,Novice,Apprentice,Narrow,Novice,Weighty,Narrow,Able,Master,Ultimate,Renowned,Proficient,Able,Proficient,Grand-Master,Able,Distinguished,Grand-Master,Master,Grand-Master,Legendary,Respected,Proficient,Able,Proficient,Able,Proficient,Renowned,Proficient
