Ekzo,https://emerald.puzzlepirates.com/yoweb/pirate.wm?classic=false&target=ekzo,http://emerald.puzzlepirates.com/media/emerald/portraits/f91/8a0fc0d473a81bb756684346e94ba.jpg,Senior Officer,,Euthanasia,Lord,No Strings Attached,Admiral,Barbary Island Navy,Ibis,3,Crazy Potions on Barbary Island | Fort Grievous on Gauntlet Island | Tora the Explorer on Gauntlet Island,1,Molten Metals on Caravanserai Island,0,,2,Manor of Steel on Barbary Island | Guardians of the Gallery on Barbary Island,2,Maybnot | Yourluckyday,Established,Eminent,Established,Aspiring,Crafting,Piracy,Piracy,Crafting,Piracy,Crafting,Carousing,Crafting,Piracy,Carousing,Piracy,Piracy,Carousing,Piracy,Piracy,Piracy,Crafting,Carousing,Piracy,Carousing,Piracy,Crafting,Solid,Solid,Expert,Solid,Expert,Solid,Narrow,Solid,Expert,Broad,Solid,Solid,Weighty,Solid,Narrow,Weighty,Solid,Narrow,Paragon,Neophyte,Solid,Broad,Renowned,Legendary,Legendary,Distinguished,Legendary,Proficient,Respected,Respected,Proficient,Grand-Master,Grand-Master,Renowned,Respected,Legendary,Renowned,Grand-Master,Master,Respected,Ultimate,Proficient,Master,Distinguished
Obaider,https://emerald.puzzlepirates.com/yoweb/pirate.wm?classic=false&target=obaider,http://emerald.puzzlepirates.com/media/emerald/portraits/19e/64705a2bed47f8e3c74536ba07395.jpg,Captain,Monster Hunter,PALACTION,Lord,No Strings Attached,Chief Petty Officer,Admiral Island Navy,Gull,0,,1,I'm a LumberJacket and I'm OK on Bowditch Island,0,,11,Caddyshack on Admiral Island | Pine Boxes on Aimuari Island | Death Row on Aimuari Island | Only a Manor of Time on Aimuari Island | Cabin Fever on Admiral Island | Cabin Fever on Admiral Island | Bedside Manors on Admiral Island | Bedside Manors on Admiral Island | Castle Arrrrrrrrrrggghh on Bowditch Island | Guardians of the Gallery on Admiral Island | Guardians of the Gallery on Barbary Island,1,Delores,Rumored,Noted,Renowned,Aspiring,Crafting,Piracy,Piracy,Crafting,Piracy,Crafting,Carousing,Crafting,Piracy,Carousing,Piracy,Piracy,Carousing,Piracy,Piracy,Piracy,Crafting,Carousing,Piracy,Carousing,Piracy,Crafting,Solid,Weighty,Expert,Neophyte,Solid,Neophyte,Apprentice,Weighty,Weighty,Narrow,Solid,Solid,Illustrious,Solid,Broad,Solid,Broad,Neophyte,Weighty,Broad,Illustrious,Solid,Proficient,Legendary,Respected,Able,Proficient,Able,Distinguished,Legendary,Proficient,Master,Proficient,Master,Proficient,Distinguished,Respected,Respected,Proficient,Proficient,Proficient,Respected,Distinguished,Master
Senga,https://emerald.puzzlepirates.com/yoweb/pirate.wm?classic=false&target=senga,http://emerald.puzzlepirates.com/media/emerald/portraits/79d/42bf63a26e94ebaffffbeb5ecc7e1.jpg,Captain,Bilge Rat,Hardcore Sea Ravers,Queen,Symonds Says,Admiral,Basset Island Navy,Gull,8,Due or Dye on Admiral Island | Toilet Paper Balls on Barbary Island | Ninny Knickers on Admiral Island | Fort Influential on Basset Island | Rums on Bowditch Island | Ten Things I Crate About You on Admiral Island | Brassy Balls on Basset Island | Salem Seven Supplies on Sayers Rock,8,Red Red Rum on Caravanserai Island | Elixir of Love on Caravanserai Island | Iron Heart on Caravanserai Island | Frig on a Lease on Caravanserai Island | Naughty Balls on Aimuari Island | Calm Seas Blacksmith on Caravanserai Island | Timely Fashion on Greenwich Island | Naughty Shots on Aimuari Island,3,Banishdemons's Ironworking Stall on The Lowland Hundred | Banishdemons's Distilling Stall on The Lowland Hundred | Cazl's Shipbuilding Stall on Isle of Kent,22,Homestead Hut on Lincoln Island | Milkshack on Wensleydale | Caddyshack on Admiral Island | Riemann Slums on Descartes Isle | Rho House on Descartes Isle | Shack eel Oh Kneel on Blackthorpe Island | Love Shack on Caravanserai Island | Love Shack on Caravanserai Island | Caddyshack on Admiral Island | Riemann Slums on Descartes Isle | Stab In Cabin on Aimuari Island | Cypress Cabins on Alkaid Island | King Kottage on Admiral Island | Row Me Daddy on Admiral Island | Bringing Town the House on Admiral Island | Only a Manor of Time on Aimuari Island | Bedside Manors on Admiral Island | The Great Estate on Admiral Island | The Great Estate on Admiral Island | Guardians of the Gallery on Admiral Island | Guardians of the Gallery on Admiral Island | Dream On on Caravanserai Island,1,Robee,Established,Rumored,Established,Aspiring,Crafting,Piracy,Piracy,Crafting,Piracy,Crafting,Carousing,Crafting,Piracy,Carousing,Piracy,Piracy,Carousing,Piracy,Piracy,Piracy,Crafting,Carousing,Piracy,Carousing,Piracy,Crafting,Sublime,Illustrious,Exalted,Paragon,Exalted,Illustrious,Solid,Illustrious,Illustrious,Solid,Sublime,Solid,Illustrious,Exalted,Broad,Paragon,Sublime,Narrow,Solid,Weighty,Paragon,Expert,Master,Proficient,Distinguished,Proficient,Distinguished,Proficient,Able,Legendary,Able,Grand-Master,Distinguished,Master,Grand-Master,Distinguished,Able,Proficient,Able,Distinguished,Able,Proficient,Legendary,Respected
Alitar,https://emerald.puzzlepirates.com/yoweb/pirate.wm?classic=false&target=alitar,http://emerald.puzzlepirates.com/media/emerald/portraits/6a1/6f2f40c2e445ef13b10d6d1a89d76.jpg,Captain,,Gondolin,Prince,Symonds Says,Lieutenant,Aimuari Island Navy,Orion,1,Harland Ships on Aimuari Island,3,Ping Ping Rubber Docks on Aimuari Island | Fabric Fix on Aimuari Island | Brassy Balls on Basset Island,1,Cupcakie's Ironworking Stall on Chachapoya Island,4,Pine Boxes on Aimuari Island | Only a Manor of Time on Aimuari Island | Mayfair Mansions on Pukru Island | Tomb of the Hallowed Soul on Aimuari Island,0,,Aspiring,Aspiring,Aspiring,Aspiring,Crafting,Piracy,Piracy,Crafting,Piracy,Crafting,Carousing,Crafting,Piracy,Carousing,Piracy,Piracy,Carousing,Piracy,Piracy,Piracy,Crafting,Carousing,Piracy,Carousing,Piracy,Crafting,Novice,Weighty,Weighty,Broad,Weighty,Novice,Novice,Broad,Paragon,Narrow,Paragon,Narrow,Solid,Illustrious,Narrow,Narrow,Expert,Broad,Broad,Novice,Expert,Broad,Able,Legendary,Distinguished,Proficient,Distinguished,Able,Able,Legendary,Master,Respected,Legendary,Respected,Distinguished,Grand-Master,Proficient,Proficient,Master,Master,Grand-Master,Proficient,Renowned,Master
Cazl,https://emerald.puzzlepirates.com/yoweb/pirate.wm?classic=false&target=cazl,http://emerald.puzzlepirates.com/media/emerald/portraits/62e/3341689a65555a8321698db2877c4.jpg,Captain,Siren,Ult naughty ones,Princess,Symonds Says,Admiral,Aimuari Island Navy,Orion,2,Naughty Balls on Aimuari Island | Naughty Shots on Aimuari Island,6,Due or Dye on Admiral Island | Toilet Paper Balls on Barbary Island | Ninny Knickers on Admiral Island | Fort Influential on Basset Island | Ten Things I Crate About You on Admiral Island | Brassy Balls on Basset Island,1,Cazl's Shipbuilding Stall on Isle of Kent,20,Adobe Abode on Chachapoya Island | Caddyshack on Admiral Island | Shack Macaque on Alkaid Island | Cabin Fever on Admiral Island | Cypress Cabins on Alkaid Island | Bungalow Bill on Admiral Island | Mayfair Mansions on Pukru Island | Live Organ Townhouses on Bowditch Island | Bringing Town the House on Admiral Island | Emu-ving on Up on Quetzal Island | Me So Homey on Armstrong Island | Only a Manor of Time on Aimuari Island | Villa of the Damned on Aimuari Island | Dead Mansion Walking on Aimuari Island | Stab In Cabin on Aimuari Island | King Kottage on Admiral Island | Emu-ving on Up on Quetzal Island | Bringing Town the House on Admiral Island | Bedside Manors on Admiral Island | The Great Estate on Admiral Island,2,Rilee | Snakegirly,Noted,Celebrated,Established,Aspiring,Crafting,Piracy,Piracy,Crafting,Piracy,Crafting,Carousing,Crafting,Piracy,Carousing,Piracy,Piracy,Carousing,Piracy,Piracy,Piracy,Crafting,Carousing,Piracy,Carousing,Piracy,Crafting,Solid,Neophyte,Illustrious,Illustrious,Transcendent,Weighty,Novice,Paragon,Broad,Novice,Neophyte,Neophyte,Neophyte,Exalted,Narrow,Expert,Paragon,Novice,Broad,Novice,Illustrious,Expert,Proficient,Able,Proficient,Proficient,Master,Proficient,Respected,Distinguished,Respected,Able,Proficient,Distinguished,Proficient,Proficient,Proficient,Proficient,Able,Able,Grand-Master,Proficient,Proficient,Distinguished
Eltaro,https://emerald.puzzlepirates.com/yoweb/pirate.wm?classic=false&target=eltaro,http://emerald.puzzlepirates.com/media/emerald/portraits/cf0/1fadafd11ae812cec1c6f741cc06c.jpg,Senior Officer,Counselor,Hardcore Sea Ravers,Princess,Symonds Says,Admiral,Admiral Island Navy,Gull,0,,3,Ninny Knickers on Admiral Island | Fort Influential on Basset Island | Brassy Balls on Basset Island,3,Eltaro's Apothecary Stall on Bowditch Island | Eltaro's Apothecary Stall on Admiral Island | Eltaro's Apothecary Stall on Aimuari Island,6,Milkshack on Wensleydale | Bedside Manors on Admiral Island | Villa Las Vegas on Admiral Island | King Kottage on Admiral Island | Dead Mansion Walking on Aimuari Island | Guardians of the Gallery on Admiral Island,2,Galantis | Smellsweird,Established,Illustrious,Celebrated,Aspiring,Crafting,Piracy,Piracy,Crafting,Piracy,Crafting,Carousing,Crafting,Piracy,Carousing,Piracy,Piracy,Carousing,Piracy,Piracy,Piracy,Crafting,Carousing,Piracy,Carousing,Piracy,Crafting,Solid,Paragon,Sublime,Weighty,Paragon,Broad,Narrow,Weighty,Sublime,Broad,Expert,Solid,Expert,Expert,Narrow,Expert,Broad,Narrow,Solid,Broad,Sublime,Broad,Respected,Distinguished,Distinguished,Able,Distinguished,Able,Proficient,Legendary,Proficient,Distinguished,Able,Renowned,Master,Renowned,Master,Distinguished,Proficient,Distinguished,Master,Proficient,Able,Proficient
Smurfysenga,https://emerald.puzzlepirates.com/yoweb/pirate.wm?classic=false&target=smurfysenga,,Captain,,The Cade Crew,Princess,Symonds Says,Petty Officer,Basset Island Navy,Gull,0,,0,,0,,2,Homestead Hut on Lincoln Island | Was A Marked Down Shack on Wissahickon Island,14,Altos | Brummies | Cazl | Clockwatcher | Cupcakeze | Deadwill | Jollyana | Marmy | Mrmoneyboy | Robee | Senga | Sethsea | Shiri | Specke,Aspiring,Aspiring,Aspiring,Aspiring,Crafting,Piracy,Piracy,Crafting,Piracy,Crafting,Carousing,Crafting,Piracy,Carousing,Piracy,Piracy,Carousing,Piracy,Piracy,Piracy,Crafting,Carousing,Piracy,Carousing,Piracy,Crafting,Apprentice,Narrow,Solid,Neophyte,Solid,Narrow,Novice,Neophyte,Narrow,Novice,Solid,Novice,Apprentice,Solid,Novice,Novice,Neophyte,Novice,Novice,Neophyte,Apprentice,Novice,Proficient,Distinguished,Distinguished,Able,Proficient,Proficient,Able,Proficient,Proficient,Able,Distinguished,Able,Legendary,Distinguished,Able,Able,Able,Able,Grand-Master,Proficient,Legendary,Able
Wiplasher,https://emerald.puzzlepirates.com/yoweb/pirate.wm?classic=false&target=Wiplasher,http://emerald.puzzlepirates.com/media/emerald/portraits/878/0e0eadc0b16377ef2869719172487.jpg,Senior Officer,Drunk,Natural Selection,Prince,No Bamboozles,Admiral,Blackthorpe Island Navy,Pelican,10,Bird Strike Bargains on Caravanserai Island | Rags to Riches on Caravanserai Island | Sacred Hemp of Ibis on Caravanserai Island | Scourge of Iron on Caravanserai Island | Oops I Whisk'd it Again on Caravanserai Island | Harbor Forge on Barbary Island | Loom 'n' Lyrics on Armstrong Island | No Ship Sherlock on Caravanserai Island | Sew What on Caravanserai Island | Crazy Ship on Barbary Island,13,Bamboozled on Scrimshaw Island | Triceracloth on Arakoua Island | Pound One Out on Bowditch Island | Bang from Downtown on Blackthorpe Island | Forty-Two on Kakraphoon Island | Dye For You on Caravanserai Island | Whole Lot of Yachts on Armstrong Island | Hammer and Hound on Spaniel Island | Dyenamite Spice on Arakoua Island | Fleet Pics on Caravanserai Island | Lithium Balls on Armstrong Island | Dino Might on Arakoua Island | Ship Happens on Kakraphoon Island,7,Wiplasher's Shipbuilding Stall on Isle of Kent | Wiplasher's Ironworking Stall on The Lowland Hundred | Wiplasher's Weaving Stall on Wensleydale | Amin's Weaving Stall on Wensleydale | Amin's Tailoring Stall on Pukru Island | Amin's Ironworking Stall on Admiral Island | Martellus's Shipbuilding Stall on Greenwich Island,8,Shack eel Oh Kneel on Blackthorpe Island | Caddyshack on Admiral Island | Was A Marked Down Shack on Wissahickon Island | Milkshack on Wensleydale | Bungalow Bill on Admiral Island | Bedside Manors on Admiral Island | Cthulhu Mansion on Admiral Island | Magical Mystery Mansion on Caravanserai Island,12,Chorleychick | Crazee | Daan | Dragonhelper | Greecefeva | Gwilo | Hakerz | Michaelos | Micko | Sacker | Theredwench | Unodos,Aspiring,Established,Illustrious,Aspiring,Crafting,Piracy,Piracy,Crafting,Piracy,Crafting,Carousing,Crafting,Piracy,Carousing,Piracy,Piracy,Carousing,Piracy,Piracy,Piracy,Crafting,Carousing,Piracy,Carousing,Piracy,Crafting,Solid,Weighty,Illustrious,Solid,Expert,Solid,Narrow,Solid,Expert,Narrow,Illustrious,Solid,Solid,Illustrious,Broad,Expert,Weighty,Neophyte,Expert,Narrow,Weighty,Broad,Respected,Proficient,Legendary,Renowned,Master,Proficient,Able,Respected,Distinguished,Proficient,Legendary,Renowned,Grand-Master,Ultimate,Proficient,Distinguished,Grand-Master,Proficient,Master,Proficient,Grand-Master,Respected
Amin,https://emerald.puzzlepirates.com/yoweb/pirate.wm?classic=false&target=amin,http://emerald.puzzlepirates.com/media/emerald/portraits/2ba/cc6f7f65c7beba068a1379e70f47a.jpg,Captain,Shopkeeper,Splash Warning,Prince,No Bamboozles,Ensign,Arakoua Island Navy,Ibis,9,Bamboozled on Scrimshaw Island | Triceracloth on Arakoua Island | Pound One Out on Bowditch Island | Dye For You on Caravanserai Island | Blow My Bellows on Barbary Island | Hammer and Hound on Spaniel Island | Dyenamite Spice on Arakoua Island | Lithium Balls on Armstrong Island | Dino Might on Arakoua Island,19,Iron Hangar on Bowditch Island | Mile High Mongers on Admiral Island | Bird Strike Bargains on Caravanserai Island | Rags to Riches on Caravanserai Island | Nuts & Bolts on Scrimshaw Island | Sacred Hemp of Ibis on Caravanserai Island | The Iron Projectiles on Aimuari Island | Scourge of Iron on Caravanserai Island | Bang from Downtown on Blackthorpe Island | Oops I Whisk'd it Again on Caravanserai Island | Harbor Forge on Barbary Island | The Screwed Goose on Scrimshaw Island | Forty-Two on Kakraphoon Island | Loom 'n' Lyrics on Armstrong Island | No Ship Sherlock on Caravanserai Island | Sew What on Caravanserai Island | Crazy Ship on Barbary Island | Malice in the Palace on Blackthorpe Island | Ship Happens on Kakraphoon Island,6,Amin's Weaving Stall on Wensleydale | Amin's Tailoring Stall on Pukru Island | Amin's Ironworking Stall on Admiral Island | Wiplasher's Shipbuilding Stall on Isle of Kent | Traegs's Apothecary Stall on Admiral Island | Wiplasher's Weaving Stall on Wensleydale,6,Pine Boxes on Aimuari Island | Shack eel Oh Kneel on Blackthorpe Island | King Kottage on Admiral Island | Bringing Town the House on Admiral Island | Bringing Town the House on Admiral Island | Bedside Manors on Admiral Island,23,Astrangel | Buckets | Capnray | Cinnaman | Embargo | Finbarr | Godoftheseas | Greecefeva | Hamsty | Jakdaniels | Jazz | Jumpyjess | Martellus | Monlizzy | Narp | Pyke | Rockstarg | Sinkz | Teabiscuit | Traegs | Umami | Wiplasher | Youngsinatra,Obscure,Celebrated,Renowned,Aspiring,Crafting,Piracy,Piracy,Crafting,Piracy,Crafting,Carousing,Crafting,Piracy,Carousing,Piracy,Piracy,Carousing,Piracy,Piracy,Piracy,Crafting,Carousing,Piracy,Carousing,Piracy,Crafting,Weighty,Solid,Broad,Solid,Illustrious,Novice,Novice,Narrow,Solid,Novice,Broad,Broad,Expert,Broad,Neophyte,Solid,Neophyte,Novice,Broad,Novice,Expert,Broad,Renowned,Respected,Proficient,Respected,Respected,Able,Able,Proficient,Proficient,Able,Able,Proficient,Proficient,Proficient,Able,Distinguished,Able,Able,Proficient,Proficient,Proficient,Distinguished
Hamsty,https://emerald.puzzlepirates.com/yoweb/pirate.wm?classic=false&target=hamsty,http://emerald.puzzlepirates.com/media/emerald/portraits/c3e/d97454868e604daab242bdb453548.jpg,Senior Officer,,Queso De Mondays,Prince,No Bamboozles,Sailor,Kakraphoon Island Navy,Dodo,0,,21,Greece's Pieces on Aimuari Island | Bird Strike Bargains on Caravanserai Island | Bamboozled on Scrimshaw Island | Rags to Riches on Caravanserai Island | Triceracloth on Arakoua Island | Sacred Hemp of Ibis on Caravanserai Island | Don't Weave Me on Aimuari Island | Pound One Out on Bowditch Island | Ball-Mart on Scrimshaw Island | Oops I Whisk'd it Again on Caravanserai Island | Harbor Forge on Barbary Island | Dye For You on Caravanserai Island | Loom 'n' Lyrics on Armstrong Island | Blow My Bellows on Barbary Island | Hammer and Hound on Spaniel Island | Dyenamite Spice on Arakoua Island | No Ship Sherlock on Caravanserai Island | Sew What on Caravanserai Island | Crazy Ship on Barbary Island | Dino Might on Arakoua Island | No Ballboozles on Aimuari Island,0,,11,Adobe Abode on Chachapoya Island | Sigil Shack on Sayers Rock | Shack eel Oh Kneel on Blackthorpe Island | Pine Boxes on Aimuari Island | Minute House on Greenwich Island | The Dove Shack on Armstrong Island | Shack Macaque on Alkaid Island | The Cuckoo's Nest on Quetzal Island | Was A Marked Down Shack on Wissahickon Island | Riemann Slums on Descartes Isle | Bringing Town the House on Admiral Island,0,,Aspiring,Aspiring,Aspiring,Aspiring,Crafting,Piracy,Piracy,Crafting,Piracy,Crafting,Carousing,Crafting,Piracy,Carousing,Piracy,Piracy,Carousing,Piracy,Piracy,Piracy,Crafting,Carousing,Piracy,Carousing,Piracy,Crafting,Novice,Weighty,Expert,Neophyte,Narrow,Novice,Novice,Broad,Broad,Novice,Solid,Broad,Weighty,Solid,Neophyte,Neophyte,Solid,Novice,Narrow,Neophyte,Solid,Novice,Able,Able,Respected,Proficient,Able,Able,Respected,Able,Distinguished,Able,Proficient,Respected,Distinguished,Distinguished,Able,Proficient,Proficient,Able,Grand-Master,Distinguished,Respected,Able
Martellus,https://emerald.puzzlepirates.com/yoweb/pirate.wm?classic=false&target=martellus,http://emerald.puzzlepirates.com/media/emerald/portraits/b58/d0bad43177ab19df9a41ff6615762.jpg,Captain,Drunk,Queso De Mondays,Princess,No Bamboozles,Petty Officer,Blackthorpe Island Navy,Pelican,0,,16,Bird Strike Bargains on Caravanserai Island | Bamboozled on Scrimshaw Island | Rags to Riches on Caravanserai Island | Triceracloth on Arakoua Island | Sacred Hemp of Ibis on Caravanserai Island | Scourge of Iron on Caravanserai Island | Bang from Downtown on Blackthorpe Island | Oops I Whisk'd it Again on Caravanserai Island | Harbor Forge on Barbary Island | Building Dynasties on Blackthorpe Island | Dye For You on Caravanserai Island | Loom 'n' Lyrics on Armstrong Island | Dyenamite Spice on Arakoua Island | No Ship Sherlock on Caravanserai Island | Crazy Ship on Barbary Island | Malice in the Palace on Blackthorpe Island,6,Martellus's Ironworking Stall on Blackthorpe Island | Martellus's Distilling Stall on Greenwich Island | Martellus's Apothecary Stall on Greenwich Island | Martellus's Shipbuilding Stall on Greenwich Island | Wiplasher's Ironworking Stall on The Lowland Hundred | Wiplasher's Shipbuilding Stall on Isle of Kent,15,Caddyshack on Admiral Island | Sigil Shack on Sayers Rock | Minute House on Greenwich Island | Shack eel Oh Kneel on Blackthorpe Island | Milkshack on Wensleydale | Cabin Fever on Admiral Island | Bungalow Bill on Admiral Island | King Kottage on Admiral Island | Row Me Daddy on Admiral Island | Bringing Town the House on Admiral Island | Caddyshack on Admiral Island | Stab In Cabin on Aimuari Island | Rho House on Descartes Isle | Bringing Town the House on Admiral Island | Bedside Manors on Admiral Island,46,Affame | Beia | Blonde | Bonze | Brocko | Cafefe | Canadagoose | Capnray | Ccarlson | Contressa | Derivatives | Dirtybowdy | Drover | Frostease | Glamourr | Greecefeva | Hamsty | Hellz | Iaago | Jacobdwnunda | Jahron | Jazz | Jerrk | Kizzle | Kushlorde | Lashientax | Maeven | Margaroo | Marioman | Mchicken | Missyfiercer | Narp | Ohmi | Papi | Pedro | Psychi | Shigby | Sonadora | Sonicbang | Sscc | Teabiscuit | Umami | Viator | Walterwhale | Youngsinatra | Zengris,Aspiring,Rumored,Rumored,Rumored,Crafting,Piracy,Piracy,Crafting,Piracy,Crafting,Carousing,Crafting,Piracy,Carousing,Piracy,Piracy,Carousing,Piracy,Piracy,Piracy,Crafting,Carousing,Piracy,Carousing,Piracy,Crafting,Neophyte,Expert,Weighty,Solid,Solid,Apprentice,Broad,Broad,Solid,Solid,Paragon,Solid,Illustrious,Expert,Solid,Solid,Broad,Narrow,Solid,Narrow,Weighty,Apprentice,Able,Proficient,Respected,Master,Proficient,Able,Proficient,Proficient,Proficient,Legendary,Ultimate,Renowned,Master,Legendary,Renowned,Proficient,Proficient,Proficient,Proficient,Proficient,Distinguished,Able
Ohmi,https://emerald.puzzlepirates.com/yoweb/pirate.wm?classic=false&target=ohmi,http://emerald.puzzlepirates.com/media/emerald/portraits/c75/e18ce6d471ffa3fd141bd7d6092aa.jpg,Senior Officer,Navigator,Splash Warning,Prince,No Bamboozles,Lieutenant,Admiral Island Navy,Gull,3,Trading Block on Blackthorpe Island | Building Dynasties on Blackthorpe Island | Malice in the Palace on Blackthorpe Island,9,Bird Strike Bargains on Caravanserai Island | Rags to Riches on Caravanserai Island | Oops I Whisk'd it Again on Caravanserai Island | Harbor Forge on Barbary Island | Loom 'n' Lyrics on Armstrong Island | Lithium Balls on Armstrong Island | Sew What on Caravanserai Island | Crazy Ship on Barbary Island | Ship Happens on Kakraphoon Island,1,Martellus's Apothecary Stall on Greenwich Island,2,Cthulhu Mansion on Admiral Island | Cthulhu Mansion on Admiral Island,10,Blonde | Daeris | Embargo | Greecefeva | Helium | Mahsa | Mahta | Martellus | Sscc | Youngsinatra,Rumored,Renowned,Illustrious,Aspiring,Crafting,Piracy,Piracy,Crafting,Piracy,Crafting,Carousing,Crafting,Piracy,Carousing,Piracy,Piracy,Carousing,Piracy,Piracy,Piracy,Crafting,Carousing,Piracy,Carousing,Piracy,Crafting,Solid,Solid,Solid,Solid,Paragon,Novice,Broad,Solid,Solid,Weighty,Solid,Solid,Paragon,Solid,Broad,Solid,Broad,Neophyte,Solid,Solid,Solid,Narrow,Distinguished,Distinguished,Proficient,Proficient,Master,Able,Proficient,Proficient,Able,Ultimate,Proficient,Respected,Proficient,Distinguished,Proficient,Proficient,Proficient,Proficient,Proficient,Renowned,Proficient,Proficient
Sankz,https://emerald.puzzlepirates.com/yoweb/pirate.wm?classic=false&target=sankz,,Senior Officer,,Splash Warning,Lord,No Bamboozles,Chief Petty Officer,Pukru Island Navy,Orion,0,,0,,0,,2,Shack eel Oh Kneel on Blackthorpe Island | Sea Shack on Scrimshaw Island,4,Canceer | Hamsty | Sinkz | Wraps,Aspiring,Aspiring,Aspiring,Aspiring,Crafting,Piracy,Piracy,Crafting,Piracy,Crafting,Carousing,Crafting,Piracy,Carousing,Piracy,Piracy,Carousing,Piracy,Piracy,Piracy,Crafting,Carousing,Piracy,Carousing,Piracy,Crafting,Novice,Apprentice,Novice,Solid,Narrow,Novice,Novice,Apprentice,Narrow,Novice,Narrow,Apprentice,Neophyte,Solid,Novice,Novice,Novice,Novice,Novice,Novice,Solid,Neophyte,Able,Able,Able,Ultimate,Proficient,Able,Able,Renowned,Master,Able,Proficient,Respected,Respected,Respected,Able,Able,Able,Able,Proficient,Able,Respected,Proficient
Wargrade,https://emerald.puzzlepirates.com/yoweb/pirate.wm?classic=false&target=wargrade,,Captain,Nap Specialist,Nightfall,Prince,Deadlock,Stowaway,Cryo Island Navy,Puffin,0,,0,,0,,1,Caddyshack on Admiral Island,0,,Aspiring,Aspiring,Aspiring,Aspiring,Crafting,Piracy,Piracy,Crafting,Piracy,Crafting,Carousing,Crafting,Piracy,Carousing,Piracy,Piracy,Carousing,Piracy,Piracy,Piracy,Crafting,Carousing,Piracy,Carousing,Piracy,Crafting,Novice,Novice,Novice,Novice,Novice,Novice,Novice,Novice,Novice,Novice,Novice,Novice,Novice,Novice,Novice,Novice,Novice,Novice,Novice,Novice,Novice,Novice,Able,Able,Able,Able,Able,Able,Able,Able,Able,Able,Able,Able,Able,Able,Able,Able,Able,Able,Able,Able,Able,Able
Velocirapta,https://emerald.puzzlepirates.com/yoweb/pirate.wm?classic=false&target=velocirapta,,Senior Officer,,Nightfall,Lord,Deadlock,Stowaway,Caravanserai Island Navy,Ibis,0,,0,,0,,1,Love Shack on Caravanserai Island,0,,Aspiring,Aspiring,Aspiring,Aspiring,Crafting,Piracy,Piracy,Crafting,Piracy,Crafting,Carousing,Crafting,Piracy,Carousing,Piracy,Piracy,Carousing,Piracy,Piracy,Piracy,Crafting,Carousing,Piracy,Carousing,Piracy,Crafting,Novice,Novice,Novice,Solid,Novice,Novice,Novice,Novice,Novice,Novice,Novice,Novice,Novice,Novice,Novice,Novice,Novice,Novice,Novice,Novice,Novice,Novice,Able,Able,Able,Master,Able,Able,Able,Able,Able,Able,Able,Able,Able,Able,Able,Able,Able,Able,Able,Able,Able,Able
Tosl,https://emerald.puzzlepirates.com/yoweb/pirate.wm?classic=false&target=Tosl,http://emerald.puzzlepirates.com/media/emerald/portraits/070/f1ee22e47c568bb5d85027f8e1f75.jpg,Senior Officer,Architect,Sticky Fingers,Prince,Sticky Rubber Duckies,Admiral,Cryo Island Navy,Puffin,3,Bang Bang Brews on Admiral Island | The Great White North on Cryo Island | Wicked Wench on Cryo Island,3,Frigate Driver on Admiral Island | Brandy on the House on Caravanserai Island | Awol or Distilling on Armstrong Island,1,Turtleman's Apothecary Stall on Admiral Island,10,Love Shack on Caravanserai Island | Milkshack on Wensleydale | Caddyshack on Admiral Island | Row Me Daddy on Admiral Island | Bedside Manors on Admiral Island | Caddyshack on Admiral Island | Pine Boxes on Aimuari Island | Bedside Manors on Admiral Island | Cthulhu Mansion on Admiral Island | Cthulhu Mansion on Admiral Island,14,Diletto | Ganderz | Geologist-East | Greyscale | Hbombalt | Hbombed | Heyyl | Jice | Krakathooms | Legendu | Penguinluvs | Sarandai | Saviour | Spadesonly,Aspiring,Celebrated,Celebrated,Obscure,Crafting,Piracy,Piracy,Crafting,Piracy,Crafting,Carousing,Crafting,Piracy,Carousing,Piracy,Piracy,Carousing,Piracy,Piracy,Piracy,Crafting,Carousing,Piracy,Carousing,Piracy,Crafting,Paragon,Illustrious,Paragon,Expert,Sublime,Exalted,Expert,Revered,Exalted,Illustrious,Exalted,Sublime,Illustrious,Illustrious,Expert,Illustrious,Paragon,Illustrious,Paragon,Expert,Revered,Illustrious,Ultimate,Able,Renowned,Legendary,Legendary,Able,Legendary,Proficient,Renowned,Ultimate,Master,Master,Renowned,Legendary,Grand-Master,Master,Master,Grand-Master,Legendary,Renowned,Able,Ultimate
