Pirate Name,Pirate URL,Portrait URL,Crew Rank,Crew Job,Crew Name,Flag Role,Flag Name,Navy Rank,Navy Name,Navy Archipelago,Owns Count,Owns List,Manages Count,Manages List,Stalls Count,Stalls List,Houses Count,Houses List,Hearties Count,Hearties List,Reputation Conqueror,Reputation Explorer,Reputation Magnate,Reputation Patron,Skill Category Alchemistry,Skill Category Battle Navigation,Skill Category Bilging,Skill Category Blacksmithing,Skill Category Carpentry,Skill Category Distilling,Skill Category Drinking,Skill Category Foraging,Skill Category Gunning,Skill Category Hearts,Skill Category Navigating,Skill Category Patching,Skill Category Poker,Skill Category Rigging,Skill Category Rumble,Skill Category Sailing,Skill Category Shipwrightery,Skill Category Spades,Skill Category Swordfighting,Skill Category Treasure Drop,Skill Category Treasure Haul,Skill Category Weaving,Skill Experience Alchemistry,Skill Experience Battle Navigation,Skill Experience Bilging,Skill Experience Blacksmithing,Skill Experience Carpentry,Skill Experience Distilling,Skill Experience Drinking,Skill Experience Foraging,Skill Experience Gunning,Skill Experience Hearts,Skill Experience Navigating,Skill Experience Patching,Skill Experience Poker,Skill Experience Rigging,Skill Experience Rumble,Skill Experience Sailing,Skill Experience Shipwrightery,Skill Experience Spades,Skill Experience Swordfighting,Skill Experience Treasure Drop,Skill Experience Treasure Haul,Skill Experience Weaving,Skill Reputation Alchemistry,Skill Reputation Battle Navigation,Skill Reputation Bilging,Skill Reputation Blacksmithing,Skill Reputation Carpentry,Skill Reputation Distilling,Skill Reputation Drinking,Skill Reputation Foraging,Skill Reputation Gunning,Skill Reputation Hearts,Skill Reputation Navigating,Skill Reputation Patching,Skill Reputation Poker,Skill Reputation Rigging,Skill Reputation Rumble,Skill Reputation Sailing,Skill Reputation Shipwrightery,Skill Reputation Spades,Skill Reputation Swordfighting,Skill Reputation Treasure Drop,Skill Reputation Treasure Haul,Skill Reputation Weaving
Brucemcgaw,https://emerald.puzzlepirates.com/yoweb/pirate.wm?classic=false&target=Brucemcgaw,http://emerald.puzzlepirates.com/media/emerald/portraits/1af/69dfcd151d71879a78ebe3d38623d.jpg,Officer,Shopkeeper,Moolah,Member,Do Not Reply,Stowaway,Admiral Island Navy,Gull,0,,0,,15,Brucemcgaw's Distilling Stall on Aimuari Island | Brucemcgaw's Distilling Stall on Sayers Rock | Brucemcgaw's Furnishing Stall on Admiral Island | Brucemcgaw's Ironworking Stall on Admiral Island | Brucemcgaw's Distilling Stall on Admiral Island | Brucemcgaw's Weaving Stall on Admiral Island | Brucemcgaw's Apothecary Stall on Admiral Island | Brucemcgaw's Ironworking Stall on Alkaid Island | Brucemcgaw's Tailoring Stall on Admiral Island | Brucemcgaw's Shipbuilding Stall on Admiral Island | Brucemcgaw's Distilling Stall on Arakoua Island | Brucemcgaw's Distilling Stall on Alkaid Island | Brucemcgaw's Distilling Stall on Scrimshaw Island | Brucemcgaw's Ironworking Stall on Aimuari Island | Brucemcgaw's Distilling Stall on Bowditch Island,1,Love Shack on Caravanserai Island,44,Alwaysbroke | Beckerz | Bekkyjo | Bilager | Blackjacck | Cazix | Darkmouth | Darkwell | Deckpig | Electricio | Fastugio | Gongfu | Gurlar | Kelsarianna | Kikinoki | Koalaking | Kou | Kozzar | Krash | Legoheads | Longsao | Meowsah | Metapuzzle | Mirru | Missroxy | Msrg | Nautical | Oceanvibe | Oodnadata | Ottilia | Prrettywoman | Rockyb | Ruminmytum | Sparrky | Squares | Teddyb | Tobyeans | Tokkii | Tosikit | Traegs | Wodobols | Xingtairen | Xyc | Yovie,Rumored,Illustrious,Renowned,Aspiring,Crafting,Piracy,Piracy,Crafting,Piracy,Crafting,Carousing,Crafting,Piracy,Carousing,Piracy,Piracy,Carousing,Piracy,Piracy,Piracy,Crafting,Carousing,Piracy,Carousing,Piracy,Crafting,Apprentice,Solid,Broad,Narrow,Narrow,Broad,Novice,Narrow,Novice,Novice,Narrow,Solid,Weighty,Solid,Neophyte,Broad,Solid,Novice,Neophyte,Neophyte,Expert,Novice,Able,Distinguished,Proficient,Able,Proficient,Proficient,Able,Proficient,Able,Able,Able,Master,Master,Proficient,Proficient,Proficient,Proficient,Able,Able,Proficient,Distinguished,Able
Amazingdarts,https://emerald.puzzlepirates.com/yoweb/pirate.wm?classic=false&target=Amazingdarts,http://emerald.puzzlepirates.com/media/emerald/portraits/632/75ddd11b9b0e1a145e49ff12b76c8.jpg,Captain,Explosives Expert,Pound the Alarm,King,Rude Awakening,Lieutenant,Arakoua Island Navy,Ibis,0,,4,The Jordanian Distillery on Bowditch Island | The Jordanian Apothecary on Bowditch Island | The Jordanian Steel on Bowditch Island | Botanical Blades on Sayers Rock,0,,5,Homestead Hut on Lincoln Island | Shacky Doo on Hubble's Eye | Minute House on Greenwich Island | Eccentric Estates on Arakoua Island | Swamp Castle on Bowditch Island,0,,Aspiring,Noted,Eminent,Aspiring,Crafting,Piracy,Piracy,Crafting,Piracy,Crafting,Carousing,Crafting,Piracy,Carousing,Piracy,Piracy,Carousing,Piracy,Piracy,Piracy,Crafting,Carousing,Piracy,Carousing,Piracy,Crafting,Solid,Solid,Solid,Narrow,Solid,Neophyte,Neophyte,Neophyte,Solid,Novice,Weighty,Broad,Solid,Weighty,Neophyte,Narrow,Solid,Novice,Narrow,Novice,Solid,Narrow,Distinguished,Master,Proficient,Proficient,Distinguished,Able,Proficient,Renowned,Master,Able,Master,Master,Respected,Grand-Master,Proficient,Proficient,Distinguished,Able,Able,Able,Distinguished,Master
Whitesnakes,https://emerald.puzzlepirates.com/yoweb/pirate.wm?classic=false&target=whitesnakes,http://emerald.puzzlepirates.com/media/emerald/portraits/87e/4262bb9fb58c04261b3e9a0c956f0.jpg,Senior Officer,Architect,Mayan Empire,Lord,No Strings Attached,Lieutenant,Admiral Island Navy,Gull,14,Hot Iron and Heavy Loads on Alkaid Island | Kukulkan Spirits on Barbary Island | Ch'aaj Apothecary on Barbary Island | Bedrock Brewery on Arakoua Island | Yo Mommas Bikini String on Alkaid Island | Jade Industry on Armstrong Island | Dark Sommeliers on Alkaid Island | Threads of Kukulkan on Arakoua Island | Threads of Kukulkan on Caravanserai Island | Distill My Heart on Alkaid Island | Knot So Spicy on Arakoua Island | Turn A Blind Dye on Bowditch Island | Kukulkan Spirits on Sayers Rock | Kukulkan Spirits on Armstrong Island,0,,4,Whitesnakes's Tailoring Stall on Admiral Island | Whitesnakes's Apothecary Stall on Admiral Island | Hydroventure's Ironworking Stall on Wissahickon Island | Woodventure's Ironworking Stall on Wissahickon Island,9,Bungalow Bill on Admiral Island | King Kottage on Admiral Island | Row Me Daddy on Admiral Island | Jonestown Houses on Aimuari Island | Bedside Manors on Admiral Island | Villa Las Vegas on Admiral Island | Guardians of the Gallery on Admiral Island | King Kottage on Admiral Island | The Great Estate on Admiral Island,33,Adrielle | Affame | Aperion | Arielday | Bluesnakes | Cashier | Cptdrewski | Dryke | Finbarr | Getwrecked | Gravee | Graysn | Hauk | Heralea | Hielo | Hollisue | Imany | Kahla | Kenjilamar | Lozenger | Mrflop | Ogkinggold | Sage | Scap | Souul | Spongiform | Spyda | Swissex | Texnikos | Urgal | Wulferion | Xery | Yasminkov,Renowned,Illustrious,Illustrious,Noted,Crafting,Piracy,Piracy,Crafting,Piracy,Crafting,Carousing,Crafting,Piracy,Carousing,Piracy,Piracy,Carousing,Piracy,Piracy,Piracy,Crafting,Carousing,Piracy,Carousing,Piracy,Crafting,Solid,Expert,Expert,Narrow,Weighty,Novice,Neophyte,Solid,Solid,Neophyte,Solid,Weighty,Solid,Illustrious,Apprentice,Solid,Broad,Neophyte,Solid,Neophyte,Sublime,Solid,Proficient,Grand-Master,Renowned,Able,Renowned,Able,Distinguished,Ultimate,Proficient,Distinguished,Distinguished,Grand-Master,Distinguished,Ultimate,Proficient,Proficient,Able,Distinguished,Grand-Master,Able,Grand-Master,Respected
Amazingtarts,https://emerald.puzzlepirates.com/yoweb/pirate.wm?classic=false&target=amazingtarts,,Captain,,Mass Extinction,Member,Rude Awakening,Stowaway,Penobscot Island Navy,Stork,0,,0,,0,,2,Shack Macaque on Alkaid Island | Eccentric Estates on Arakoua Island,3,Amazingdarts | Captbiology | Cptbigbamboo,Aspiring,Aspiring,Aspiring,Aspiring,Crafting,Piracy,Piracy,Crafting,Piracy,Crafting,Carousing,Crafting,Piracy,Carousing,Piracy,Piracy,Carousing,Piracy,Piracy,Piracy,Crafting,Carousing,Piracy,Carousing,Piracy,Crafting,Novice,Neophyte,Apprentice,Apprentice,Novice,Novice,Novice,Neophyte,Novice,Novice,Neophyte,Novice,Novice,Narrow,Novice,Novice,Narrow,Novice,Novice,Novice,Novice,Novice,Able,Able,Able,Proficient,Able,Able,Able,Proficient,Able,Able,Able,Able,Able,Proficient,Able,Able,Proficient,Able,Able,Able,Proficient,Able
Drunkdarts,https://emerald.puzzlepirates.com/yoweb/pirate.wm?classic=false&target=drunkdarts,,,,,,,Stowaway,The Lowland Hundred Navy,Horse Head,0,,0,,0,,1,Milkshack on Wensleydale,3,Amazingdarts | Captbiology | Deserteagles,Aspiring,Aspiring,Aspiring,Aspiring,Crafting,Piracy,Piracy,Crafting,Piracy,Crafting,Carousing,Crafting,Piracy,Carousing,Piracy,Piracy,Carousing,Piracy,Piracy,Piracy,Crafting,Carousing,Piracy,Carousing,Piracy,Crafting,Novice,Novice,Neophyte,Solid,Novice,Novice,Novice,Novice,Novice,Novice,Novice,Novice,Novice,Apprentice,Novice,Novice,Neophyte,Novice,Novice,Novice,Novice,Novice,Able,Able,Proficient,Distinguished,Able,Able,Able,Able,Able,Able,Able,Able,Able,Proficient,Able,Able,Able,Able,Able,Able,Able,Able
Scozy,https://emerald.puzzlepirates.com/yoweb/pirate.wm?classic=false&target=scozy,http://emerald.puzzlepirates.com/media/emerald/portraits/36d/431d421bde146c18fdb1fe7f55136.jpg,Captain,Warmonger,Washed Up,King,Guppy Gang,Ensign,Alkaid Island Navy,Ursa,5,Lawless Blonde on Admiral Island | The Shrine of the Silver Monkey on Alkaid Island | The Iron Ape on Alkaid Island | Primate Realty on Alkaid Island | See Hear Speak and Buy No Evil on Alkaid Island,3,Dial M for Madder on Admiral Island | Grindylows on Scrimshaw Island | Clothes that Sleigh on Aimuari Island,0,,20,Caddyshack on Admiral Island | Shack eel Oh Kneel on Blackthorpe Island | Sigil Shack on Sayers Rock | Milkshack on Wensleydale | Adobe Abode on Chachapoya Island | Homestead Hut on Lincoln Island | The Cuckoo's Nest on Quetzal Island | Stab In Cabin on Aimuari Island | Cambrian Cabins on Arakoua Island | Cabin Fever on Admiral Island | Bunker Bungalow on Lincoln Island | Bungalow Bill on Admiral Island | Cheesy Pun on Wensleydale | Bringing Town the House on Admiral Island | Sidekick Shacks on Barbary Island | King Kottage on Admiral Island | Row Me Daddy on Admiral Island | Funky Townhouse on Caravanserai Island | Only a Manor of Time on Aimuari Island | Bedside Manors on Admiral Island,0,,Aspiring,Eminent,Illustrious,Aspiring,Crafting,Piracy,Piracy,Crafting,Piracy,Crafting,Carousing,Crafting,Piracy,Carousing,Piracy,Piracy,Carousing,Piracy,Piracy,Piracy,Crafting,Carousing,Piracy,Carousing,Piracy,Crafting,Narrow,Weighty,Solid,Solid,Solid,Apprentice,Neophyte,Solid,Weighty,Narrow,Expert,Broad,Sublime,Narrow,Apprentice,Illustrious,Narrow,Broad,Expert,Narrow,Expert,Weighty,Proficient,Respected,Proficient,Master,Respected,Able,Proficient,Respected,Respected,Master,Master,Master,Proficient,Proficient,Respected,Legendary,Proficient,Master,Grand-Master,Distinguished,Distinguished,Legendary
Swiggity,https://emerald.puzzlepirates.com/yoweb/pirate.wm?classic=false&target=swiggity,http://emerald.puzzlepirates.com/media/emerald/portraits/e39/93c08462ad7bc7da5a157a87e60c2.jpg,Captain,Drunk,Jack Daniels,King,Whiskey Business,Chief Petty Officer,Admiral Island Navy,Gull,1,Monkey Mix on Alkaid Island,0,,1,Crystalla's Tailoring Stall on Admiral Island,5,Caddyshack on Admiral Island | King Kottage on Admiral Island | Bedside Manors on Admiral Island | Cabin Fever on Admiral Island | Bringing Town the House on Admiral Island,2,Avada | Kedavra,Aspiring,Noted,Celebrated,Aspiring,Crafting,Piracy,Piracy,Crafting,Piracy,Crafting,Carousing,Crafting,Piracy,Carousing,Piracy,Piracy,Carousing,Piracy,Piracy,Piracy,Crafting,Carousing,Piracy,Carousing,Piracy,Crafting,Broad,Weighty,Narrow,Broad,Broad,Solid,Neophyte,Broad,Narrow,Solid,Narrow,Broad,Solid,Narrow,Apprentice,Broad,Narrow,Novice,Narrow,Apprentice,Solid,Neophyte,Proficient,Ultimate,Proficient,Able,Proficient,Able,Able,Proficient,Proficient,Renowned,Able,Proficient,Proficient,Proficient,Able,Proficient,Able,Able,Able,Proficient,Proficient,Proficient
Scozydeeds,https://emerald.puzzlepirates.com/yoweb/pirate.wm?classic=false&target=scozydeeds,http://emerald.puzzlepirates.com/media/emerald/portraits/908/b45d71ad9cbfb37ab865290eefd6e.jpg,Captain,,Nein Nein Nein Nein,Member,Guppy Gang,Petty Officer,Armstrong Island Navy,Canis,0,,0,,0,,6,Shack eel Oh Kneel on Blackthorpe Island | Sidekick Shacks on Barbary Island | Milkshack on Wensleydale | Sea Shack on Scrimshaw Island | Caddyshack on Admiral Island | Love Shack on Caravanserai Island,1,Jobwithme,Aspiring,Obscure,Rumored,Aspiring,Crafting,Piracy,Piracy,Crafting,Piracy,Crafting,Carousing,Crafting,Piracy,Carousing,Piracy,Piracy,Carousing,Piracy,Piracy,Piracy,Crafting,Carousing,Piracy,Carousing,Piracy,Crafting,Novice,Solid,Narrow,Solid,Neophyte,Novice,Novice,Novice,Apprentice,Novice,Narrow,Novice,Neophyte,Novice,Novice,Solid,Novice,Novice,Novice,Novice,Apprentice,Apprentice,Able,Able,Able,Respected,Proficient,Able,Able,Able,Respected,Able,Proficient,Able,Able,Able,Able,Master,Able,Able,Able,Able,Master,Distinguished
Crushiie,https://emerald.puzzlepirates.com/yoweb/pirate.wm?classic=false&target=crushiie,http://emerald.puzzlepirates.com/media/emerald/portraits/e9e/15ee075a90f0ffb77719e12ba6ba4.jpg,Captain,,Get Scuppered,Queen,Her Majesties Misfits,Lieutenant,Admiral Island Navy,Gull,2,You're Getting on My Threads on Barbary Island | Let's Get Ship Faced on Barbary Island,0,,0,,6,Jurassic Shack on Arakoua Island | King Kottage on Admiral Island | Bringing Town the House on Admiral Island | Jurassic Shack on Arakoua Island | Villa Las Vegas on Admiral Island | Be Our Guest Gallery on Armstrong Island,0,,Aspiring,Aspiring,Illustrious,Aspiring,Crafting,Piracy,Piracy,Crafting,Piracy,Crafting,Carousing,Crafting,Piracy,Carousing,Piracy,Piracy,Carousing,Piracy,Piracy,Piracy,Crafting,Carousing,Piracy,Carousing,Piracy,Crafting,Apprentice,Broad,Weighty,Solid,Broad,Apprentice,Novice,Solid,Solid,Novice,Solid,Illustrious,Solid,Solid,Broad,Solid,Weighty,Neophyte,Solid,Apprentice,Weighty,Solid,Able,Proficient,Proficient,Proficient,Proficient,Able,Able,Distinguished,Able,Able,Proficient,Grand-Master,Distinguished,Proficient,Able,Proficient,Proficient,Proficient,Proficient,Able,Proficient,Respected
Graysn,https://emerald.puzzlepirates.com/yoweb/pirate.wm?classic=false&target=graysn,http://emerald.puzzlepirates.com/media/emerald/portraits/af3/ebf8142b91d46f2112397e05e7539.jpg,Senior Officer,Treasurer,Dopamine,Prince,Do Not Reply,Lieutenant,Admiral Island Navy,Gull,6,Fight The Power on Armstrong Island | The Metal on Armstrong Island | Where the Deed at on Armstrong Island | Biz Market on Armstrong Island | No Reply | No Problems on Armstrong Island,13,Baker Street on Doyle Island | Mafia Holdings on Pukru Island | The Norwood Builder on Doyle Island | Ships of Prey on Albatross Island | Falcons Bay on Albatross Island | Blazers of Glory on Admiral Island | Buckingham on Pukru Island | Fortress of Solitude on Hubble's Eye | Progress Pointe on Gallows Island | The Great White North on Cryo Island | Cannonballs Incorporated on Sayers Rock | Sew Ideal on Sayers Rock | Wicked Wench on Cryo Island,1,Graysn's Tailoring Stall on Admiral Island,6,Caddyshack on Admiral Island | The Cuckoo's Nest on Quetzal Island | Love Shack on Caravanserai Island | Cabin Fever on Admiral Island | Bedside Manors on Admiral Island | Guardians of the Gallery on Barbary Island,1,Wishfury,Obscure,Established,Illustrious,Obscure,Crafting,Piracy,Piracy,Crafting,Piracy,Crafting,Carousing,Crafting,Piracy,Carousing,Piracy,Piracy,Carousing,Piracy,Piracy,Piracy,Crafting,Carousing,Piracy,Carousing,Piracy,Crafting,Narrow,Narrow,Solid,Novice,Broad,Novice,Novice,Solid,Broad,Novice,Solid,Solid,Narrow,Illustrious,Novice,Broad,Novice,Novice,Weighty,Novice,Illustrious,Novice,Able,Distinguished,Respected,Able,Proficient,Able,Proficient,Ultimate,Distinguished,Able,Master,Grand-Master,Proficient,Legendary,Able,Proficient,Able,Able,Legendary,Proficient,Respected,Proficient
Krimz,https://emerald.puzzlepirates.com/yoweb/pirate.wm?classic=false&target=krimz,http://emerald.puzzlepirates.com/media/emerald/portraits/6b4/a762ddca10f6fc6478c65cb4f9c4c.jpg,Captain,Prisoner,Trippin Balls,Prince,Bad Trip,Admiral,Admiral Island Navy,Gull,1,Hullucination Harbor on Sayers Rock,1,Your Moist Laundry on Caravanserai Island,0,,2,Bedside Manors on Admiral Island | King Kottage on Admiral Island,0,,Rumored,Eminent,Illustrious,Aspiring,Crafting,Piracy,Piracy,Crafting,Piracy,Crafting,Carousing,Crafting,Piracy,Carousing,Piracy,Piracy,Carousing,Piracy,Piracy,Piracy,Crafting,Carousing,Piracy,Carousing,Piracy,Crafting,Novice,Solid,Solid,Apprentice,Illustrious,Novice,Novice,Solid,Illustrious,Narrow,Weighty,Solid,Expert,Narrow,Neophyte,Paragon,Weighty,Apprentice,Weighty,Neophyte,Paragon,Neophyte,Able,Ultimate,Respected,Able,Master,Able,Able,Grand-Master,Legendary,Master,Proficient,Grand-Master,Proficient,Proficient,Master,Grand-Master,Proficient,Distinguished,Grand-Master,Proficient,Respected,Able
Rickeh,https://emerald.puzzlepirates.com/yoweb/pirate.wm?classic=false&target=rickeh,http://emerald.puzzlepirates.com/media/emerald/portraits/84c/73f7ebe1fe98f0c915b0c6bd608f2.jpg,Captain,Diplomat,Moolah,Prince,Do Not Reply,Lieutenant,Admiral Island Navy,Gull,5,Peat's Oak on Isle of Kent | Scepter & Sage on Isle of Kent | The Mighty Iron Monger on Caravanserai Island | Rheinmetal on Aimuari Island | Budding Traders on Isle of Kent,7,Mean Girls HQ on Sayers Rock | When Devils Strike on Arakoua Island | Mastrology on Sayers Rock | Biggie Ballistics on Armstrong Island | Alloy Architect on Gallows Island | Grogper Army on Caravanserai Island | Arrr Balls on Sayers Rock,8,Rickeh's Ironworking Stall on Isle of Kent | Rickeh's Distilling Stall on Lincoln Island | Rickeh's Ironworking Stall on Greenwich Island | Rickeh's Ironworking Stall on Kasidim Island | Rickeh's Ironworking Stall on Lincoln Island | Rhay's Distilling Stall on Kasidim Island | Laleh's Apothecary Stall on Wensleydale | Hertez's Apothecary Stall on Wensleydale,5,Shack Macaque on Alkaid Island | Caddyshack on Admiral Island | Villa Las Vegas on Admiral Island | Caddyshack on Admiral Island | The Great Estate on Admiral Island,0,,Established,Celebrated,Eminent,Aspiring,Crafting,Piracy,Piracy,Crafting,Piracy,Crafting,Carousing,Crafting,Piracy,Carousing,Piracy,Piracy,Carousing,Piracy,Piracy,Piracy,Crafting,Carousing,Piracy,Carousing,Piracy,Crafting,Solid,Broad,Weighty,Weighty,Paragon,Expert,Neophyte,Narrow,Weighty,Broad,Illustrious,Solid,Expert,Weighty,Broad,Solid,Solid,Solid,Narrow,Apprentice,Paragon,Apprentice,Respected,Ultimate,Grand-Master,Grand-Master,Grand-Master,Distinguished,Respected,Ultimate,Respected,Master,Legendary,Legendary,Proficient,Ultimate,Respected,Respected,Proficient,Master,Ultimate,Proficient,Renowned,Distinguished
Cashier,https://emerald.puzzlepirates.com/yoweb/pirate.wm?classic=false&target=cashier,http://emerald.puzzlepirates.com/media/emerald/portraits/845/c1c43a8b2e7d482b080f7e9104a2f.jpg,Senior Officer,Ambassador,The Salty Splatoon,King,Party On Olympus,Lieutenant Commander,Doyle Island Navy,Ursa,0,,3,Magical Monkey on Alkaid Island | Negra Arroyo Lane on Alkaid Island | Salty Remedies on Sayers Rock,1,Cashier's Tailoring Stall on Admiral Island,6,Sea Shack on Scrimshaw Island | Caddyshack on Admiral Island | Milkshack on Wensleydale | Bedside Manors on Admiral Island | Tortilla Villas on Chachapoya Island | Keep Calm and Love King Kong on Alkaid Island,1,Jezerbell,Noted,Eminent,Illustrious,Renowned,Crafting,Piracy,Piracy,Crafting,Piracy,Crafting,Carousing,Crafting,Piracy,Carousing,Piracy,Piracy,Carousing,Piracy,Piracy,Piracy,Crafting,Carousing,Piracy,Carousing,Piracy,Crafting,Narrow,Weighty,Expert,Solid,Expert,Neophyte,Apprentice,Weighty,Broad,Neophyte,Solid,Weighty,Solid,Illustrious,Neophyte,Narrow,Broad,Novice,Weighty,Broad,Paragon,Weighty,Able,Proficient,Legendary,Grand-Master,Master,Able,Able,Ultimate,Proficient,Distinguished,Master,Grand-Master,Proficient,Ultimate,Proficient,Proficient,Respected,Able,Legendary,Respected,Grand-Master,Ultimate
Chefdavid,https://emerald.puzzlepirates.com/yoweb/pirate.wm?classic=false&target=chefdavid,http://emerald.puzzlepirates.com/media/emerald/portraits/77d/5cab7b2d5f3715847bc25e7fc101f.jpg,Senior Officer,Cook,Euthanasia,Prince,No Strings Attached,Petty Officer,Barbary Island Navy,Ibis,9,Hyper Balls on Barbary Island | Hall of Justice on Barbary Island | Haute Couture Cafe on Sayers Rock | Bananaman on Barbary Island | Stark Solutions on Barbary Island | Daily Plan-It on Barbary Island | Punisher Potions on Barbary Island | uballs on Barbary Island | Rum Factory on Alkaid Island,15,Skail Spice on Sayers Rock | Only Frigs on Barbary Island | Altered Reality on Kasidim Island | Calico Cut Pants on Alkaid Island | Blow My Bellows on Barbary Island | Frigate Driver on Admiral Island | Jurassic Arch on Arakoua Island | Spirited Away on Admiral Island | Laboratory on Aimuari Island | The Crystal Palace on Arakoua Island | Longneck Lager on Arakoua Island | Sword in the Stone on Admiral Island | Dirty Dyeing on Admiral Island | The Lab on Arakoua Island | Frig Off on Barbary Island,1,Katzecradle's Apothecary Stall on Greenwich Island,7,Sigil Shack on Sayers Rock | Sidekick Shacks on Barbary Island | Cabin Fever on Admiral Island | A Theatre To Watch My Movies on Sayers Rock | Caddyshack on Admiral Island | Tortilla Villas on Chachapoya Island | Guardians of the Gallery on Barbary Island,0,,Aspiring,Rumored,Established,Aspiring,Crafting,Piracy,Piracy,Crafting,Piracy,Crafting,Carousing,Crafting,Piracy,Carousing,Piracy,Piracy,Carousing,Piracy,Piracy,Piracy,Crafting,Carousing,Piracy,Carousing,Piracy,Crafting,Novice,Expert,Expert,Solid,Novice,Novice,Apprentice,Broad,Narrow,Broad,Narrow,Broad,Solid,Solid,Neophyte,Neophyte,Neophyte,Novice,Broad,Novice,Illustrious,Novice,Able,Ultimate,Proficient,Able,Able,Able,Distinguished,Able,Able,Renowned,Able,Respected,Proficient,Proficient,Respected,Able,Able,Able,Able,Able,Able,Able
Chefdavidd,https://emerald.puzzlepirates.com/yoweb/pirate.wm?classic=false&target=chefdavidd,http://emerald.puzzlepirates.com/media/emerald/portraits/9b9/b6388cbde4a0e66bf59d920425441.jpg,Senior Officer,,Friends with Benefits,Member,No Strings Attached,Stowaway,Sayers Rock Navy,Ursa,0,,0,,0,,1,Aural Shacks on Bowditch Island,0,,Aspiring,Aspiring,Obscure,Aspiring,Crafting,Piracy,Piracy,Crafting,Piracy,Crafting,Carousing,Crafting,Piracy,Carousing,Piracy,Piracy,Carousing,Piracy,Piracy,Piracy,Crafting,Carousing,Piracy,Carousing,Piracy,Crafting,Novice,Novice,Novice,Novice,Novice,Novice,Novice,Novice,Narrow,Novice,Novice,Novice,Novice,Novice,Novice,Novice,Novice,Novice,Novice,Novice,Solid,Novice,Able,Able,Able,Able,Able,Able,Able,Able,Able,Able,Able,Able,Able,Able,Able,Able,Able,Able,Able,Able,Able,Able
Danuc,https://emerald.puzzlepirates.com/yoweb/pirate.wm?classic=false&target=danuc,http://emerald.puzzlepirates.com/media/emerald/portraits/f41/bb29406d8db96509a0ca4683e09c4.jpg,Captain,Strategist,Qui Pro Quo,Princess,The Scarlet Empire,Lieutenant,Scrimshaw Island Navy,Stork,8,Steel Base on Caravanserai Island | Ah Cloth on Scrimshaw Island | Steel Base on Barbary Island | Ah Spice on Scrimshaw Island | Steel Base on Armstrong Island | Ah Ship on Scrimshaw Island | Your Moist Laundry on Caravanserai Island | Steel Base on Scrimshaw Island,0,,1,Danuc's Shipbuilding Stall on Isle of Kent,2,Black Villa Black on Scrimshaw Island | Bedside Manors on Admiral Island,1,Disruptor,Established,Illustrious,Illustrious,Aspiring,Crafting,Piracy,Piracy,Crafting,Piracy,Crafting,Carousing,Crafting,Piracy,Carousing,Piracy,Piracy,Carousing,Piracy,Piracy,Piracy,Crafting,Carousing,Piracy,Carousing,Piracy,Crafting,Novice,Weighty,Illustrious,Weighty,Paragon,Novice,Novice,Weighty,Solid,Novice,Illustrious,Illustrious,Novice,Illustrious,Broad,Solid,Expert,Novice,Broad,Novice,Illustrious,Solid,Able,Master,Legendary,Legendary,Grand-Master,Able,Able,Ultimate,Respected,Able,Grand-Master,Legendary,Able,Grand-Master,Master,Master,Grand-Master,Able,Legendary,Able,Renowned,Legendary
Danr,https://emerald.puzzlepirates.com/yoweb/pirate.wm?classic=false&target=danr,http://emerald.puzzlepirates.com/media/emerald/portraits/c99/8645780f88398e3dd3e956bfa76f0.jpg,Senior Officer,,The Mob,Lord,Late Night Hoes,Lieutenant Commander,Admiral Island Navy,Gull,0,,0,,1,Amaliie's Tailoring Stall on Lincoln Island,10,Caddyshack on Admiral Island | Shack Macaque on Alkaid Island | Pine Boxes on Aimuari Island | Shack eel Oh Kneel on Blackthorpe Island | Bedside Manors on Admiral Island | The Dove Shack on Armstrong Island | Past Tents on Greenwich Island | Bringing Town the House on Admiral Island | Villa Las Vegas on Admiral Island | Makavilli on Armstrong Island,0,,Obscure,Illustrious,Celebrated,Aspiring,Crafting,Piracy,Piracy,Crafting,Piracy,Crafting,Carousing,Crafting,Piracy,Carousing,Piracy,Piracy,Carousing,Piracy,Piracy,Piracy,Crafting,Carousing,Piracy,Carousing,Piracy,Crafting,Solid,Broad,Illustrious,Solid,Expert,Apprentice,Narrow,Weighty,Weighty,Apprentice,Solid,Solid,Solid,Illustrious,Broad,Revered,Broad,Apprentice,Weighty,Narrow,Illustrious,Solid,Distinguished,Grand-Master,Legendary,Renowned,Grand-Master,Able,Respected,Ultimate,Respected,Distinguished,Respected,Legendary,Legendary,Ultimate,Master,Ultimate,Proficient,Distinguished,Legendary,Proficient,Renowned,Legendary
