Aperion,https://emerald.puzzlepirates.com/yoweb/pirate.wm?classic=false&target=aperion,http://emerald.puzzlepirates.com/media/emerald/portraits/3fe/08bc9385f80166b16d93e0b349ea4.jpg,,,,,,Stowaway,Admiral Island Navy,Gull,0,,0,,1,Coffeebee's Shipbuilding Stall on Admiral Island,16,The Dove Shack on Armstrong Island | Shacky Doo on Hubble's Eye | Jurassic Shack on Arakoua Island | Sigil Shack on Sayers Rock | Milkshack on Wensleydale | Sidekick Shacks on Barbary Island | Shack Macaque on Alkaid Island | Homestead Hut on Lincoln Island | Sea Shack on Scrimshaw Island | Love Shack on Caravanserai Island | Pine Boxes on Aimuari Island | Munky Town on Alkaid Island | Cthulhu Mansion on Admiral Island | Sidekick Shacks on Barbary Island | Only a Manor of Time on Aimuari Island | Guardians of the Gallery on Admiral Island,13,Bigbea | Catchase | Cmdoughboy | Coaxoch | Danipop | Gafgarion | Mrflop | Mrspongebob | Mrsvastfury | Msworldnv | Paleblade | Whitesnakes | Wishfury,Noted,Eminent,Celebrated,Aspiring,Crafting,Piracy,Piracy,Crafting,Piracy,Crafting,Carousing,Crafting,Piracy,Carousing,Piracy,Piracy,Carousing,Piracy,Piracy,Piracy,Crafting,Carousing,Piracy,Carousing,Piracy,Crafting,Solid,Solid,Weighty,Solid,Broad,Novice,Apprentice,Solid,Apprentice,Solid,Neophyte,Expert,Solid,Solid,Neophyte,Neophyte,Apprentice,Narrow,Narrow,Broad,Sublime,Apprentice,Distinguished,Master,Proficient,Proficient,Proficient,Able,Proficient,Respected,Able,Grand-Master,Able,Legendary,Renowned,Proficient,Able,Able,Able,Distinguished,Able,Distinguished,Proficient,Able
Graymouser,https://emerald.puzzlepirates.com/yoweb/pirate.wm?classic=false&target=graymouser,http://emerald.puzzlepirates.com/media/emerald/portraits/2ce/71dfee1b11a760da7f4d1b86bf9c0.jpg,Senior Officer,,The Salty Splatoon,Lord,Party On Olympus,Lieutenant,Alkaid Island Navy,Ursa,0,,0,,1,Graymouser's Tailoring Stall on Pukru Island,6,Caddyshack on Admiral Island | Sigil Shack on Sayers Rock | Past Tents on Greenwich Island | Just a Bungalow on Caravanserai Island | Liana Villa on Alkaid Island | Sherlock Homes on Doyle Island,0,,Rumored,Established,Celebrated,Aspiring,Crafting,Piracy,Piracy,Crafting,Piracy,Crafting,Carousing,Crafting,Piracy,Carousing,Piracy,Piracy,Carousing,Piracy,Piracy,Piracy,Crafting,Carousing,Piracy,Carousing,Piracy,Crafting,Narrow,Paragon,Broad,Weighty,Weighty,Neophyte,Novice,Solid,Solid,Novice,Neophyte,Apprentice,Solid,Narrow,Apprentice,Expert,Solid,Novice,Narrow,Apprentice,Solid,Expert,Proficient,Renowned,Proficient,Proficient,Distinguished,Able,Distinguished,Legendary,Proficient,Distinguished,Able,Proficient,Proficient,Proficient,Proficient,Renowned,Proficient,Able,Proficient,Proficient,Distinguished,Grand-Master
Gusher,https://emerald.puzzlepirates.com/yoweb/pirate.wm?classic=false&target=gusher,http://emerald.puzzlepirates.com/media/emerald/portraits/dc7/fee0d7ab3bca586e60101075d47df.jpg,Senior Officer,First Mate,The Salty Splatoon,Member,Party On Olympus,Admiral,Admiral Island Navy,Gull,1,Ships For Days on Sayers Rock,0,,0,,4,Caddyshack on Admiral Island | Cabin Fever on Admiral Island | Bungalow Bill on Admiral Island | Keep Calm and Love King Kong on Alkaid Island,5,Alykat | Crip | Jezerbell | Mattystrong | Rojavey,Aspiring,Aspiring,Aspiring,Aspiring,Crafting,Piracy,Piracy,Crafting,Piracy,Crafting,Carousing,Crafting,Piracy,Carousing,Piracy,Piracy,Carousing,Piracy,Piracy,Piracy,Crafting,Carousing,Piracy,Carousing,Piracy,Crafting,Narrow,Narrow,Revered,Narrow,Paragon,Novice,Narrow,Solid,Weighty,Expert,Paragon,Weighty,Solid,Illustrious,Narrow,Narrow,Expert,Solid,Solid,Narrow,Illustrious,Neophyte,Able,Distinguished,Legendary,Proficient,Legendary,Able,Respected,Ultimate,Proficient,Ultimate,Legendary,Legendary,Distinguished,Ultimate,Able,Proficient,Legendary,Respected,Legendary,Proficient,Grand-Master,Able
Toastyboy,https://emerald.puzzlepirates.com/yoweb/pirate.wm?classic=false&target=toastyboy,http://emerald.puzzlepirates.com/media/emerald/portraits/7d6/d6584d5c0f5a8ec0e6db3bb5633bb.jpg,Senior Officer,First Mate,Cheers,Member,Party On Olympus,Commander,Admiral Island Navy,Gull,0,,4,Cannon Balls & Swords on Alkaid Island | Salty Balls on Sayers Rock | Negra Arroyo Lane on Alkaid Island | Salty Remedies on Sayers Rock,2,Toastyboy's Ironworking Stall on Wissahickon Island | Toastyboy's Tailoring Stall on Sayers Rock,6,Pine Boxes on Aimuari Island | Bedside Manors on Admiral Island | Bringing Town the House on Admiral Island | Bringing Town the House on Admiral Island | Only a Manor of Time on Aimuari Island | Bedside Manors on Admiral Island,1,Scap,Celebrated,Illustrious,Illustrious,Noted,Crafting,Piracy,Piracy,Crafting,Piracy,Crafting,Carousing,Crafting,Piracy,Carousing,Piracy,Piracy,Carousing,Piracy,Piracy,Piracy,Crafting,Carousing,Piracy,Carousing,Piracy,Crafting,Solid,Weighty,Sublime,Solid,Expert,Broad,Apprentice,Solid,Solid,Neophyte,Expert,Solid,Weighty,Illustrious,Narrow,Solid,Narrow,Narrow,Solid,Narrow,Illustrious,Narrow,Distinguished,Respected,Legendary,Master,Master,Proficient,Able,Legendary,Proficient,Proficient,Grand-Master,Grand-Master,Legendary,Ultimate,Respected,Proficient,Proficient,Proficient,Legendary,Proficient,Ultimate,Proficient
Ulygold,https://emerald.puzzlepirates.com/yoweb/pirate.wm?classic=false&target=ulygold,http://emerald.puzzlepirates.com/media/emerald/portraits/25f/ad56761afd6c258ee9ad609592b1a.jpg,Captain,,Panda Pirates,Prince,Party On Olympus,Lieutenant,Ix Chel Navy,Eagle,4,Snoop Forge on Armstrong Island | Big Beautiful Ball on Sayers Rock | Unstable Concoction on Sayers Rock | Stanless Steel on Armstrong Island,2,Weaving in Traffic on Sayers Rock | Cursed Cauldron on Alkaid Island,1,Ulygold's Tailoring Stall on Admiral Island,11,Aural Shacks on Bowditch Island | Caddyshack on Admiral Island | Bungalow Bill on Admiral Island | Got Your Girlfriend on Sayers Rock | Villa of the Damned on Aimuari Island | Mirror Mirror Hanging On The Wall on Sayers Rock | Krypton Kottage on Barbary Island | Sherlock Homes on Doyle Island | Bedside Manors on Admiral Island | Bedside Manors on Admiral Island | Tortilla Villas on Chachapoya Island,0,,Established,Illustrious,Illustrious,Aspiring,Crafting,Piracy,Piracy,Crafting,Piracy,Crafting,Carousing,Crafting,Piracy,Carousing,Piracy,Piracy,Carousing,Piracy,Piracy,Piracy,Crafting,Carousing,Piracy,Carousing,Piracy,Crafting,Solid,Expert,Paragon,Solid,Paragon,Neophyte,Neophyte,Solid,Weighty,Novice,Solid,Solid,Broad,Illustrious,Narrow,Weighty,Solid,Neophyte,Solid,Neophyte,Illustrious,Solid,Respected,Respected,Grand-Master,Renowned,Master,Proficient,Proficient,Distinguished,Proficient,Able,Proficient,Grand-Master,Renowned,Ultimate,Master,Respected,Distinguished,Distinguished,Proficient,Proficient,Distinguished,Respected
Xanorth,https://emerald.puzzlepirates.com/yoweb/pirate.wm?classic=false&target=xanorth,http://emerald.puzzlepirates.com/media/emerald/portraits/3cd/d3078adba9fb28997f49a65e6b401.jpg,Captain,Wildcard,Chaotic Disposition,Prince,Party On Olympus,Lieutenant Commander,Aimuari Island Navy,Orion,0,,0,,0,,3,Minute House on Greenwich Island | Cabin Fever on Admiral Island | Villa of the Damned on Aimuari Island,0,,Renowned,Eminent,Eminent,Aspiring,Crafting,Piracy,Piracy,Crafting,Piracy,Crafting,Carousing,Crafting,Piracy,Carousing,Piracy,Piracy,Carousing,Piracy,Piracy,Piracy,Crafting,Carousing,Piracy,Carousing,Piracy,Crafting,Apprentice,Solid,Solid,Narrow,Illustrious,Apprentice,Novice,Solid,Broad,Novice,Solid,Narrow,Solid,Solid,Apprentice,Narrow,Weighty,Novice,Narrow,Neophyte,Weighty,Neophyte,Able,Respected,Respected,Able,Legendary,Able,Distinguished,Legendary,Proficient,Able,Proficient,Distinguished,Distinguished,Proficient,Respected,Proficient,Distinguished,Able,Legendary,Distinguished,Master,Proficient
Dalnoth,https://emerald.puzzlepirates.com/yoweb/pirate.wm?classic=false&target=Dalnoth,http://emerald.puzzlepirates.com/media/emerald/portraits/358/84d081ed5804148db25fae7b08f32.jpg,Captain,,- Virtute et Armis -,King,Don't Open Till Doomsday,Commander,Admiral Island Navy,Gull,4,Warship's Eulogy on Aimuari Island | Blackjack Betty on Armstrong Island | Bring Out Your Thread on Aimuari Island | Bar With No Name on Barbary Island,13,Cannonballs Do Migrate on Bowditch Island | Old Shipyard on Admiral Island | Capybara Cryptyard on Aimuari Island | Dr Doom's Dyes on Barbary Island | Sink Factory on Admiral Island | Rhesus Pieces on Alkaid Island | Gucci Gang on Admiral Island | A Stitch In Time on Aimuari Island | Gun Clappers on Barbary Island | How Tee Vest Waz Won on Admiral Island | National Paint's on Admiral Island | Cool Ocean Shipyard on Arakoua Island | King's Iron on Admiral Island,0,,15,The Cuckoo's Nest on Quetzal Island | Cottagious Disease on Aimuari Island | King Kottage on Admiral Island | Eazy Street on Armstrong Island | The Cuckoo's Nest on Quetzal Island | Mayfair Mansions on Pukru Island | Mayfair Mansions on Pukru Island | Row Me Daddy on Admiral Island | Death Row on Aimuari Island | Only a Manor of Time on Aimuari Island | Villa Las Vegas on Admiral Island | Makavilli on Armstrong Island | Cthulhu Mansion on Admiral Island | The Great Estate on Admiral Island | Guardians of the Gallery on Admiral Island,0,,Rumored,Celebrated,Renowned,Aspiring,Crafting,Piracy,Piracy,Crafting,Piracy,Crafting,Carousing,Crafting,Piracy,Carousing,Piracy,Piracy,Carousing,Piracy,Piracy,Piracy,Crafting,Carousing,Piracy,Carousing,Piracy,Crafting,Narrow,Expert,Revered,Broad,Paragon,Narrow,Solid,Narrow,Expert,Solid,Illustrious,Neophyte,Sublime,Broad,Paragon,Illustrious,Weighty,Solid,Revered,Broad,Weighty,Neophyte,Proficient,Legendary,Grand-Master,Proficient,Ultimate,Proficient,Respected,Proficient,Legendary,Renowned,Grand-Master,Proficient,Distinguished,Distinguished,Ultimate,Master,Respected,Respected,Ultimate,Distinguished,Ultimate,Able
Codefish,https://emerald.puzzlepirates.com/yoweb/pirate.wm?classic=false&target=codefish,http://emerald.puzzlepirates.com/media/emerald/portraits/403/9310083f9632cc71c5bad6cd583ae.jpg,Captain,,Silver Storm,Princess,Don't Open Till Doomsday,Admiral,Sayers Rock Navy,Ursa,2,Wicked Stitch of the Vest on Sayers Rock | Cool Ocean Shipyard on Arakoua Island,9,Unicorn Blood on Aimuari Island | All Dyes On You on Admiral Island | Old Shipyard on Admiral Island | Basilisk's Fang on Aimuari Island | Sink Factory on Admiral Island | National Paint's on Admiral Island | Living Death on Aimuari Island | The Night Tables on Admiral Island | King's Iron on Admiral Island,0,,28,Sigil Shack on Sayers Rock | The Cuckoo's Nest on Quetzal Island | Jurassic Shack on Arakoua Island | Shacky Doo on Hubble's Eye | Caddyshack on Admiral Island | Pine Boxes on Aimuari Island | Homestead Hut on Lincoln Island | The Dove Shack on Armstrong Island | Love Shack on Caravanserai Island | Sidekick Shacks on Barbary Island | Stab In Cabin on Aimuari Island | King Kottage on Admiral Island | Row Me Daddy on Admiral Island | Jonestown Houses on Aimuari Island | A Jacuzzi on Sayers Rock | The Great Estate on Admiral Island | Pine Boxes on Aimuari Island | Cottagious Disease on Aimuari Island | King Kottage on Admiral Island | Bringing Town the House on Admiral Island | Only a Manor of Time on Aimuari Island | Chatham Manor on Lincoln Island | Bedside Manors on Admiral Island | Bedside Manors on Admiral Island | Villa Las Vegas on Admiral Island | Cthulhu Mansion on Admiral Island | Dead Mansion Walking on Aimuari Island | Guardians of the Gallery on Admiral Island,0,,Aspiring,Obscure,Aspiring,Aspiring,Crafting,Piracy,Piracy,Crafting,Piracy,Crafting,Carousing,Crafting,Piracy,Carousing,Piracy,Piracy,Carousing,Piracy,Piracy,Piracy,Crafting,Carousing,Piracy,Carousing,Piracy,Crafting,Illustrious,Illustrious,Revered,Weighty,Illustrious,Expert,Narrow,Sublime,Illustrious,Solid,Revered,Illustrious,Paragon,Expert,Solid,Exalted,Illustrious,Solid,Solid,Broad,Illustrious,Expert,Master,Respected,Proficient,Proficient,Proficient,Proficient,Able,Respected,Able,Legendary,Proficient,Distinguished,Grand-Master,Able,Proficient,Distinguished,Proficient,Respected,Able,Proficient,Distinguished,Distinguished
Drinkkoolaid,https://emerald.puzzlepirates.com/yoweb/pirate.wm?classic=false&target=drinkkoolaid,,Senior Officer,,- Virtute et Armis -,Princess,Don't Open Till Doomsday,Stowaway,Admiral Island Navy,Gull,0,,0,,1,Madisonbeer's Apothecary Stall on Aimuari Island,3,Caddyshack on Admiral Island | The Dove Shack on Armstrong Island | Bungalow Bill on Admiral Island,1,Bungeegum,Aspiring,Aspiring,Noted,Aspiring,Crafting,Piracy,Piracy,Crafting,Piracy,Crafting,Carousing,Crafting,Piracy,Carousing,Piracy,Piracy,Carousing,Piracy,Piracy,Piracy,Crafting,Carousing,Piracy,Carousing,Piracy,Crafting,Novice,Narrow,Apprentice,Novice,Broad,Novice,Novice,Novice,Novice,Novice,Narrow,Novice,Weighty,Novice,Novice,Apprentice,Novice,Illustrious,Weighty,Novice,Broad,Novice,Able,Able,Able,Able,Proficient,Able,Able,Able,Able,Proficient,Proficient,Able,Master,Proficient,Able,Proficient,Able,Grand-Master,Grand-Master,Proficient,Proficient,Able
Imgonnanut,https://emerald.puzzlepirates.com/yoweb/pirate.wm?classic=false&target=imgonnanut,,Fleet Officer,,Keyboard Warrior,Princess,Don't Open Till Doomsday,Sailor,Admiral Island Navy,Gull,0,,0,,0,,1,Milkshack on Wensleydale,0,,Aspiring,Aspiring,Noted,Aspiring,Crafting,Piracy,Piracy,Crafting,Piracy,Crafting,Carousing,Crafting,Piracy,Carousing,Piracy,Piracy,Carousing,Piracy,Piracy,Piracy,Crafting,Carousing,Piracy,Carousing,Piracy,Crafting,Novice,Solid,Apprentice,Novice,Broad,Novice,Novice,Apprentice,Narrow,Novice,Neophyte,Novice,Weighty,Novice,Novice,Broad,Narrow,Novice,Narrow,Novice,Novice,Novice,Able,Proficient,Able,Able,Legendary,Able,Proficient,Legendary,Legendary,Able,Proficient,Able,Proficient,Able,Proficient,Ultimate,Respected,Distinguished,Renowned,Proficient,Able,Able
Misstrix,https://emerald.puzzlepirates.com/yoweb/pirate.wm?classic=false&target=misstrix,http://emerald.puzzlepirates.com/media/emerald/portraits/b68/f32304379ad7e03de08779aa88acb.jpg,Senior Officer,,Keyboard Warrior,Princess,Don't Open Till Doomsday,Stowaway,Admiral Island Navy,Gull,0,,0,,0,,1,Aural Shacks on Bowditch Island,0,,Aspiring,Aspiring,Aspiring,Aspiring,Crafting,Piracy,Piracy,Crafting,Piracy,Crafting,Carousing,Crafting,Piracy,Carousing,Piracy,Piracy,Carousing,Piracy,Piracy,Piracy,Crafting,Carousing,Piracy,Carousing,Piracy,Crafting,Neophyte,Broad,Weighty,Novice,Novice,Novice,Novice,Solid,Apprentice,Novice,Solid,Solid,Neophyte,Neophyte,Novice,Solid,Broad,Novice,Novice,Novice,Neophyte,Novice,Able,Renowned,Proficient,Able,Able,Able,Able,Proficient,Proficient,Able,Proficient,Distinguished,Proficient,Able,Proficient,Distinguished,Proficient,Able,Proficient,Able,Able,Able
Sscc,https://emerald.puzzlepirates.com/yoweb/pirate.wm?classic=false&target=sscc,http://emerald.puzzlepirates.com/media/emerald/portraits/738/21996baf4aa953f73fa7410cff047.jpg,Captain,Cook,Bax,Prince,Don't Open Till Doomsday,Lieutenant Commander,Admiral Island Navy,Gull,7,All Dyes On You on Admiral Island | Old Shipyard on Admiral Island | Sink Factory on Admiral Island | Gucci Gang on Admiral Island | King's Chair on Admiral Island | National Paint's on Admiral Island | King's Iron on Admiral Island,2,Cool Ocean Shipyard on Arakoua Island | The Night Tables on Admiral Island,0,,11,Sea Shack on Scrimshaw Island | Love Shack on Caravanserai Island | Caddyshack on Admiral Island | Bungalow Bill on Admiral Island | King Kottage on Admiral Island | Row Me Daddy on Admiral Island | Caddyshack on Admiral Island | Bungalow Bill on Admiral Island | Row Me Daddy on Admiral Island | Villa Las Vegas on Admiral Island | The Great Estate on Admiral Island,28,Aazy | Bobswald | Cairna | Carpaccio | Daeris | Dalnoth | Eyad | Hesperus | Icefiredad | Incineration | Joshsivils | Kingofthewar | Liud | Mahsa | Mahta | Mfw | Muli | Pasteyman | Ractor | Shadowiie | Shar | Shroomy | Sidero | Tempix | Texnikos | Tswifty | Tzz | Wowriver,Aspiring,Aspiring,Aspiring,Aspiring,Crafting,Piracy,Piracy,Crafting,Piracy,Crafting,Carousing,Crafting,Piracy,Carousing,Piracy,Piracy,Carousing,Piracy,Piracy,Piracy,Crafting,Carousing,Piracy,Carousing,Piracy,Crafting,Narrow,Solid,Solid,Apprentice,Paragon,Solid,Narrow,Narrow,Solid,Novice,Solid,Broad,Illustrious,Weighty,Neophyte,Solid,Narrow,Narrow,Expert,Neophyte,Solid,Solid,Proficient,Ultimate,Respected,Able,Distinguished,Able,Respected,Able,Distinguished,Distinguished,Respected,Respected,Ultimate,Renowned,Master,Distinguished,Able,Distinguished,Legendary,Proficient,Master,Respected
Robinhoodx,https://emerald.puzzlepirates.com/yoweb/pirate.wm?classic=false&target=robinhoodx,http://emerald.puzzlepirates.com/media/emerald/portraits/12b/d77d112d0e68939997449e440fc8f.jpg,Senior Officer,,Thank You Next,King,Pull Out,Lieutenant Commander,Admiral Island Navy,Gull,5,Reef Reelators on Scrimshaw Island | Trade Winds on Scrimshaw Island | So Frigging Low on Sayers Rock | Trap House on Scrimshaw Island | Rum Punch on Admiral Island,8,Kitty City on Iocane Island | Loaded Balls on Sayers Rock | Rent Free Graveyards on Aimuari Island | Dawn of the Deed on Aimuari Island | Trap House on Sayers Rock | King's Landing on Wissahickon Island | Trance Estate on Sayers Rock | Frigged up on Iocane Island,3,Robinhoodx's Apothecary Stall on Admiral Island | Robinhoodx's Apothecary Stall on Scrimshaw Island | Robinaltx's Apothecary Stall on Admiral Island,7,The Dove Shack on Armstrong Island | Stab In Cabin on Aimuari Island | Cabin Fever on Admiral Island | Bungalow Bill on Admiral Island | Caddyshack on Admiral Island | Bringing Town the House on Admiral Island | The Great Estate on Admiral Island,0,,Aspiring,Renowned,Noted,Aspiring,Crafting,Piracy,Piracy,Crafting,Piracy,Crafting,Carousing,Crafting,Piracy,Carousing,Piracy,Piracy,Carousing,Piracy,Piracy,Piracy,Crafting,Carousing,Piracy,Carousing,Piracy,Crafting,Solid,Weighty,Broad,Apprentice,Solid,Novice,Narrow,Broad,Broad,Illustrious,Narrow,Apprentice,Revered,Solid,Apprentice,Paragon,Weighty,Expert,Expert,Weighty,Solid,Neophyte,Distinguished,Ultimate,Distinguished,Able,Master,Able,Able,Able,Grand-Master,Ultimate,Able,Respected,Ultimate,Renowned,Able,Master,Distinguished,Renowned,Legendary,Master,Proficient,Able
Bobswald,https://emerald.puzzlepirates.com/yoweb/pirate.wm?classic=false&target=bobswald,http://emerald.puzzlepirates.com/media/emerald/portraits/4cc/ed9584d3dfe5b0c1e4770abac50b7.jpg,Senior Officer,,Atlantean Explorers,Prince,Pull Out,Apprentice Sailor,Admiral Island Navy,Gull,0,,1,Labyrinth on Caravanserai Island,0,,2,Caddyshack on Admiral Island | Bringing Town the House on Admiral Island,8,Anchovia | Cairna | Dagnanlian | Iwnabeu | Joshsivils | Ltrekess | Sscc | Yassenn,Aspiring,Aspiring,Aspiring,Aspiring,Crafting,Piracy,Piracy,Crafting,Piracy,Crafting,Carousing,Crafting,Piracy,Carousing,Piracy,Piracy,Carousing,Piracy,Piracy,Piracy,Crafting,Carousing,Piracy,Carousing,Piracy,Crafting,Neophyte,Narrow,Broad,Novice,Weighty,Apprentice,Novice,Novice,Narrow,Narrow,Solid,Novice,Solid,Narrow,Novice,Solid,Novice,Apprentice,Solid,Novice,Apprentice,Novice,Proficient,Master,Master,Able,Legendary,Proficient,Able,Able,Proficient,Master,Master,Able,Grand-Master,Legendary,Proficient,Grand-Master,Able,Proficient,Renowned,Proficient,Respected,Able
Cencul,https://emerald.puzzlepirates.com/yoweb/pirate.wm?classic=false&target=cencul,http://emerald.puzzlepirates.com/media/emerald/portraits/d61/c8fb688b128907e81a951fcff2cb0.jpg,Captain,,Forward,Prince,Pull Out,Lieutenant,Admiral Island Navy,Gull,0,,3,Reef Reelators on Scrimshaw Island | The Boys on Admiral Island | Trap House on Admiral Island,1,Xii's Tailoring Stall on Pukru Island,3,Cabin Fever on Admiral Island | Bungalow Bill on Admiral Island | The Great Estate on Admiral Island,1,Xii,Aspiring,Aspiring,Aspiring,Aspiring,Crafting,Piracy,Piracy,Crafting,Piracy,Crafting,Carousing,Crafting,Piracy,Carousing,Piracy,Piracy,Carousing,Piracy,Piracy,Piracy,Crafting,Carousing,Piracy,Carousing,Piracy,Crafting,Weighty,Solid,Solid,Solid,Solid,Weighty,Broad,Narrow,Broad,Solid,Weighty,Weighty,Transcendent,Solid,Broad,Solid,Solid,Broad,Solid,Broad,Solid,Solid,Ultimate,Ultimate,Ultimate,Ultimate,Ultimate,Ultimate,Ultimate,Ultimate,Legendary,Ultimate,Ultimate,Ultimate,Ultimate,Ultimate,Ultimate,Ultimate,Legendary,Legendary,Ultimate,Ultimate,Ultimate,Ultimate
Discriminate,https://emerald.puzzlepirates.com/yoweb/pirate.wm?classic=false&target=discriminate,http://emerald.puzzlepirates.com/media/emerald/portraits/31a/43ac215798587ef44d0839c99c91e.jpg,Senior Officer,Ambassador,Thank You Next,Prince,Pull Out,Lieutenant,Admiral Island Navy,Gull,3,Sales from the Crypt on Aimuari Island | Rent Free Graveyards on Aimuari Island | Dawn of the Deed on Aimuari Island,6,So Frigging Low on Sayers Rock | Trap House on Sayers Rock | The Boys on Admiral Island | King's Landing on Wissahickon Island | Trap House on Scrimshaw Island | Trap House on Admiral Island,3,Robinhoodx's Apothecary Stall on Scrimshaw Island | Robinhoodx's Apothecary Stall on Admiral Island | Robinaltx's Apothecary Stall on Admiral Island,16,Caddyshack on Admiral Island | Shack eel Oh Kneel on Blackthorpe Island | Shack Macaque on Alkaid Island | Homestead Hut on Lincoln Island | Pine Boxes on Aimuari Island | Milkshack on Wensleydale | Cabin Fever on Admiral Island | Bringing Town the House on Admiral Island | Bedside Manors on Admiral Island | The Cuckoo's Nest on Quetzal Island | Love Shack on Caravanserai Island | Cabin Fever on Admiral Island | Bungalow Bill on Admiral Island | Bringing Town the House on Admiral Island | Bringing Town the House on Admiral Island | Villa Las Vegas on Admiral Island,0,,Aspiring,Noted,Eminent,Aspiring,Crafting,Piracy,Piracy,Crafting,Piracy,Crafting,Carousing,Crafting,Piracy,Carousing,Piracy,Piracy,Carousing,Piracy,Piracy,Piracy,Crafting,Carousing,Piracy,Carousing,Piracy,Crafting,Apprentice,Solid,Expert,Narrow,Solid,Novice,Novice,Solid,Solid,Expert,Solid,Solid,Sublime,Narrow,Neophyte,Weighty,Solid,Novice,Weighty,Neophyte,Solid,Neophyte,Proficient,Grand-Master,Grand-Master,Proficient,Proficient,Able,Proficient,Proficient,Distinguished,Ultimate,Proficient,Master,Respected,Proficient,Able,Distinguished,Proficient,Distinguished,Legendary,Proficient,Distinguished,Proficient
Joshsivils,https://emerald.puzzlepirates.com/yoweb/pirate.wm?classic=false&target=joshsivils,http://emerald.puzzlepirates.com/media/emerald/portraits/c0a/e7aef844953cab85421729b820c99.jpg,Captain,Explorer,Atlantean Explorers,Prince,Pull Out,Commander,Admiral Island Navy,Gull,3,Flea Market on Spaniel Island | Woof Over Yer Head on Spaniel Island | Scottish Parliament on Spaniel Island,1,Pirates Pantaloons on Scrimshaw Island,0,,3,Caddyshack on Admiral Island | Caddyshack on Admiral Island | Villa Las Vegas on Admiral Island,21,Accoutre | Aeri | Amaliie | Anchovia | Bobswald | Cairna | Caitman | Captnpugwash | Caramaria | Dagnanlian | Daquan | Flourish | Hellacious | Jevons | Kikkit | Kingtomy | Ltrekess | Maeven | Seepnah | Sscc | Yassenn,Rumored,Illustrious,Illustrious,Aspiring,Crafting,Piracy,Piracy,Crafting,Piracy,Crafting,Carousing,Crafting,Piracy,Carousing,Piracy,Piracy,Carousing,Piracy,Piracy,Piracy,Crafting,Carousing,Piracy,Carousing,Piracy,Crafting,Solid,Expert,Sublime,Broad,Illustrious,Narrow,Solid,Solid,Paragon,Weighty,Weighty,Novice,Illustrious,Expert,Solid,Expert,Weighty,Solid,Illustrious,Solid,Paragon,Narrow,Distinguished,Ultimate,Renowned,Able,Ultimate,Proficient,Respected,Respected,Grand-Master,Ultimate,Ultimate,Able,Distinguished,Ultimate,Legendary,Ultimate,Respected,Respected,Legendary,Respected,Ultimate,Distinguished
